number,value,datetime_start,datetime_complete,duration,params_clip_layer,params_gru_dropout,params_gru_num_layers,params_hidden_dim,params_lr,params_lr_scheduler,params_mlp_dropout,params_mlp_hidden_dim,params_optimizer_type,params_weight_decay,system_attrs_completed_rung_0,system_attrs_completed_rung_1,system_attrs_completed_rung_2,system_attrs_completed_rung_3,state
590,0.7940688775510204,2026-04-22 19:32:32.721490,2026-04-22 19:32:38.870588,0 days 00:00:06.149098,block_12,0.14654355995726387,3,512,0.00011246396935300816,constant,0.2490829707688469,1024,adamw,0.0008279816492593375,0.7940688775510204,,,,PRUNED
591,0.5464158163265306,2026-04-22 19:32:39.011647,2026-04-22 19:32:45.147591,0 days 00:00:06.135944,block_16,0.116423161004933,2,512,1.1571821130237794e-05,constant,0.02143662268355731,256,adam,0.0005476817572016321,0.5464158163265306,,,,PRUNED
592,0.8377933673469388,2026-04-22 19:32:45.289409,2026-04-22 19:32:53.673910,0 days 00:00:08.384501,pre_proj,0.29457374923299984,4,1024,0.000799886239215211,cosine,0.2657809735494595,512,adamw,0.0021340351800718045,0.8377933673469388,,,,PRUNED
593,0.6083673469387756,2026-04-22 19:32:53.845747,2026-04-22 19:34:14.456307,0 days 00:01:20.610560,block_16,0.02172467676986259,2,512,0.002473144371228096,constant,0.0017270159660658646,512,adam,0.0019345455501013865,0.6083673469387756,,,,PRUNED
594,0.948125,2026-04-22 19:34:14.592014,2026-04-22 19:36:11.580185,0 days 00:01:56.988171,block_16,0.0886558965606199,5,256,0.0008159126899375782,constant,0.35755709071532216,512,adamw,0.006255763331137514,0.9465051020408164,,,,COMPLETE
595,0.8812755102040817,2026-04-22 19:36:11.720742,2026-04-22 19:36:29.831162,0 days 00:00:18.110420,block_12,0.32487851865155337,5,1024,0.00018508163409252537,cosine,0.056983702560303245,512,adamw,0.0005457009670360466,0.8812755102040817,,,,PRUNED
596,0.8116836734693877,2026-04-22 19:36:30.030517,2026-04-22 19:36:36.076352,0 days 00:00:06.045835,block_16,0.10535352515797816,5,256,0.00015608389052545666,constant,0.36652382013026386,512,adamw,0.0039348423603508195,0.8116836734693877,,,,PRUNED
597,0.8717346938775511,2026-04-22 19:36:36.197064,2026-04-22 19:36:42.143098,0 days 00:00:05.946034,block_20,0.09535368230620657,4,256,0.00032292135121865946,cosine,0.3956366155248699,512,adamw,0.007059282950747469,0.8717346938775511,,,,PRUNED
598,0.8621556122448981,2026-04-22 19:36:42.263594,2026-04-22 19:36:48.266232,0 days 00:00:06.002638,block_12,0.38425952512391126,4,256,0.0003798725022106302,constant,0.3022046214550771,1024,adamw,0.001689853908841064,0.8621556122448981,,,,PRUNED
599,0.5,2026-04-22 19:36:48.397869,2026-04-22 19:38:48.625558,0 days 00:02:00.227689,block_20,0.26301048450786224,5,1024,0.00028382321895113044,constant,0.3363648143175957,256,adam,0.0038739810921215867,0.5,,,,PRUNED
600,0.8770153061224489,2026-04-22 19:38:48.820609,2026-04-22 19:39:00.812726,0 days 00:00:11.992117,pre_proj,0.3665152983222482,4,512,0.00018581323025999567,cosine,0.31789868838545504,512,adamw,0.005521982721377276,0.8770153061224489,,,,PRUNED
601,0.919936224489796,2026-04-22 19:39:00.954681,2026-04-22 19:39:12.792773,0 days 00:00:11.838092,block_16,0.0394080852407509,4,256,0.0011415551825023267,constant,0.3524862786049835,512,adamw,0.0045172621668518355,0.9122576530612245,0.919936224489796,,,PRUNED
602,0.8824872448979592,2026-04-22 19:39:12.924198,2026-04-22 19:39:24.676874,0 days 00:00:11.752676,pre_proj,0.3120933119454451,2,256,0.0012445727618234025,constant,0.2962936890020972,1024,adamw,0.0019052135364745527,0.8824872448979592,,,,PRUNED
603,0.9039285714285714,2026-04-22 19:39:24.822269,2026-04-22 19:39:53.789474,0 days 00:00:28.967205,block_12,0.36579951149314954,2,512,7.394571658562998e-05,constant,0.37225226966800967,256,adamw,0.0005301160323809973,0.9039285714285714,,,,PRUNED
604,0.9058545918367347,2026-04-22 19:39:53.914205,2026-04-22 19:40:05.621155,0 days 00:00:11.706950,block_16,0.3659523223651139,2,512,0.00011024191161037877,constant,0.2706529904185381,256,adamw,0.0006460642070016359,0.9058545918367347,,,,PRUNED
605,0.8924362244897959,2026-04-22 19:40:05.753580,2026-04-22 19:41:32.529176,0 days 00:01:26.775596,pre_proj,0.2601044691629551,3,1024,4.2961743571019106e-05,constant,0.05420436944081808,256,adam,0.0014517253444941598,0.8924362244897959,,,,PRUNED
606,0.9325255102040816,2026-04-22 19:41:32.692786,2026-04-22 19:42:01.862977,0 days 00:00:29.170191,block_20,0.15607876927138786,4,256,0.00033321894299688835,constant,0.3172114727136336,512,adamw,0.004040983837260228,0.9153316326530613,0.9325255102040816,,,PRUNED
607,0.890344387755102,2026-04-22 19:42:01.995655,2026-04-22 19:42:17.674090,0 days 00:00:15.678435,block_12,0.24401373456404343,4,1024,0.0003180339316486319,constant,0.3509936562826959,256,adam,0.0013888401776812665,0.890344387755102,,,,PRUNED
608,0.906109693877551,2026-04-22 19:42:17.840517,2026-04-22 19:42:29.764590,0 days 00:00:11.924073,block_16,0.10371781628224058,5,256,0.0005619188902477285,constant,0.2641942098252405,512,adamw,0.005801947526817282,0.906109693877551,,,,PRUNED
609,0.9333290816326532,2026-04-22 19:42:29.884835,2026-04-22 19:42:58.617758,0 days 00:00:28.732923,block_16,0.3328429001286263,2,256,0.00020607347947840729,constant,0.340679503385465,1024,adamw,0.0010634227857476914,0.9333290816326532,,,,PRUNED
610,0.8739030612244898,2026-04-22 19:42:58.750137,2026-04-22 19:43:27.851780,0 days 00:00:29.101643,pre_proj,0.14178025367482747,4,256,0.0024663418209871822,constant,0.3216713817552539,512,adamw,0.003288706921259852,0.8739030612244898,,,,PRUNED
611,0.9221683673469389,2026-04-22 19:43:27.988679,2026-04-22 19:43:39.856385,0 days 00:00:11.867706,block_16,0.31487576924769967,2,512,0.00040829845004529023,constant,0.2953581611475706,512,adamw,0.0005113384522294687,0.9003316326530612,0.9221683673469389,,,PRUNED
612,0.8540433673469388,2026-04-22 19:43:39.987909,2026-04-22 19:43:46.090621,0 days 00:00:06.102712,pre_proj,0.36292461986199204,2,512,0.0002621476362660634,cosine,0.34102198478763845,1024,adamw,0.0009477762715848973,0.8540433673469388,,,,PRUNED
613,0.8916071428571429,2026-04-22 19:43:46.213310,2026-04-22 19:44:23.806467,0 days 00:00:37.593157,block_12,0.283683798107616,4,1024,1.7435688319812824e-05,cosine,0.39398804198733384,256,adamw,0.0021723017903314376,0.8916071428571429,,,,PRUNED
614,0.5171301020408163,2026-04-22 19:44:23.977564,2026-04-22 19:44:35.840862,0 days 00:00:11.863298,block_16,0.29366379667828263,3,512,0.0005156235370623923,constant,0.20707362089455145,512,adam,0.007301409086443977,0.5171301020408163,,,,PRUNED
615,0.9427168367346939,2026-04-22 19:44:35.978905,2026-04-22 19:45:56.847631,0 days 00:01:20.868726,block_16,0.047742546188416744,5,256,0.0001545550625757683,constant,0.395282959560772,512,adamw,0.008524578049821764,0.9427168367346939,,,,PRUNED
616,0.3892665816326531,2026-04-22 19:45:56.979020,2026-04-22 19:46:02.996051,0 days 00:00:06.017031,block_12,0.1341948568531898,5,256,0.003744315675173715,constant,0.30887294380529534,512,adamw,0.009827642441990454,0.3892665816326531,,,,PRUNED
617,0.8854591836734694,2026-04-22 19:46:03.122263,2026-04-22 19:46:15.091024,0 days 00:00:11.968761,block_16,0.09027637139182605,3,512,7.589664093236424e-05,constant,0.25247022457793894,256,adamw,0.0005131407642987065,0.8854591836734694,,,,PRUNED
618,0.7569706632653062,2026-04-22 19:46:15.231315,2026-04-22 19:46:26.959989,0 days 00:00:11.728674,block_16,0.36019441936389135,2,512,0.0021632003582366254,constant,0.3027501673182622,256,adam,0.0027604681959931005,0.7569706632653062,,,,PRUNED
619,0.8250255102040817,2026-04-22 19:46:27.098558,2026-04-22 19:46:38.833360,0 days 00:00:11.734802,block_20,0.29238638757189306,5,256,4.2425975886961066e-05,constant,0.2901929323884971,256,adamw,0.002558217319937818,0.8250255102040817,,,,PRUNED
620,0.8143239795918369,2026-04-22 19:46:38.978349,2026-04-22 19:46:45.033177,0 days 00:00:06.054828,block_20,0.37955132887240073,2,512,0.00010423117131081091,constant,0.34339488189370615,256,adamw,0.002013321272686924,0.8143239795918369,,,,PRUNED
621,0.9185969387755102,2026-04-22 19:46:45.182045,2026-04-22 19:46:56.910953,0 days 00:00:11.728908,block_16,0.15022027278055364,2,512,0.0002777208277522978,constant,0.2567729040640794,512,adamw,0.0007855618308580092,0.8772576530612245,0.9185969387755102,,,PRUNED
622,0.7614285714285715,2026-04-22 19:46:57.043579,2026-04-22 19:47:03.251246,0 days 00:00:06.207667,block_16,0.09948947766492569,3,512,3.8511415433278664e-05,constant,0.23223708691851105,512,adamw,0.001132006985228629,0.7614285714285715,,,,PRUNED
623,0.8453443877551021,2026-04-22 19:47:03.375252,2026-04-22 19:47:09.587442,0 days 00:00:06.212190,block_12,0.3513127231239402,4,512,0.0002759622321754833,constant,0.21286247510884765,512,adamw,0.006543888963616615,0.8453443877551021,,,,PRUNED
624,0.9071428571428571,2026-04-22 19:47:09.735486,2026-04-22 19:47:21.582502,0 days 00:00:11.847016,block_20,0.28642579668242407,5,256,0.0008796990305098017,constant,0.14901242473889997,256,adam,0.0009832814611494384,0.9071428571428571,,,,PRUNED
625,0.6325063775510205,2026-04-22 19:47:21.714705,2026-04-22 19:48:42.170398,0 days 00:01:20.455693,block_16,0.11727199287961933,5,256,0.0020052317942318887,constant,0.31547784158958925,512,adamw,0.004459544253407613,0.6325063775510205,,,,PRUNED
626,0.9085969387755102,2026-04-22 19:48:42.292951,2026-04-22 19:49:12.025139,0 days 00:00:29.732188,block_12,0.08887180232669498,2,1024,0.00016322956656247159,cosine,0.012582488274159143,512,adam,0.002685688251884632,0.9085969387755102,,,,PRUNED
627,0.7982908163265305,2026-04-22 19:49:12.184984,2026-04-22 19:49:18.248712,0 days 00:00:06.063728,block_16,0.32820791951464495,4,256,0.0005264922496385847,constant,0.23168201278258257,1024,adam,0.002644974331367315,0.7982908163265305,,,,PRUNED
628,0.9014795918367347,2026-04-22 19:49:18.390221,2026-04-22 19:49:30.352170,0 days 00:00:11.961949,block_16,0.07875035068404285,5,256,0.0014389455268458936,cosine,0.3541938668686524,512,adamw,0.00501809856604591,0.9014795918367347,,,,PRUNED
629,0.7921301020408164,2026-04-22 19:49:30.495611,2026-04-22 19:49:36.688345,0 days 00:00:06.192734,block_16,0.22952651382898323,2,256,0.00016254962488972913,constant,0.3318542825174273,512,adamw,0.0011976590528492187,0.7921301020408164,,,,PRUNED
630,0.5816262755102041,2026-04-22 19:49:36.828587,2026-04-22 19:50:05.716760,0 days 00:00:28.888173,block_12,0.09187204251222802,2,512,0.0008167658386898176,cosine,0.07415763820052988,512,adam,0.004633164327497428,0.5816262755102041,,,,PRUNED
631,0.9025510204081634,2026-04-22 19:50:05.853582,2026-04-22 19:50:17.834487,0 days 00:00:11.980905,block_16,0.26224251252506914,3,512,0.0001328041759507624,constant,0.29439145381123577,256,adamw,0.0014676945644824901,0.9025510204081634,,,,PRUNED
632,0.9069770408163266,2026-04-22 19:50:18.009834,2026-04-22 19:50:29.987477,0 days 00:00:11.977643,block_16,0.19764302916455345,5,256,0.0009899818207751094,constant,0.3840412443361127,512,adamw,0.008750523308312722,0.8803826530612245,0.9069770408163266,,,PRUNED
633,0.9204719387755101,2026-04-22 19:50:30.128961,2026-04-22 19:50:41.977957,0 days 00:00:11.848996,block_20,0.0523214214910039,2,512,0.0006735258614681256,constant,0.34524985937593483,512,adamw,0.000996638188938515,0.9042984693877552,0.9204719387755101,,,PRUNED
634,0.9194770408163265,2026-04-22 19:50:42.106576,2026-04-22 19:50:53.887048,0 days 00:00:11.780472,block_16,0.07494662230531442,2,512,0.0003672770784034832,constant,0.2160430925279638,1024,adamw,0.0016435790918800394,0.9076658163265307,0.9194770408163265,,,PRUNED
635,0.40991071428571424,2026-04-22 19:50:54.036595,2026-04-22 19:51:00.252557,0 days 00:00:06.215962,block_20,0.3819887412360774,4,512,0.003680638054152966,cosine,0.35997610505364186,512,adamw,0.0009521582945693764,0.40991071428571424,,,,PRUNED
636,0.9222066326530612,2026-04-22 19:51:00.398720,2026-04-22 19:51:12.334168,0 days 00:00:11.935448,block_16,0.3345110382716624,2,512,0.00040485345868252257,cosine,0.26546015026876685,512,adamw,0.006400785267316709,0.900280612244898,0.9222066326530612,,,PRUNED
637,0.7006760204081633,2026-04-22 19:51:12.456529,2026-04-22 19:51:18.454272,0 days 00:00:05.997743,block_16,0.3956326240630398,2,256,6.32163936897965e-05,constant,0.3785426488701383,256,adamw,0.0017555109843857444,0.7006760204081633,,,,PRUNED
638,0.9495663265306122,2026-04-22 19:51:18.588862,2026-04-22 19:52:40.008504,0 days 00:01:21.419642,block_16,0.16232108242737983,3,512,0.00031991357929076836,constant,0.21331838347645704,512,adamw,0.0009134717351231093,0.8859821428571428,0.9240051020408162,0.9403188775510204,0.9495663265306122,PRUNED
639,0.7197895408163264,2026-04-22 19:52:40.157958,2026-04-22 19:52:49.991935,0 days 00:00:09.833977,block_16,0.20747876470505722,5,1024,7.509265046137216e-05,cosine,0.20312994445002241,1024,adam,0.005670269111121013,0.7197895408163264,,,,PRUNED
640,0.6905739795918368,2026-04-22 19:52:50.179982,2026-04-22 19:52:56.219163,0 days 00:00:06.039181,block_16,0.04008041603852455,3,256,4.719268153229822e-05,constant,0.20129948486504018,512,adamw,0.0014705135967431205,0.6905739795918368,,,,PRUNED
641,0.9139158163265306,2026-04-22 19:52:56.361639,2026-04-22 19:53:25.133365,0 days 00:00:28.771726,block_12,0.13584330904987635,5,256,0.0002033212476174562,cosine,0.08189116894677606,1024,adamw,0.002644576489151359,0.9139158163265306,,,,PRUNED
642,0.8007142857142857,2026-04-22 19:53:25.263037,2026-04-22 19:53:35.196784,0 days 00:00:09.933747,block_20,0.38790130373062537,5,1024,1.166745619489716e-05,constant,0.11369504013829568,512,adamw,0.009718916059716807,0.8007142857142857,,,,PRUNED
643,0.8291836734693877,2026-04-22 19:53:35.392009,2026-04-22 19:55:01.463559,0 days 00:01:26.071550,pre_proj,0.17886763289449426,3,1024,0.00044891092461250744,constant,0.23611021389833403,512,adamw,0.0012623687252448564,0.8291836734693877,,,,PRUNED
644,0.5,2026-04-22 19:55:01.624916,2026-04-22 19:55:30.663928,0 days 00:00:29.039012,block_16,0.08719871988249402,5,256,0.000600445022882413,constant,0.2739526865495421,512,adam,0.003853322416817532,0.5,,,,PRUNED
645,0.7067602040816326,2026-04-22 19:55:30.817772,2026-04-22 19:55:36.904915,0 days 00:00:06.087143,block_12,0.37846148843569477,4,256,0.0021467103745867553,cosine,0.3168519248911151,512,adamw,0.0013881990606706474,0.7067602040816326,,,,PRUNED
646,0.9338265306122449,2026-04-22 19:55:37.044473,2026-04-22 19:56:06.064085,0 days 00:00:29.019612,block_16,0.12374617491994444,2,512,0.002733299861151243,constant,0.18032494080873107,512,adamw,0.0006425304347377667,0.9147193877551021,0.9338265306122449,,,PRUNED
647,0.8742984693877551,2026-04-22 19:56:06.234390,2026-04-22 19:56:17.997195,0 days 00:00:11.762805,block_12,0.16292447346906147,2,256,0.0012499700772310564,cosine,0.09754273687314875,512,adam,0.0030181668106297192,0.8742984693877551,,,,PRUNED
648,0.8045089285714285,2026-04-22 19:56:18.117829,2026-04-22 19:56:24.149181,0 days 00:00:06.031352,block_12,0.2855940697401952,2,512,6.138295882624506e-05,constant,0.1272469066099869,512,adamw,0.0011939734324677125,0.8045089285714285,,,,PRUNED
649,0.948890306122449,2026-04-22 19:56:24.291602,2026-04-22 19:58:21.972536,0 days 00:01:57.680934,block_16,0.1406942624436628,3,512,0.0005324112864483555,constant,0.27591940669299864,512,adamw,0.0010684025578584066,0.9394005102040817,0.9509183673469388,,,COMPLETE
650,0.9106122448979592,2026-04-22 19:58:22.105025,2026-04-22 19:58:33.744659,0 days 00:00:11.639634,block_16,0.009973045205850989,4,256,0.00031944892941218,constant,0.318818257141089,1024,adamw,0.006999486204754452,0.9106122448979592,,,,PRUNED
651,0.913545918367347,2026-04-22 19:58:33.889374,2026-04-22 19:58:45.943221,0 days 00:00:12.053847,block_16,0.2058661469665194,4,512,0.0006845161940182268,constant,0.38317574873709115,512,adamw,0.0009792271898371196,0.913545918367347,,,,PRUNED
652,0.9514158163265306,2026-04-22 19:58:46.081685,2026-04-22 20:00:07.006406,0 days 00:01:20.924721,block_16,0.19313451563768197,3,512,0.00040834614824235825,constant,0.2843763690771467,512,adamw,0.0005332311781260022,0.9048852040816326,0.9300127551020408,0.9418877551020408,0.9514158163265306,PRUNED
653,0.9361224489795918,2026-04-22 20:00:07.146462,2026-04-22 20:01:34.585102,0 days 00:01:27.438640,block_12,0.15568454059386058,3,1024,7.187027229759685e-05,cosine,0.29500834795182257,256,adamw,0.009158229892657844,0.9361224489795918,,,,PRUNED
654,0.9448469387755103,2026-04-22 20:01:34.752042,2026-04-22 20:02:56.655545,0 days 00:01:21.903503,block_16,0.3657828228846106,2,1024,0.00018871536655416885,cosine,0.18731955307371412,512,adamw,0.0028546685171636503,0.934438775510204,0.9448469387755103,,,PRUNED
655,0.5829846938775509,2026-04-22 20:02:56.811084,2026-04-22 20:03:03.219174,0 days 00:00:06.408090,block_20,0.31522695712030474,2,1024,0.0028049932939237837,cosine,0.15693157631938398,512,adamw,0.0015618851310975905,0.5829846938775509,,,,PRUNED
656,0.8329336734693878,2026-04-22 20:03:03.386635,2026-04-22 20:03:09.606557,0 days 00:00:06.219922,block_16,0.3763095023454053,3,512,0.00016026238827627942,constant,0.39636349955092887,256,adamw,0.0035676562023084827,0.8329336734693878,,,,PRUNED
657,0.8288137755102041,2026-04-22 20:03:09.760281,2026-04-22 20:03:21.689726,0 days 00:00:11.929445,pre_proj,0.26982659017212807,2,512,7.53030383933887e-05,constant,0.03311349445821965,1024,adam,0.0018105354415983337,0.8288137755102041,,,,PRUNED
658,0.8488775510204082,2026-04-22 20:03:21.837458,2026-04-22 20:03:27.939783,0 days 00:00:06.102325,block_16,0.18840394950768002,5,256,0.00024400323836677742,cosine,0.29040038869572016,512,adamw,0.009815975525239322,0.8488775510204082,,,,PRUNED
659,0.9274872448979592,2026-04-22 20:03:28.067388,2026-04-22 20:03:57.468967,0 days 00:00:29.401579,block_20,0.1050716338288287,3,512,0.000695772802953513,cosine,0.08951665134368586,256,adam,0.0024583213918565614,0.9207397959183673,0.9274872448979592,,,PRUNED
660,0.8162372448979592,2026-04-22 20:03:57.605065,2026-04-22 20:04:03.845645,0 days 00:00:06.240580,block_16,0.12871481105428012,4,512,0.00013080552286945434,constant,0.19184419824817703,512,adamw,0.0026513473459725927,0.8162372448979592,,,,PRUNED
661,0.9128826530612244,2026-04-22 20:04:03.995162,2026-04-22 20:04:15.836048,0 days 00:00:11.840886,block_16,0.2810440095762858,2,512,0.0003266314604119359,constant,0.3084290951348083,1024,adamw,0.0021735169827857377,0.8865306122448979,0.9128826530612244,,,PRUNED
662,0.9491836734693877,2026-04-22 20:04:15.978344,2026-04-22 20:06:14.751055,0 days 00:01:58.772711,block_16,0.19084001120612112,2,1024,0.000349608003368259,constant,0.188041007442037,512,adamw,0.0016582742737701285,0.9333673469387755,0.9494642857142856,,,COMPLETE
663,0.8686479591836735,2026-04-22 20:06:14.884154,2026-04-22 20:06:21.303023,0 days 00:00:06.418869,block_12,0.3589411330465763,2,1024,0.0007564928047168799,constant,0.1743697905470538,512,adamw,0.0018308851960190616,0.8686479591836735,,,,PRUNED
664,0.9209566326530613,2026-04-22 20:06:21.456384,2026-04-22 20:06:33.774918,0 days 00:00:12.318534,block_16,0.2281611828357382,2,1024,0.0001850174620514544,constant,0.14820677797791848,512,adamw,0.0017911941521619287,0.8834311224489796,0.9209566326530613,,,PRUNED
665,0.7881186224489796,2026-04-22 20:06:33.917209,2026-04-22 20:06:39.966019,0 days 00:00:06.048810,block_16,0.010090712300741475,2,512,0.00031405661774826845,cosine,0.21046062874408678,512,adam,0.005788988521531646,0.7881186224489796,,,,PRUNED
666,0.9073852040816326,2026-04-22 20:06:40.101218,2026-04-22 20:06:51.967813,0 days 00:00:11.866595,block_16,0.26510453529038197,3,512,0.0008649623106047261,constant,0.2190525310108608,256,adamw,0.003842007102317907,0.8803698979591836,0.9073852040816326,,,PRUNED
667,0.7535969387755103,2026-04-22 20:06:52.102297,2026-04-22 20:06:58.535458,0 days 00:00:06.433161,block_12,0.02832941583595877,2,1024,8.820316248088623e-05,cosine,0.18568113595865673,1024,adam,0.009463255692810434,0.7535969387755103,,,,PRUNED
668,0.8965561224489796,2026-04-22 20:06:58.695684,2026-04-22 20:07:10.857114,0 days 00:00:12.161430,block_16,0.15786083690634609,2,1024,7.102201283761924e-05,constant,0.30312593752635614,512,adamw,0.0024258088199323176,0.8965561224489796,,,,PRUNED
669,0.8068494897959183,2026-04-22 20:07:11.006057,2026-04-22 20:07:17.074237,0 days 00:00:06.068180,block_12,0.3208948034415821,2,512,0.00010765390739791304,constant,0.3915543299922798,1024,adamw,0.005652741305259495,0.8068494897959183,,,,PRUNED
670,0.9134566326530612,2026-04-22 20:07:17.195681,2026-04-22 20:07:29.326949,0 days 00:00:12.131268,block_16,0.12951911010632713,2,1024,0.00030016413403393674,constant,0.264539149553211,256,adamw,0.0012008057117247738,0.899170918367347,0.9134566326530612,,,PRUNED
671,0.9319260204081633,2026-04-22 20:07:29.476755,2026-04-22 20:07:59.176852,0 days 00:00:29.700097,block_16,0.20042325685365708,2,1024,0.0005027429008683882,constant,0.2751619255812321,512,adamw,0.0009442745297212193,0.9004209183673471,0.9266581632653061,0.9319260204081633,,PRUNED
672,0.7399362244897958,2026-04-22 20:07:59.313942,2026-04-22 20:08:11.252024,0 days 00:00:11.938082,block_20,0.2693083935771742,2,512,2.221757718464435e-05,cosine,0.2338542025324137,512,adam,0.007852647008533836,0.7399362244897958,,,,PRUNED
673,0.923265306122449,2026-04-22 20:08:11.398115,2026-04-22 20:08:23.762923,0 days 00:00:12.364808,block_16,0.046618793703035954,2,1024,0.00025302661592643865,constant,0.11995133333512129,512,adamw,0.0018793548605099478,0.8796428571428572,0.923265306122449,,,PRUNED
674,0.5,2026-04-22 20:08:23.905346,2026-04-22 20:09:51.481634,0 days 00:01:27.576288,block_16,0.1506606849764243,3,1024,0.00036824001955702704,constant,0.23524710346609976,512,adam,0.0030107295132713063,0.5,,,,PRUNED
675,0.9127423469387755,2026-04-22 20:09:51.635530,2026-04-22 20:10:04.631474,0 days 00:00:12.995944,block_16,0.12613703626453288,3,1024,0.0006076817081763315,constant,0.17898892291922336,512,adamw,0.001980406710761936,0.9127423469387755,,,,PRUNED
