number,value,datetime_start,datetime_complete,duration,params_clip_layer,params_gru_dropout,params_gru_num_layers,params_hidden_dim,params_lr,params_lr_scheduler,params_mlp_dropout,params_mlp_hidden_dim,params_optimizer_type,params_weight_decay,system_attrs_completed_rung_0,system_attrs_completed_rung_1,system_attrs_completed_rung_2,system_attrs_completed_rung_3,state
168,0.7624872448979593,2026-04-22 15:59:15.058207,2026-04-22 15:59:21.241763,0 days 00:00:06.183556,block_16,0.32885926553864747,4,256,8.795813389036738e-05,constant,0.010553658908257851,512,adamw,0.001589601736843819,0.7624872448979593,,,,PRUNED
169,0.8113647959183673,2026-04-22 15:59:21.381003,2026-04-22 15:59:27.486193,0 days 00:00:06.105190,block_16,0.2589418810696866,2,256,0.0002535870943299376,constant,0.025958287093080616,512,adam,0.001240095924898202,0.8113647959183673,,,,PRUNED
170,0.8360586734693877,2026-04-22 15:59:27.615243,2026-04-22 15:59:33.914464,0 days 00:00:06.299221,block_16,0.35586535285807713,3,512,0.0001203600286227916,constant,0.046814750668292396,512,adamw,0.0005033243868248379,0.8360586734693877,,,,PRUNED
171,0.8307525510204081,2026-04-22 15:59:34.048836,2026-04-22 15:59:40.442120,0 days 00:00:06.393284,pre_proj,0.3331023369732428,2,1024,0.00011468642076098076,constant,0.15306814407891606,512,adamw,0.0017854963255025875,0.8307525510204081,,,,PRUNED
172,0.9449617346938776,2026-04-22 15:59:40.590586,2026-04-22 16:01:00.528506,0 days 00:01:19.937920,block_16,0.31093294497584506,2,512,0.00041593834105020883,constant,0.042540719590488385,512,adamw,0.00124032641556584,0.9221938775510204,0.9367984693877551,0.9449617346938776,,PRUNED
173,0.9052040816326531,2026-04-22 16:01:00.650408,2026-04-22 16:01:12.433781,0 days 00:00:11.783373,block_16,0.33936399027786984,3,512,0.00013149776166643452,constant,0.25977007668582436,1024,adamw,0.000941863665363213,0.9052040816326531,,,,PRUNED
174,0.9342857142857143,2026-04-22 16:01:12.569242,2026-04-22 16:01:41.991443,0 days 00:00:29.422201,block_16,0.2965121653209272,2,1024,0.00019580520327596132,constant,0.20073857039721715,512,adamw,0.0011523612257104759,0.9217091836734694,0.9342857142857143,,,PRUNED
175,0.9494770408163266,2026-04-22 16:01:42.122218,2026-04-22 16:03:38.078666,0 days 00:01:55.956448,block_16,0.11365784555127453,3,512,0.0002465825938634426,constant,0.2757425379756645,512,adamw,0.0010659869139516352,0.9410459183673469,0.9525255102040817,,,COMPLETE
176,0.597295918367347,2026-04-22 16:03:38.207997,2026-04-22 16:03:44.215942,0 days 00:00:06.007945,block_12,0.3405456932048964,3,512,1.1515203517857627e-05,constant,0.06544933615775403,512,adamw,0.0005953911889217503,0.597295918367347,,,,PRUNED
177,0.9467091836734693,2026-04-22 16:03:44.340444,2026-04-22 16:05:40.019275,0 days 00:01:55.678831,block_16,0.02564719635004624,3,512,0.0004167938110223217,constant,0.2768188252047256,512,adamw,0.0005964601660730347,0.9275,0.9394897959183673,0.9519770408163266,,COMPLETE
178,0.8563520408163267,2026-04-22 16:05:40.141527,2026-04-22 16:05:46.196168,0 days 00:00:06.054641,block_16,0.09477844756371906,3,512,0.00014218805855298778,constant,0.346933015240409,512,adamw,0.0013488361161365454,0.8563520408163267,,,,PRUNED
179,0.9479336734693877,2026-04-22 16:05:46.330055,2026-04-22 16:07:41.969733,0 days 00:01:55.639678,block_16,0.009569706188174123,3,512,0.0003388064798781659,constant,0.2283691938464367,512,adamw,0.0005520087326742052,0.9403571428571429,0.9490561224489796,,,COMPLETE
180,0.9185969387755103,2026-04-22 16:07:42.087315,2026-04-22 16:07:53.864207,0 days 00:00:11.776892,block_20,0.047678304938687605,4,512,0.0011548423734393835,constant,0.30270899907084686,512,adamw,0.0006331498001276262,0.8860714285714286,0.9185969387755103,,,PRUNED
181,0.5654910714285715,2026-04-22 16:07:53.994818,2026-04-22 16:08:09.309035,0 days 00:00:15.314217,block_16,0.03304348742559175,4,1024,0.0010905195695802825,constant,0.27896917195582693,512,adamw,0.0008339765691304784,0.5654910714285715,,,,PRUNED
182,0.8496811224489795,2026-04-22 16:08:09.475547,2026-04-22 16:08:15.470334,0 days 00:00:05.994787,block_16,0.09211031406356414,3,512,0.00037139027362361675,constant,0.1851434822068781,512,adam,0.0008217021013954163,0.8496811224489795,,,,PRUNED
183,0.937219387755102,2026-04-22 16:08:15.595975,2026-04-22 16:09:34.238070,0 days 00:01:18.642095,block_16,0.005341909466578636,3,256,0.00024717845522504616,constant,0.29752761521980214,512,adamw,0.0007838001652799555,0.9307525510204081,0.937219387755102,,,PRUNED
184,0.8867984693877551,2026-04-22 16:09:34.368606,2026-04-22 16:09:45.777030,0 days 00:00:11.408424,block_16,0.02608470281926068,2,512,8.429798057132108e-05,constant,0.15852516685196918,512,adamw,0.0007082987472846567,0.8867984693877551,,,,PRUNED
185,0.918329081632653,2026-04-22 16:09:45.893987,2026-04-22 16:09:57.602318,0 days 00:00:11.708331,block_16,0.02101366560120063,3,512,0.0007563979766246971,constant,0.2756622776325494,256,adamw,0.000608460876621468,0.88,0.918329081632653,,,PRUNED
186,0.9493112244897961,2026-04-22 16:09:57.735154,2026-04-22 16:11:52.661750,0 days 00:01:54.926596,block_16,0.0001670291764266866,3,512,0.0006613190264668076,constant,0.17819534516217517,512,adamw,0.0008457282357518966,0.8924234693877551,0.9255229591836734,0.9391836734693877,0.9500637755102042,COMPLETE
187,0.948469387755102,2026-04-22 16:11:52.792589,2026-04-22 16:13:11.558015,0 days 00:01:18.765426,block_16,0.038932804206285976,3,512,0.0005503348950751374,constant,0.13468147907939096,512,adamw,0.0007620005189259047,0.9255102040816326,0.9399744897959184,0.948469387755102,,PRUNED
188,0.8199107142857143,2026-04-22 16:13:11.677273,2026-04-22 16:13:17.722473,0 days 00:00:06.045200,block_16,0.036568652302687535,3,512,9.656930828147117e-05,constant,0.2753842029217806,512,adamw,0.0006147924213231232,0.8199107142857143,,,,PRUNED
189,0.6437627551020408,2026-04-22 16:13:17.850900,2026-04-22 16:13:24.073982,0 days 00:00:06.223082,block_16,0.010822109389382556,2,1024,0.0019413770021231994,constant,0.2003991087048509,512,adamw,0.0005448031701508772,0.6437627551020408,,,,PRUNED
190,0.9205931122448978,2026-04-22 16:13:24.224259,2026-04-22 16:14:43.151637,0 days 00:01:18.927378,block_16,0.008766905575570923,4,512,0.0024986863820278516,constant,0.19479782601511847,512,adamw,0.001446656036615115,0.9205931122448978,,,,PRUNED
191,0.9094132653061224,2026-04-22 16:14:43.283739,2026-04-22 16:14:54.824312,0 days 00:00:11.540573,block_16,0.23041839157612615,3,256,0.0005890289839447253,cosine,0.368181947202901,256,adamw,0.0022154010049685808,0.9094132653061224,,,,PRUNED
192,0.8580357142857142,2026-04-22 16:14:54.942119,2026-04-22 16:15:01.256386,0 days 00:00:06.314267,block_16,0.33310349445594284,2,1024,0.0008920279857713723,constant,0.033660759175281066,256,adamw,0.004287705788782224,0.8580357142857142,,,,PRUNED
193,0.8161989795918368,2026-04-22 16:15:01.394034,2026-04-22 16:15:07.515108,0 days 00:00:06.121074,block_16,0.14807882567247665,4,512,0.00010521102370941035,constant,0.10782712880993361,1024,adamw,0.001031462466999319,0.8161989795918368,,,,PRUNED
194,0.9495663265306123,2026-04-22 16:15:07.655670,2026-04-22 16:17:02.313464,0 days 00:01:54.657794,block_16,0.10989430879772873,3,512,0.00046874884908056444,constant,0.2553517143087976,512,adamw,0.0006432558216920455,0.8987244897959182,0.927984693877551,0.9418367346938776,0.9523852040816326,COMPLETE
195,0.8318367346938775,2026-04-22 16:17:02.447170,2026-04-22 16:17:08.541451,0 days 00:00:06.094281,block_16,0.29536312163638323,2,256,0.0003381526048878937,constant,0.387641294425209,256,adamw,0.004665841001936122,0.8318367346938775,,,,PRUNED
196,0.934936224489796,2026-04-22 16:17:08.674248,2026-04-22 16:17:37.724270,0 days 00:00:29.050022,block_16,0.2494516211148562,2,1024,0.00026098576601803165,constant,0.06402404641512541,512,adamw,0.0025641133543585853,0.8810459183673469,0.9237627551020408,0.934936224489796,,PRUNED
197,0.7512627551020408,2026-04-22 16:17:37.868352,2026-04-22 16:17:49.506899,0 days 00:00:11.638547,block_16,0.10212977824483103,3,512,0.0016303204517697542,constant,0.3533890893117057,512,adamw,0.0008840521121044534,0.7512627551020408,,,,PRUNED
198,0.8152295918367347,2026-04-22 16:17:49.636582,2026-04-22 16:17:55.641367,0 days 00:00:06.004785,block_16,0.3092708191577171,2,512,0.0002723649037920553,cosine,0.35656742417619014,256,adam,0.0019820813476396693,0.8152295918367347,,,,PRUNED
199,0.8620535714285714,2026-04-22 16:17:55.781820,2026-04-22 16:18:02.082797,0 days 00:00:06.300977,block_16,0.1596714609769458,4,512,0.0006470563547789194,cosine,0.22022230753815936,512,adamw,0.001425377493693624,0.8620535714285714,,,,PRUNED
200,0.918954081632653,2026-04-22 16:18:02.225730,2026-04-22 16:18:13.756135,0 days 00:00:11.530405,block_16,0.014017627793774742,3,512,0.0004425703474005023,constant,0.2621153796749201,1024,adamw,0.0007453310563407201,0.886173469387755,0.918954081632653,,,PRUNED
201,0.920280612244898,2026-04-22 16:18:13.894676,2026-04-22 16:18:25.337718,0 days 00:00:11.443042,block_16,0.36593763138713487,2,512,0.00034959904269542984,cosine,0.02112286057292998,512,adamw,0.000613302788585944,0.879579081632653,0.920280612244898,,,PRUNED
202,0.8283928571428573,2026-04-22 16:18:25.454003,2026-04-22 16:18:31.453298,0 days 00:00:05.999295,block_12,0.27068637083719077,2,512,0.0017670609488380435,cosine,0.04535556701779687,512,adamw,0.0018485060733405118,0.8283928571428573,,,,PRUNED
203,0.9397576530612244,2026-04-22 16:18:31.587048,2026-04-22 16:19:50.746301,0 days 00:01:19.159253,block_16,0.0039164474523841145,2,512,0.0009096687339058038,constant,0.26018461967935724,512,adamw,0.0010854392253759541,0.9060841836734694,0.9234311224489796,0.9375255102040817,0.9397576530612244,PRUNED
204,0.6891071428571428,2026-04-22 16:19:50.871428,2026-04-22 16:19:56.793721,0 days 00:00:05.922293,block_16,0.10875329172421111,2,512,0.0010867948922226804,cosine,0.023560015046121756,512,adam,0.005778477609103612,0.6891071428571428,,,,PRUNED
205,0.8496045918367348,2026-04-22 16:19:56.910298,2026-04-22 16:20:02.889838,0 days 00:00:05.979540,block_16,0.0768229143582205,3,512,0.001773901428783547,constant,0.2593200366572322,512,adamw,0.0005872004793014775,0.8496045918367348,,,,PRUNED
206,0.9130357142857143,2026-04-22 16:20:03.020923,2026-04-22 16:20:14.670488,0 days 00:00:11.649565,block_16,0.17856872474530128,4,512,0.0001415835983770208,constant,0.21211740715205296,512,adamw,0.0010386094034893789,0.9130357142857143,,,,PRUNED
207,0.8686352040816326,2026-04-22 16:20:14.802298,2026-04-22 16:20:20.701068,0 days 00:00:05.898770,block_16,0.23137789628667232,2,512,0.0002310454040424292,constant,0.2088172411727277,512,adamw,0.001373589373863272,0.8686352040816326,,,,PRUNED
208,0.7845153061224489,2026-04-22 16:20:20.821911,2026-04-22 16:20:26.671736,0 days 00:00:05.849825,block_16,0.1783292928623879,2,512,0.0008934990681054156,constant,0.15917685425325953,512,adam,0.003049062456491798,0.7845153061224489,,,,PRUNED
209,0.878545918367347,2026-04-22 16:20:26.805842,2026-04-22 16:20:38.271113,0 days 00:00:11.465271,pre_proj,0.016777141984481186,2,512,0.00022874963936596104,constant,0.26801384204543005,512,adamw,0.0009914654199179001,0.878545918367347,,,,PRUNED
210,0.8700637755102041,2026-04-22 16:20:38.388173,2026-04-22 16:20:44.272379,0 days 00:00:05.884206,block_16,0.3623647958702201,2,512,0.00044908192404887875,cosine,0.3561361038405496,256,adamw,0.0008803496118752173,0.8700637755102041,,,,PRUNED
211,0.947640306122449,2026-04-22 16:20:44.392158,2026-04-22 16:22:03.165825,0 days 00:01:18.773667,block_16,0.2290934473861576,2,512,0.000814377992882319,cosine,0.027209051389986208,512,adamw,0.0010301148935167148,0.8972831632653062,0.9244770408163265,0.9379081632653061,0.947640306122449,PRUNED
212,0.8181760204081633,2026-04-22 16:22:03.296030,2026-04-22 16:22:09.462915,0 days 00:00:06.166885,block_12,0.11763667716806446,4,512,0.0013708557344311182,constant,0.14022551127678853,512,adamw,0.0005895615079946414,0.8181760204081633,,,,PRUNED
213,0.8469515306122449,2026-04-22 16:22:09.593618,2026-04-22 16:22:15.459295,0 days 00:00:05.865677,pre_proj,0.26243779746797796,2,256,0.000698098915436933,cosine,0.33595135817607513,1024,adamw,0.0006075963735839144,0.8469515306122449,,,,PRUNED
214,0.9473724489795919,2026-04-22 16:22:15.575130,2026-04-22 16:24:09.278857,0 days 00:01:53.703727,block_16,0.06846175876813691,2,512,0.0004937782063092898,cosine,0.26701429126089765,512,adamw,0.0005088287894413271,0.9239668367346939,0.937984693877551,0.9488201530612245,,COMPLETE
215,0.6340561224489796,2026-04-22 16:24:09.404544,2026-04-22 16:24:15.554706,0 days 00:00:06.150162,block_16,0.32443162782104,2,512,2.949593237969016e-05,constant,0.10654787969079287,512,adam,0.0016614938508815336,0.6340561224489796,,,,PRUNED
216,0.897640306122449,2026-04-22 16:24:15.690665,2026-04-22 16:24:27.484106,0 days 00:00:11.793441,block_12,0.27782873178345013,2,512,0.0006043638316146653,cosine,0.38957905199091364,256,adamw,0.002250294532958674,0.897640306122449,,,,PRUNED
217,0.9336989795918367,2026-04-22 16:24:27.609079,2026-04-22 16:24:55.892827,0 days 00:00:28.283748,block_16,0.08216068166347179,2,256,0.0005452966769410202,cosine,0.32012125691235455,1024,adamw,0.000845078600613019,0.8847576530612246,0.9246683673469388,0.9336989795918367,,PRUNED
218,0.5272512755102041,2026-04-22 16:24:56.034122,2026-04-22 16:25:02.771694,0 days 00:00:06.737572,block_16,0.255601932311337,3,1024,0.0022500522526434133,cosine,0.39787841766113596,1024,adamw,0.000958090403136104,0.5272512755102041,,,,PRUNED
219,0.9227423469387757,2026-04-22 16:25:02.940433,2026-04-22 16:25:14.517339,0 days 00:00:11.576906,block_20,0.017827203556060302,2,512,0.0007689124250125797,cosine,0.26020870335455,512,adamw,0.0005154161993995204,0.9022704081632653,0.9227423469387757,,,PRUNED
220,0.9450765306122448,2026-04-22 16:25:14.641855,2026-04-22 16:26:34.555000,0 days 00:01:19.913145,block_16,0.024042048345567883,2,1024,0.00029872627671729505,cosine,0.09054482479992962,512,adamw,0.0007696972196771746,0.9344005102040817,0.9450765306122448,,,PRUNED
221,0.9195408163265306,2026-04-22 16:26:34.698795,2026-04-22 16:26:46.390639,0 days 00:00:11.691844,block_16,0.05364274885744893,2,512,0.002251506972612654,cosine,0.2809520839956763,512,adamw,0.0007385035417285854,0.8927423469387755,0.9195408163265306,,,PRUNED
222,0.7974744897959184,2026-04-22 16:26:46.519178,2026-04-22 16:26:52.533771,0 days 00:00:06.014593,block_16,0.13731435942610914,3,512,6.485832544519356e-05,cosine,0.25348230108798697,512,adamw,0.0007773595167886484,0.7974744897959184,,,,PRUNED
223,0.8010969387755102,2026-04-22 16:26:52.655854,2026-04-22 16:26:58.521900,0 days 00:00:05.866046,block_16,0.222777222632128,3,256,0.0020360673464915103,cosine,0.31803607035961773,1024,adam,0.0010625424534835325,0.8010969387755102,,,,PRUNED
224,0.870484693877551,2026-04-22 16:26:58.647098,2026-04-22 16:27:10.049756,0 days 00:00:11.402658,pre_proj,0.28278457070208984,2,512,0.00016134995546068282,constant,0.15919285031170427,512,adamw,0.00083900566424687,0.870484693877551,,,,PRUNED
225,0.9341964285714286,2026-04-22 16:27:10.166077,2026-04-22 16:27:38.816441,0 days 00:00:28.650364,block_16,0.07583898486183047,2,512,0.0007279557435190095,cosine,0.25154896859294684,512,adam,0.0005962980132847204,0.8955994897959183,0.9244260204081632,0.9341964285714286,,PRUNED
226,0.9220918367346939,2026-04-22 16:27:38.935100,2026-04-22 16:27:50.703081,0 days 00:00:11.767981,block_16,0.013717405818861092,4,512,0.00034015854208099193,constant,0.24277859165082635,512,adamw,0.0008923051189189223,0.9002933673469388,0.9220918367346939,,,PRUNED
227,0.8588010204081633,2026-04-22 16:27:50.829029,2026-04-22 16:27:56.836408,0 days 00:00:06.007379,block_16,0.1411833996638095,2,512,0.00019377921937444555,cosine,0.319817401494386,512,adamw,0.0005977806718173881,0.8588010204081633,,,,PRUNED
228,0.6026147959183673,2026-04-22 16:27:56.957400,2026-04-22 16:28:02.973199,0 days 00:00:06.015799,block_12,0.033895710175577076,4,256,1.9322544534540284e-05,constant,0.3216306926024954,512,adamw,0.004852119370548749,0.6026147959183673,,,,PRUNED
229,0.7909948979591837,2026-04-22 16:28:03.089567,2026-04-22 16:28:09.162861,0 days 00:00:06.073294,block_12,0.15669415434629305,2,512,0.00032731125593568833,cosine,0.1625231929928493,512,adam,0.0027502971811720796,0.7909948979591837,,,,PRUNED
230,0.5121683673469388,2026-04-22 16:28:09.288100,2026-04-22 16:28:21.286902,0 days 00:00:11.998802,block_16,0.22705891115859683,2,1024,0.0021759820960767706,constant,0.09892276722943179,512,adamw,0.0014410471920352833,0.5121683673469388,,,,PRUNED
231,0.7541836734693877,2026-04-22 16:28:21.432543,2026-04-22 16:28:32.976236,0 days 00:00:11.543693,block_16,0.33278915071417264,2,512,3.074456732240109e-05,constant,0.2947628209736033,256,adam,0.0006964276888992441,0.7541836734693877,,,,PRUNED
232,0.921530612244898,2026-04-22 16:28:33.092535,2026-04-22 16:28:44.503767,0 days 00:00:11.411232,block_20,0.23988966337345538,2,512,0.0007005187990602837,cosine,0.13129650119420083,512,adamw,0.0007168389790134243,0.9027295918367346,0.921530612244898,,,PRUNED
233,0.9480994897959184,2026-04-22 16:28:44.636371,2026-04-22 16:30:03.279451,0 days 00:01:18.643080,block_16,0.25134981564335823,2,512,0.00042056298112693293,cosine,0.3873833288313722,1024,adamw,0.001758891180213486,0.9202423469387755,0.9366709183673468,0.9480994897959184,,PRUNED
234,0.860140306122449,2026-04-22 16:30:03.425901,2026-04-22 16:30:09.468009,0 days 00:00:06.042108,block_20,0.035833642197149504,3,512,0.0001027184370479765,constant,0.21948173227972645,512,adamw,0.00060635297909287,0.860140306122449,,,,PRUNED
235,0.9360459183673469,2026-04-22 16:30:09.596297,2026-04-22 16:30:38.197613,0 days 00:00:28.601316,block_16,0.30195312090597914,2,512,0.0004302184243989418,constant,0.36009275929638856,1024,adamw,0.0006778184349624751,0.9199744897959183,0.9360459183673469,,,PRUNED
236,0.8102295918367347,2026-04-22 16:30:38.327297,2026-04-22 16:30:44.326739,0 days 00:00:05.999442,block_16,0.06034558333398038,2,512,0.00013062863183408227,cosine,0.18674084611816727,256,adamw,0.0005157536604759546,0.8102295918367347,,,,PRUNED
237,0.8358163265306122,2026-04-22 16:30:44.447044,2026-04-22 16:30:50.488630,0 days 00:00:06.041586,block_16,0.1233973597107442,3,512,0.00011757292745938146,constant,0.13471280418275622,512,adamw,0.0018958366156094574,0.8358163265306122,,,,PRUNED
238,0.7462627551020408,2026-04-22 16:30:50.606488,2026-04-22 16:30:56.475075,0 days 00:00:05.868587,block_16,0.1029569758305143,2,512,0.0014298580777667538,cosine,0.23802244516860793,512,adam,0.0028763919228135073,0.7462627551020408,,,,PRUNED
239,0.45376913265306124,2026-04-22 16:30:56.592564,2026-04-22 16:31:08.521731,0 days 00:00:11.929167,block_16,0.1332154991842939,5,512,0.0022470849743566027,constant,0.007252252901573275,512,adamw,0.002553030444364524,0.45376913265306124,,,,PRUNED
240,0.8320408163265307,2026-04-22 16:31:08.653757,2026-04-22 16:31:14.799584,0 days 00:00:06.145827,block_16,0.06498493164663424,3,512,0.00019240551304883848,cosine,0.3127574523982063,1024,adamw,0.0005566489576738094,0.8320408163265307,,,,PRUNED
241,0.8630612244897959,2026-04-22 16:31:14.926242,2026-04-22 16:31:20.905299,0 days 00:00:05.979057,block_12,0.057601353432230704,3,512,0.000538787304996856,constant,0.2634381898703083,512,adamw,0.001162276884517371,0.8630612244897959,,,,PRUNED
242,0.885765306122449,2026-04-22 16:31:21.024718,2026-04-22 16:31:32.668382,0 days 00:00:11.643664,pre_proj,0.11733194195393008,4,512,0.0005733899306497826,constant,0.38846313197404014,512,adam,0.0008484845468521648,0.885765306122449,,,,PRUNED
243,0.8758035714285713,2026-04-22 16:31:32.802062,2026-04-22 16:31:44.287235,0 days 00:00:11.485173,pre_proj,0.26817629241465657,3,512,0.0012890378661037573,constant,0.25239687101559866,512,adamw,0.0005116264943780619,0.8758035714285713,,,,PRUNED
244,0.8862244897959183,2026-04-22 16:31:44.417254,2026-04-22 16:32:12.795096,0 days 00:00:28.377842,pre_proj,0.3019508937922318,2,512,0.00025964488461600454,cosine,0.01057539260428935,512,adamw,0.0022867849386047586,0.8862244897959183,,,,PRUNED
245,0.8094260204081632,2026-04-22 16:32:12.915751,2026-04-22 16:32:19.144700,0 days 00:00:06.228949,block_16,0.3635776994764058,4,512,9.52365170418348e-05,constant,0.24554126608355653,512,adamw,0.0008868712322177347,0.8094260204081632,,,,PRUNED
246,0.824719387755102,2026-04-22 16:32:19.276772,2026-04-22 16:32:25.168785,0 days 00:00:05.892013,block_16,0.3621622551054598,2,512,0.00012183314868267268,constant,0.31419170695320014,1024,adam,0.0005242097981246419,0.824719387755102,,,,PRUNED
247,0.9488392857142857,2026-04-22 16:32:25.295586,2026-04-22 16:34:19.780191,0 days 00:01:54.484605,block_16,0.3242531858186352,3,512,0.000449868387130102,constant,0.29279943684389637,512,adamw,0.0011657936405238762,0.9041581632653061,0.9304591836734695,0.9416198979591837,0.9517729591836736,COMPLETE
248,0.7809757653061223,2026-04-22 16:34:19.915099,2026-04-22 16:34:26.188952,0 days 00:00:06.273853,block_16,0.26983504126044067,2,1024,3.490153487726448e-05,constant,0.07801326336948533,512,adam,0.0007279223292474286,0.7809757653061223,,,,PRUNED
249,0.9166964285714286,2026-04-22 16:34:26.344649,2026-04-22 16:34:37.880805,0 days 00:00:11.536156,block_16,0.31430952296387416,3,256,0.000437318050529701,constant,0.2714611295148445,512,adamw,0.0014130448818103997,0.8810204081632654,0.9166964285714286,,,PRUNED
250,0.7737244897959183,2026-04-22 16:34:37.998492,2026-04-22 16:34:44.038409,0 days 00:00:06.039917,block_16,0.11880051327862745,3,512,0.000448269017745254,cosine,0.08000980065458108,256,adam,0.005569531528075105,0.7737244897959183,,,,PRUNED
251,0.9075000000000001,2026-04-22 16:34:44.171044,2026-04-22 16:34:55.897115,0 days 00:00:11.726071,block_16,0.24078353033356006,4,512,8.624955012590203e-05,constant,0.38438049360637716,256,adamw,0.0006629792173358972,0.9075000000000001,,,,PRUNED
