number,value,datetime_start,datetime_complete,duration,params_clip_layer,params_gru_dropout,params_gru_num_layers,params_hidden_dim,params_lr,params_lr_scheduler,params_mlp_dropout,params_mlp_hidden_dim,params_optimizer_type,params_weight_decay,system_attrs_completed_rung_0,system_attrs_completed_rung_1,system_attrs_completed_rung_2,system_attrs_completed_rung_3,state
762,0.8850255102040816,2026-04-22 20:47:19.883705,2026-04-22 20:48:40.314556,0 days 00:01:20.430851,pre_proj,0.2306459843385046,2,1024,0.000567075956740184,cosine,0.04530618653301027,512,adam,0.0030002507921888855,0.8850255102040816,,,,PRUNED
763,0.9496045918367346,2026-04-22 20:48:40.471634,2026-04-22 20:50:37.486368,0 days 00:01:57.014734,block_16,0.3999121748404637,2,1024,0.0002475481331863909,constant,0.16511440227404117,256,adamw,0.0016339877684104188,0.9468749999999999,,,,COMPLETE
764,0.9227551020408163,2026-04-22 20:50:37.618311,2026-04-22 20:50:50.476111,0 days 00:00:12.857800,block_16,0.3839830694413124,3,1024,0.0003897827876977648,constant,0.10944106153491587,256,adamw,0.0012219510606763075,0.9013903061224489,0.9227551020408163,,,PRUNED
765,0.8681760204081632,2026-04-22 20:50:50.640626,2026-04-22 20:50:57.448257,0 days 00:00:06.807631,block_16,0.30471837132629354,3,1024,0.00024572938133505314,constant,0.23580590769724608,256,adamw,0.0018615042263003948,0.8681760204081632,,,,PRUNED
766,0.9224489795918368,2026-04-22 20:50:57.606737,2026-04-22 20:51:26.409582,0 days 00:00:28.802845,block_16,0.3733173801684612,2,1024,3.145094848793606e-05,constant,0.2001821594561082,256,adamw,0.004066104822721137,0.9224489795918368,,,,PRUNED
767,0.9279591836734694,2026-04-22 20:51:26.560196,2026-04-22 20:51:54.814385,0 days 00:00:28.254189,block_16,0.31904179311470515,2,256,0.0009314903634323002,constant,0.19460682656670858,256,adamw,0.002870739894769893,0.9279591836734694,,,,PRUNED
768,0.8975765306122448,2026-04-22 20:51:54.953893,2026-04-22 20:52:25.834859,0 days 00:00:30.880966,block_12,0.028107905783678583,3,1024,2.070987793560671e-05,constant,0.29489852314409803,1024,adamw,0.004120076477125404,0.8975765306122448,,,,PRUNED
769,0.7190816326530612,2026-04-22 20:52:26.005300,2026-04-22 20:52:32.216555,0 days 00:00:06.211255,block_16,0.2546213489792831,4,512,0.0002833355392712936,cosine,0.36712603591872184,1024,adam,0.006473109321183467,0.7190816326530612,,,,PRUNED
770,0.9353316326530612,2026-04-22 20:52:32.351381,2026-04-22 20:53:01.053317,0 days 00:00:28.701936,block_20,0.10984267435661649,3,512,0.0004966414862324549,cosine,0.392677304084504,512,adam,0.0026318623780303336,0.9227168367346938,0.9353316326530612,,,PRUNED
771,0.9211352040816326,2026-04-22 20:53:01.179641,2026-04-22 20:53:12.995378,0 days 00:00:11.815737,block_16,0.3642721687233391,2,512,0.0005401378397604269,constant,0.23523152289904098,512,adam,0.0007722146713142697,0.8940880102040816,0.9211352040816326,,,PRUNED
772,0.8181377551020409,2026-04-22 20:53:13.137280,2026-04-22 20:53:19.974257,0 days 00:00:06.836977,block_12,0.37303749213318715,3,1024,9.689623552231586e-05,constant,0.21519649616891756,256,adamw,0.0008364169941596073,0.8181377551020409,,,,PRUNED
773,0.8327678571428573,2026-04-22 20:53:20.122077,2026-04-22 20:53:26.500879,0 days 00:00:06.378802,pre_proj,0.13431851125255598,2,1024,0.00012023387340317991,constant,0.13701071124057843,512,adamw,0.0033063204783313352,0.8327678571428573,,,,PRUNED
774,0.8366326530612245,2026-04-22 20:53:26.657342,2026-04-22 20:53:32.698761,0 days 00:00:06.041419,pre_proj,0.036356936152348696,2,256,0.000601761338682343,cosine,0.2561460302229218,256,adam,0.001001103030914306,0.8366326530612245,,,,PRUNED
775,0.909795918367347,2026-04-22 20:53:32.822369,2026-04-22 20:53:44.977261,0 days 00:00:12.154892,block_16,0.35885436713554386,2,1024,0.0002463116467434799,constant,0.13169691862373895,256,adamw,0.0035875050847066444,0.8912372448979592,0.909795918367347,,,PRUNED
776,0.7913392857142857,2026-04-22 20:53:45.124115,2026-04-22 20:53:51.473697,0 days 00:00:06.349582,block_16,0.3144964950272303,2,1024,2.718305541512071e-05,constant,0.18904702027213824,512,adamw,0.0010627119825644378,0.7913392857142857,,,,PRUNED
777,0.8202040816326531,2026-04-22 20:53:51.607096,2026-04-22 20:53:57.712433,0 days 00:00:06.105337,block_16,0.0992624764964812,3,512,0.0002735140772416027,cosine,0.168872555283898,512,adam,0.0035049311334231685,0.8202040816326531,,,,PRUNED
778,0.9134438775510205,2026-04-22 20:53:57.841591,2026-04-22 20:54:09.983638,0 days 00:00:12.142047,block_16,0.35033109795526435,2,1024,0.0006047799033479523,constant,0.24751846739803457,256,adamw,0.0006989638780818051,0.8974872448979593,0.9134438775510205,,,PRUNED
779,0.8258290816326531,2026-04-22 20:54:10.117035,2026-04-22 20:54:16.539980,0 days 00:00:06.422945,pre_proj,0.25271734466278206,2,1024,0.00013091118118838008,constant,0.14965873467991694,256,adamw,0.0010968224899045409,0.8258290816326531,,,,PRUNED
780,0.7752551020408164,2026-04-22 20:54:16.700502,2026-04-22 20:54:23.007467,0 days 00:00:06.306965,block_20,0.04407952749072716,5,512,2.053691913776215e-05,constant,0.25804941277860294,1024,adam,0.0014165114924018735,0.7752551020408164,,,,PRUNED
781,0.9437627551020408,2026-04-22 20:54:23.154268,2026-04-22 20:55:42.696897,0 days 00:01:19.542629,block_16,0.3766864374809825,3,512,0.000500992741490031,constant,0.3489300027679887,1024,adam,0.0011747845334226037,0.9437627551020408,,,,PRUNED
782,0.5854336734693878,2026-04-22 20:55:42.844316,2026-04-22 20:55:52.368158,0 days 00:00:09.523842,block_20,0.11725618740270738,5,1024,0.0005844314876124149,cosine,0.27897666515983965,256,adam,0.0020407282815706647,0.5854336734693878,,,,PRUNED
783,0.9132780612244897,2026-04-22 20:55:52.571983,2026-04-22 20:56:04.320635,0 days 00:00:11.748652,block_16,0.054896024894228033,3,512,0.0007947603258655354,constant,0.14812932552185704,256,adamw,0.0010662509009394365,0.8895918367346939,0.9132780612244897,,,PRUNED
784,0.9103571428571429,2026-04-22 20:56:04.447818,2026-04-22 20:56:16.566148,0 days 00:00:12.118330,block_16,0.3166094815075581,2,1024,0.0004290008629644825,constant,0.1669050309085948,256,adamw,0.0014506946639087713,0.9103571428571429,,,,PRUNED
785,0.9269387755102041,2026-04-22 20:56:16.738143,2026-04-22 20:56:45.419089,0 days 00:00:28.680946,block_20,0.146734018741336,2,512,0.0011263471848654187,constant,0.23252370869170422,512,adam,0.0008198756903828013,0.9216581632653061,0.9269387755102041,,,PRUNED
786,0.9502551020408163,2026-04-22 20:56:45.570259,2026-04-22 20:58:05.169645,0 days 00:01:19.599386,block_16,0.1602529103581324,3,512,0.0006995653874715622,constant,0.1449726108709416,512,adamw,0.0009117712424955912,0.9264668367346939,0.9390561224489795,0.9502551020408163,,PRUNED
787,0.5,2026-04-22 20:58:05.300282,2026-04-22 20:58:34.127885,0 days 00:00:28.827603,block_16,0.013488975223430004,2,512,0.000905316753047812,cosine,0.08264490764827,256,adam,0.006756267993985845,0.5,,,,PRUNED
788,0.9107397959183674,2026-04-22 20:58:34.261659,2026-04-22 20:58:45.986415,0 days 00:00:11.724756,block_16,0.30677090151213426,2,512,0.00099540782817576,constant,0.3216682697823203,1024,adamw,0.0009744339584105185,0.9092346938775511,0.9107397959183674,,,PRUNED
789,0.8241326530612245,2026-04-22 20:58:46.114977,2026-04-22 20:58:52.460732,0 days 00:00:06.345755,block_16,0.39933423430604825,2,1024,8.260989613572835e-05,constant,0.16104872681782434,256,adamw,0.000986692364180008,0.8241326530612245,,,,PRUNED
790,0.6834693877551021,2026-04-22 20:58:52.621688,2026-04-22 20:58:58.592192,0 days 00:00:05.970504,pre_proj,0.08758963729234326,5,256,2.8275260606646427e-05,cosine,0.07184310713157355,256,adam,0.0031196878161635568,0.6834693877551021,,,,PRUNED
791,0.8494642857142857,2026-04-22 20:58:58.713287,2026-04-22 20:59:05.050293,0 days 00:00:06.337006,block_16,0.3588145566056308,2,1024,0.0005023124257571757,constant,0.2963809177861609,1024,adam,0.001964517845056245,0.8494642857142857,,,,PRUNED
792,0.9035586734693878,2026-04-22 20:59:05.190147,2026-04-22 20:59:16.854744,0 days 00:00:11.664597,block_20,0.033774288887254145,4,256,0.0018256126162396928,cosine,0.08757415244886833,256,adamw,0.007697166903268919,0.9020025510204082,0.9035586734693878,,,PRUNED
793,0.670031887755102,2026-04-22 20:59:16.991813,2026-04-22 20:59:26.570990,0 days 00:00:09.579177,block_16,0.27967644790944646,5,1024,1.8599247312884052e-05,constant,0.09940226212848685,256,adam,0.0053457363394768835,0.670031887755102,,,,PRUNED
794,0.5390369897959184,2026-04-22 20:59:26.767321,2026-04-22 20:59:36.309589,0 days 00:00:09.542268,block_16,0.17507909909206237,5,1024,0.0015261651631006932,cosine,0.18732485931250184,256,adamw,0.0012042494228261718,0.5390369897959184,,,,PRUNED
795,0.6084438775510205,2026-04-22 20:59:36.487242,2026-04-22 20:59:48.336748,0 days 00:00:11.849506,block_16,0.357190421965183,2,1024,0.0031355366012014445,constant,0.23918761956070725,256,adamw,0.0024120985668097017,0.6084438775510205,,,,PRUNED
796,0.9216326530612244,2026-04-22 20:59:48.470038,2026-04-22 21:00:16.914592,0 days 00:00:28.444554,block_12,0.35660962677564456,2,512,0.00012748617802264473,constant,0.23991234159139538,512,adamw,0.0006815697721990212,0.9216326530612244,,,,PRUNED
797,0.5,2026-04-22 21:00:17.047921,2026-04-22 21:00:32.559373,0 days 00:00:15.511452,block_16,0.22059979777948818,4,1024,0.0009605522741388702,cosine,0.32124860404832745,512,adam,0.006729660655527463,0.5,,,,PRUNED
798,0.8204464285714286,2026-04-22 21:00:32.725678,2026-04-22 21:00:38.875353,0 days 00:00:06.149675,block_16,0.12317977595365744,4,512,0.00013755151134640104,constant,0.29496553077379595,512,adamw,0.0006329914975447423,0.8204464285714286,,,,PRUNED
799,0.9013775510204081,2026-04-22 21:00:39.029140,2026-04-22 21:00:50.697374,0 days 00:00:11.668234,block_12,0.04374575705424087,2,256,0.000706209189087207,constant,0.28265679478963945,512,adamw,0.0010054875147259947,0.884107142857143,0.9013775510204081,,,PRUNED
800,0.9062627551020409,2026-04-22 21:00:50.819611,2026-04-22 21:01:02.598627,0 days 00:00:11.779016,block_16,0.1195071944227222,3,256,0.0002689430946553111,constant,0.1851736364208337,512,adamw,0.0011420983532780082,0.9062627551020409,,,,PRUNED
801,0.9482270408163266,2026-04-22 21:01:02.735705,2026-04-22 21:02:57.305147,0 days 00:01:54.569442,block_16,0.36228646879470244,3,512,0.0005963334094740535,constant,0.29918043101771447,512,adamw,0.0013280472517475995,0.9501020408163265,,,,COMPLETE
802,0.6224489795918366,2026-04-22 21:02:57.426989,2026-04-22 21:03:40.562524,0 days 00:00:43.135535,block_12,0.3876365095254945,5,1024,0.0028830187315426114,constant,0.37027703384552496,512,adam,0.0026150409303115616,0.6224489795918366,,,,PRUNED
803,0.8958928571428572,2026-04-22 21:03:40.737806,2026-04-22 21:03:52.837684,0 days 00:00:12.099878,block_16,0.3414687898077621,2,1024,7.954000925109597e-05,cosine,0.11842667235062201,256,adamw,0.0011660430078428575,0.8958928571428572,,,,PRUNED
804,0.9095025510204081,2026-04-22 21:03:52.984255,2026-04-22 21:04:05.021827,0 days 00:00:12.037572,block_20,0.35315900393975097,2,1024,7.471827262404817e-05,constant,0.17349381078260812,256,adamw,0.003217391338111811,0.9095025510204081,,,,PRUNED
805,0.8842857142857142,2026-04-22 21:04:05.165607,2026-04-22 21:05:26.072960,0 days 00:01:20.907353,pre_proj,0.23027388364716617,2,1024,0.0007558921057367997,constant,0.15065914472551564,512,adam,0.0010592186476129151,0.8842857142857142,,,,PRUNED
806,0.881109693877551,2026-04-22 21:05:26.222989,2026-04-22 21:05:38.283212,0 days 00:00:12.060223,block_12,0.32738810854709427,2,1024,0.0007937498248676531,constant,0.12364677863444877,256,adamw,0.001161704372513773,0.881109693877551,,,,PRUNED
807,0.8738392857142857,2026-04-22 21:05:38.434135,2026-04-22 21:05:50.050886,0 days 00:00:11.616751,pre_proj,0.1496633319418833,2,512,0.0010589687685893428,constant,0.04348473142433894,512,adam,0.0033780970680817026,0.8738392857142857,,,,PRUNED
808,0.5,2026-04-22 21:05:50.172189,2026-04-22 21:06:18.457795,0 days 00:00:28.285606,block_16,0.0948452598766404,2,512,0.0014579251420494242,constant,0.06559634605839813,1024,adam,0.005378599262463556,0.5,,,,PRUNED
809,0.9410459183673469,2026-04-22 21:06:18.597928,2026-04-22 21:07:38.552472,0 days 00:01:19.954544,block_16,0.013847305162055599,4,512,0.0009266113817631321,constant,0.1380494896713148,512,adamw,0.0005649754919276004,0.9195153061224489,0.9422704081632652,0.9410459183673469,,PRUNED
810,0.7443494897959184,2026-04-22 21:07:38.686311,2026-04-22 21:07:44.882306,0 days 00:00:06.195995,block_16,0.15156071306718222,4,512,0.0010248794240491157,constant,0.099943134588266,512,adam,0.0006286245520914456,0.7443494897959184,,,,PRUNED
811,0.9060586734693877,2026-04-22 21:07:45.024336,2026-04-22 21:09:05.862919,0 days 00:01:20.838583,block_12,0.26385318930662083,2,1024,6.519608279150717e-05,constant,0.396438299515892,512,adam,0.00584310454749621,0.9060586734693877,,,,PRUNED
812,0.7518367346938775,2026-04-22 21:09:06.026738,2026-04-22 21:09:12.029571,0 days 00:00:06.002833,block_16,0.3808196274122797,3,256,7.182649949078399e-05,constant,0.16010112567065848,256,adamw,0.0021264395568084413,0.7518367346938775,,,,PRUNED
813,0.9186224489795919,2026-04-22 21:09:12.157724,2026-04-22 21:09:23.859396,0 days 00:00:11.701672,block_16,0.26538131904073126,2,512,0.00032761657133748923,constant,0.29372390294884737,512,adamw,0.0012176250085945155,0.8801020408163265,0.9186224489795919,,,PRUNED
814,0.8424617346938775,2026-04-22 21:09:23.989556,2026-04-22 21:09:30.323199,0 days 00:00:06.333643,pre_proj,0.2763270769887716,2,1024,0.001062796434253166,constant,0.1112037376917421,512,adamw,0.001532106070041026,0.8424617346938775,,,,PRUNED
815,0.9139285714285714,2026-04-22 21:09:30.464955,2026-04-22 21:09:42.152978,0 days 00:00:11.688023,block_16,0.35886396180137625,2,512,0.0015105785420031466,constant,0.3935294901597107,1024,adamw,0.0005305469210729888,0.8850382653061225,0.9139285714285714,,,PRUNED
816,0.9052423469387756,2026-04-22 21:09:42.284739,2026-04-22 21:09:54.274838,0 days 00:00:11.990099,block_16,0.3694243484658456,2,1024,6.839607571768198e-05,constant,0.3105873499788029,1024,adamw,0.004820449447652327,0.9052423469387756,,,,PRUNED
817,0.9117729591836735,2026-04-22 21:09:54.420296,2026-04-22 21:10:06.093826,0 days 00:00:11.673530,block_20,0.13673597621497532,2,512,0.00022032873908550338,cosine,0.07721686431874993,1024,adam,0.0017881821744515755,0.9117729591836735,,,,PRUNED
818,0.8936224489795919,2026-04-22 21:10:06.215143,2026-04-22 21:11:31.779827,0 days 00:01:25.564684,pre_proj,0.27912161717365364,3,1024,0.00031167389243477,cosine,0.13346038674171934,256,adam,0.008375077021732126,0.8936224489795919,,,,PRUNED
819,0.5,2026-04-22 21:11:31.936314,2026-04-22 21:11:44.806895,0 days 00:00:12.870581,block_20,0.319022490852227,3,1024,0.0007260030196684942,cosine,0.24906837857052244,1024,adam,0.008908444367282544,0.5,,,,PRUNED
820,0.9264540816326531,2026-04-22 21:11:44.968522,2026-04-22 21:12:13.523575,0 days 00:00:28.555053,block_16,0.38414385772538745,2,512,9.810108404083676e-05,cosine,0.38778681890667954,256,adamw,0.0021546511565235485,0.9264540816326531,,,,PRUNED
821,0.4667410714285714,2026-04-22 21:12:13.645533,2026-04-22 21:12:20.430473,0 days 00:00:06.784940,block_16,0.03823972152659619,3,1024,0.0029925594430978497,cosine,0.016250732908429488,512,adam,0.0008477781928569789,0.4667410714285714,,,,PRUNED
822,0.722908163265306,2026-04-22 21:12:20.585234,2026-04-22 21:12:26.675852,0 days 00:00:06.090618,block_16,0.29150506034221646,3,256,0.004626486001479065,cosine,0.19908840963782573,256,adamw,0.009533607661780725,0.722908163265306,,,,PRUNED
823,0.934936224489796,2026-04-22 21:12:26.801716,2026-04-22 21:12:55.326643,0 days 00:00:28.524927,block_16,0.3439912462086103,2,512,0.0005824140011142378,constant,0.26290955522131937,256,adamw,0.004508992163729138,0.8878316326530612,0.9236224489795918,0.934936224489796,,PRUNED
824,0.8224999999999999,2026-04-22 21:12:55.469849,2026-04-22 21:13:07.722235,0 days 00:00:12.252386,block_20,0.13849484638013712,5,512,5.497973804071008e-05,cosine,0.21502964535209354,256,adam,0.001367203403594199,0.8224999999999999,,,,PRUNED
825,0.9181505102040817,2026-04-22 21:13:07.875307,2026-04-22 21:13:23.393246,0 days 00:00:15.517939,block_20,0.09083553445902702,4,1024,0.0001939675181907455,constant,0.2332122883022368,256,adam,0.0007802256131138369,0.8962117346938776,0.9181505102040817,,,PRUNED
826,0.8715688775510204,2026-04-22 21:13:23.566931,2026-04-22 21:13:29.648205,0 days 00:00:06.081274,block_12,0.12051973997550187,4,512,0.000482150301450666,cosine,0.07506551974812654,1024,adamw,0.0005711101573130913,0.8715688775510204,,,,PRUNED
827,0.9481632653061225,2026-04-22 21:13:29.787736,2026-04-22 21:15:25.744159,0 days 00:01:55.956423,block_16,0.2078997144460303,4,512,0.00024654687630632204,constant,0.20959182075506502,512,adamw,0.0006001723233463351,0.9463265306122449,,,,COMPLETE
828,0.921875,2026-04-22 21:15:25.866433,2026-04-22 21:15:37.465490,0 days 00:00:11.599057,block_16,0.26673292969159157,2,512,0.0010044134693443093,constant,0.23521360910669853,512,adamw,0.0010448611072687503,0.9041198979591837,0.921875,,,PRUNED
829,0.8821045918367347,2026-04-22 21:15:37.603728,2026-04-22 21:15:48.994907,0 days 00:00:11.391179,pre_proj,0.34273086651853474,2,512,0.0007071838844832756,constant,0.2022646505989363,256,adamw,0.0015717435383287193,0.8821045918367347,,,,PRUNED
830,0.8529591836734695,2026-04-22 21:15:49.123118,2026-04-22 21:16:00.842962,0 days 00:00:11.719844,block_16,0.03326384688277552,2,512,0.0022647313478962082,cosine,0.1405390585962436,512,adamw,0.005771841072928589,0.8529591836734695,,,,PRUNED
831,0.615733418367347,2026-04-22 21:16:00.965431,2026-04-22 21:16:07.124362,0 days 00:00:06.158931,block_16,0.001109258836933219,4,512,1.8610551909974573e-05,cosine,0.08396517459846937,1024,adam,0.002016513270873563,0.615733418367347,,,,PRUNED
832,0.9462627551020408,2026-04-22 21:16:07.258910,2026-04-22 21:17:26.644479,0 days 00:01:19.385569,block_16,0.28591806215289833,2,512,0.00019633841063892182,constant,0.34963568572628895,256,adamw,0.008306892410865154,0.9336607142857143,0.9462627551020408,,,PRUNED
833,0.9343239795918368,2026-04-22 21:17:26.775143,2026-04-22 21:18:46.405180,0 days 00:01:19.630037,block_20,0.17968091678452927,3,512,0.0020434025118797544,constant,0.19426082809193754,512,adamw,0.0005495721290088427,0.9389030612244899,0.9343239795918368,,,PRUNED
834,0.8322066326530614,2026-04-22 21:18:46.540006,2026-04-22 21:18:52.658464,0 days 00:00:06.118458,block_16,0.20523769776614542,2,512,0.0002951910748673496,constant,0.17423435968811452,512,adam,0.0011838928643794022,0.8322066326530614,,,,PRUNED
835,0.5,2026-04-22 21:18:52.797304,2026-04-22 21:19:02.438606,0 days 00:00:09.641302,block_20,0.3791435362784311,5,1024,0.0017522606953260826,constant,0.1307706117967025,512,adam,0.006967165637914318,0.5,,,,PRUNED
836,0.789655612244898,2026-04-22 21:19:02.612672,2026-04-22 21:19:08.994235,0 days 00:00:06.381563,block_12,0.38845315917828827,2,1024,0.00012861798778272593,constant,0.1851684046205645,256,adam,0.0061808879975906485,0.789655612244898,,,,PRUNED
837,0.8727933673469388,2026-04-22 21:19:09.139637,2026-04-22 21:19:20.852548,0 days 00:00:11.712911,block_20,0.29829842992195593,2,512,0.0030030834989853983,cosine,0.023615380826631754,512,adam,0.0015793634060614922,0.8848214285714285,0.8727933673469388,,,PRUNED
838,0.7906058673469387,2026-04-22 21:19:20.974313,2026-04-22 21:19:27.022923,0 days 00:00:06.048610,block_12,0.3797525302389983,4,256,0.0004556418382033573,cosine,0.28758737511608945,1024,adam,0.00188187406377831,0.7906058673469387,,,,PRUNED
839,0.8899107142857143,2026-04-22 21:19:27.144754,2026-04-22 21:19:55.753360,0 days 00:00:28.608606,pre_proj,0.2835976282064949,2,512,0.00028596891630796575,constant,0.33062512316803605,1024,adamw,0.0009469526748814406,0.8899107142857143,,,,PRUNED
840,0.9500127551020408,2026-04-22 21:19:55.886479,2026-04-22 21:21:50.466253,0 days 00:01:54.579774,block_16,0.09507671490881979,2,512,0.0012680361153204638,cosine,0.15817938173064652,512,adam,0.0021302409649280817,0.9511096938775511,,,,COMPLETE
841,0.7856186224489795,2026-04-22 21:21:50.594082,2026-04-22 21:22:02.295847,0 days 00:00:11.701765,block_12,0.38747466372598294,5,256,6.241123506770096e-05,constant,0.29052302840562494,256,adam,0.0028248500512869225,0.7856186224489795,,,,PRUNED
842,0.7406632653061225,2026-04-22 21:22:02.432696,2026-04-22 21:22:31.491649,0 days 00:00:29.058953,block_12,0.04068010748675549,2,1024,0.0016450224150262413,constant,0.12102099871675466,256,adamw,0.004881519886101121,0.7406632653061225,,,,PRUNED
843,0.6223086734693878,2026-04-22 21:22:31.633373,2026-04-22 21:22:37.992799,0 days 00:00:06.359426,block_20,0.07383964439534027,2,1024,2.030100351424145e-05,cosine,0.10951868667380343,512,adam,0.006669349040715712,0.6223086734693878,,,,PRUNED
844,0.5,2026-04-22 21:22:38.146801,2026-04-22 21:22:44.112088,0 days 00:00:05.965287,block_16,0.08763637056014317,4,256,0.0024923587638506104,cosine,0.05043722785370852,1024,adam,0.006872273890384255,0.5,,,,PRUNED
845,0.7936607142857143,2026-04-22 21:22:44.256627,2026-04-22 21:22:50.178035,0 days 00:00:05.921408,block_16,0.18132013208729938,2,256,0.0007132748419788235,cosine,0.03730344834258426,256,adam,0.0027237144985874846,0.7936607142857143,,,,PRUNED
846,0.719515306122449,2026-04-22 21:22:50.306170,2026-04-22 21:22:56.197631,0 days 00:00:05.891461,block_20,0.06011718316693382,2,256,3.111104105196055e-05,constant,0.026997324814233253,512,adamw,0.00907980639704741,0.719515306122449,,,,PRUNED
847,0.7745408163265306,2026-04-22 21:22:56.335204,2026-04-22 21:23:02.306212,0 days 00:00:05.971008,pre_proj,0.39870585641967554,3,256,0.0003875852701795178,constant,0.27978575709447795,256,adam,0.005555472937711361,0.7745408163265306,,,,PRUNED
848,0.5,2026-04-22 21:23:02.437779,2026-04-22 21:23:31.102644,0 days 00:00:28.664865,block_16,0.13449210030707084,4,512,0.0035396202572608977,cosine,0.03626135284912716,512,adam,0.005776720977851573,0.5,,,,PRUNED
