number,value,datetime_start,datetime_complete,duration,params_clip_layer,params_gru_dropout,params_gru_num_layers,params_hidden_dim,params_lr,params_lr_scheduler,params_mlp_dropout,params_mlp_hidden_dim,params_optimizer_type,params_weight_decay,system_attrs_completed_rung_0,system_attrs_completed_rung_1,system_attrs_completed_rung_2,system_attrs_completed_rung_3,state
849,0.9288392857142858,2026-04-22 21:23:31.237175,2026-04-22 21:24:02.148869,0 days 00:00:30.911694,block_16,0.08395994488354716,3,1024,0.00027934843797963553,constant,0.10453466974608253,512,adamw,0.0005243164854088428,0.9145663265306123,0.9288392857142858,,,PRUNED
