number,value,datetime_start,datetime_complete,duration,params_clip_layer,params_lr,params_lr_scheduler,params_mlp_dropout,params_mlp_hidden_dim,params_optimizer_type,params_warmup_epochs,state
487,0.8842729591836735,2026-04-21 15:24:12.582455,2026-04-21 15:24:29.850535,0 days 00:00:17.268080,block_16,0.09333115825502256,constant,0.37734230157421034,512,adamw,,PRUNED
488,0.8101913265306122,2026-04-21 15:24:30.000265,2026-04-21 15:24:47.325767,0 days 00:00:17.325502,pre_proj,0.030485090626848416,constant,0.3148559803011568,2048,adamw,,PRUNED
489,0.9018239795918368,2026-04-21 15:24:47.483661,2026-04-21 15:25:04.650170,0 days 00:00:17.166509,block_16,0.015952607221992585,constant,0.3007951616397699,1024,adamw,,PRUNED
490,0.9143494897959183,2026-04-21 15:25:04.800680,2026-04-21 15:25:27.564742,0 days 00:00:22.764062,block_16,0.009345705326224175,constant,0.22393574124970356,2048,adamw,,PRUNED
491,0.9026147959183672,2026-04-21 15:25:27.735559,2026-04-21 15:25:44.904127,0 days 00:00:17.168568,block_16,0.06293659731856525,constant,0.19505658666823228,1024,adamw,,PRUNED
492,0.908201530612245,2026-04-21 15:25:45.069435,2026-04-21 15:26:02.251136,0 days 00:00:17.181701,block_16,0.010973648377703291,constant,0.14427897604395323,1024,adamw,,PRUNED
493,0.9071428571428573,2026-04-21 15:26:02.379324,2026-04-21 15:26:19.475682,0 days 00:00:17.096358,block_16,0.028975743355161614,constant,0.29112042775213265,2048,adamw,,PRUNED
494,0.9186989795918368,2026-04-21 15:26:19.633975,2026-04-21 15:26:45.258406,0 days 00:00:25.624431,block_16,0.01152633794993621,constant,0.17841680503314097,2048,adamw,,PRUNED
495,0.8569260204081632,2026-04-21 15:26:45.426780,2026-04-21 15:27:02.599361,0 days 00:00:17.172581,block_20,0.012318152449904795,cosine_warmup,0.018286010833917538,1024,adamw,10.0,PRUNED
496,0.8987882653061225,2026-04-21 15:27:02.746144,2026-04-21 15:27:19.739075,0 days 00:00:16.992931,block_16,0.02597666073518977,constant,0.24990268621308448,1024,adamw,,PRUNED
497,0.9146811224489796,2026-04-21 15:27:19.912535,2026-04-21 15:27:42.675831,0 days 00:00:22.763296,block_16,0.013081298192313653,constant,0.37865816634878297,2048,adamw,,PRUNED
498,0.9149362244897958,2026-04-21 15:27:42.828188,2026-04-21 15:28:08.449696,0 days 00:00:25.621508,block_16,0.05366074783308269,constant,0.187029623681594,2048,adamw,,PRUNED
499,0.833188775510204,2026-04-21 15:28:08.610524,2026-04-21 15:28:25.808695,0 days 00:00:17.198171,block_12,0.08560557848651497,constant,0.23013366944648614,512,adamw,,PRUNED
500,0.909158163265306,2026-04-21 15:28:25.960781,2026-04-21 15:28:43.132650,0 days 00:00:17.171869,block_16,0.02142885993878182,constant,0.19040576124150754,2048,adamw,,PRUNED
501,0.8800510204081632,2026-04-21 15:28:43.303114,2026-04-21 15:29:00.486276,0 days 00:00:17.183162,block_20,0.05727453064148907,cosine_warmup,0.03674441636215389,512,adamw,6.0,PRUNED
