number,value,datetime_start,datetime_complete,duration,params_clip_layer,params_lr,params_lr_scheduler,params_mlp_dropout,params_mlp_hidden_dim,params_optimizer_type,params_warmup_epochs,state
365,0.9076913265306122,2026-04-21 14:39:12.949842,2026-04-21 14:39:30.313009,0 days 00:00:17.363167,block_16,0.021120189273297754,constant,0.19952412018302232,2048,adamw,,PRUNED
366,0.9075892857142858,2026-04-21 14:39:30.451885,2026-04-21 14:39:47.850074,0 days 00:00:17.398189,block_16,0.01717603563598178,constant,0.3171969128113143,2048,adamw,,PRUNED
367,0.9138647959183673,2026-04-21 14:39:48.011521,2026-04-21 14:40:11.176360,0 days 00:00:23.164839,block_16,0.008590442159156214,constant,0.18472308814175403,2048,adamw,,PRUNED
368,0.8836096938775511,2026-04-21 14:40:11.338413,2026-04-21 14:40:28.688451,0 days 00:00:17.350038,block_12,0.010638505082667641,constant,0.23887634155081697,1024,adamw,,PRUNED
369,0.9070153061224491,2026-04-21 14:40:28.826882,2026-04-21 14:40:46.262659,0 days 00:00:17.435777,block_16,0.02853375243548819,constant,0.31279535895572186,2048,adamw,,PRUNED
370,0.8814158163265307,2026-04-21 14:40:46.417465,2026-04-21 14:41:03.777531,0 days 00:00:17.360066,block_20,0.010982648257687985,constant,0.2813837669827138,2048,adamw,,PRUNED
371,0.881517857142857,2026-04-21 14:41:03.921536,2026-04-21 14:41:21.317685,0 days 00:00:17.396149,block_20,0.011320421692547107,constant,0.1943191098584877,2048,adamw,,PRUNED
372,0.9123469387755103,2026-04-21 14:41:21.471761,2026-04-21 14:41:44.477649,0 days 00:00:23.005888,block_16,0.009582188014762974,constant,0.2698901931537204,2048,adamw,,PRUNED
373,0.8955994897959183,2026-04-21 14:41:44.619197,2026-04-21 14:42:02.100917,0 days 00:00:17.481720,block_16,0.011030910914581757,cosine_warmup,0.027143521210889504,1024,adamw,9.0,PRUNED
374,0.8217219387755103,2026-04-21 14:42:02.234751,2026-04-21 14:42:19.651194,0 days 00:00:17.416443,pre_proj,0.005585344786734271,constant,0.06771798851847188,2048,adamw,,PRUNED
375,0.9185841836734694,2026-04-21 14:42:19.814668,2026-04-21 14:42:45.698674,0 days 00:00:25.884006,block_16,0.016793633826949563,constant,0.11301632307795138,2048,adamw,,PRUNED
376,0.9054591836734693,2026-04-21 14:42:45.851800,2026-04-21 14:43:03.151940,0 days 00:00:17.300140,block_16,0.03496862851038983,constant,0.15184113955067263,1024,adamw,,PRUNED
377,0.9258545918367347,2026-04-21 14:43:03.285790,2026-04-21 14:43:54.965614,0 days 00:00:51.679824,block_16,0.01641604592430216,constant,0.18350081386064554,2048,adamw,,PRUNED
378,0.8603316326530613,2026-04-21 14:43:55.107263,2026-04-21 14:44:12.500102,0 days 00:00:17.392839,block_20,0.008371202333739343,cosine_warmup,0.29415165995847325,512,adamw,6.0,PRUNED
379,0.889298469387755,2026-04-21 14:44:12.644668,2026-04-21 14:44:29.983970,0 days 00:00:17.339302,block_12,0.011537492668485003,constant,0.2163983411170603,2048,adamw,,PRUNED
380,0.811875,2026-04-21 14:44:30.139942,2026-04-21 14:44:47.541428,0 days 00:00:17.401486,pre_proj,0.0364975194456847,constant,0.07644907424153813,1024,adamw,,PRUNED
381,0.9084311224489796,2026-04-21 14:44:47.685588,2026-04-21 14:45:05.109429,0 days 00:00:17.423841,block_16,0.00708973963020266,constant,0.18278367700698722,1024,adamw,,PRUNED
382,0.9046811224489796,2026-04-21 14:45:05.235339,2026-04-21 14:45:22.592688,0 days 00:00:17.357349,block_16,0.03758592485262417,constant,0.15944315303673912,2048,adamw,,PRUNED
383,0.9171938775510204,2026-04-21 14:45:22.738261,2026-04-21 14:45:48.908068,0 days 00:00:26.169807,block_16,0.013393680643084275,constant,0.385703069859748,2048,adamw,,PRUNED
384,0.9002551020408164,2026-04-21 14:45:49.053783,2026-04-21 14:46:06.499472,0 days 00:00:17.445689,block_16,0.08373133430289048,constant,0.12815482686635168,2048,adamw,,PRUNED
385,0.9145025510204081,2026-04-21 14:46:06.651673,2026-04-21 14:46:29.728067,0 days 00:00:23.076394,block_16,0.008746649222747156,constant,0.2216527097612277,2048,adamw,,PRUNED
386,0.8644515306122449,2026-04-21 14:46:29.885784,2026-04-21 14:46:47.252969,0 days 00:00:17.367185,block_12,0.09276490025896657,constant,0.03236162136716576,1024,adamw,,PRUNED
387,0.9071938775510203,2026-04-21 14:46:47.407493,2026-04-21 14:47:04.785828,0 days 00:00:17.378335,block_16,0.030745961595664,constant,0.2638182150627729,2048,adamw,,PRUNED
388,0.9140943877551021,2026-04-21 14:47:04.934250,2026-04-21 14:47:27.973961,0 days 00:00:23.039711,block_16,0.009822747737166784,constant,0.1377191852822932,2048,adamw,,PRUNED
389,0.8709438775510204,2026-04-21 14:47:28.115172,2026-04-21 14:47:45.503755,0 days 00:00:17.388583,block_20,0.005113804612629843,constant,0.31047849144127826,1024,adamw,,PRUNED
390,0.8778698979591837,2026-04-21 14:47:45.641253,2026-04-21 14:48:03.069458,0 days 00:00:17.428205,block_16,0.03984794905080902,constant,0.23948399846912347,1024,adamw,,PRUNED
391,0.8117091836734693,2026-04-21 14:48:03.223116,2026-04-21 14:48:20.704583,0 days 00:00:17.481467,pre_proj,0.027128675234337825,cosine_warmup,0.3125090940545239,1024,adamw,11.0,PRUNED
392,0.9155229591836735,2026-04-21 14:48:20.835121,2026-04-21 14:48:43.855901,0 days 00:00:23.020780,block_16,0.014327921701866534,constant,0.25468069694051143,2048,adamw,,PRUNED
393,0.9073852040816326,2026-04-21 14:48:44.000952,2026-04-21 14:49:04.074197,0 days 00:00:20.073245,block_16,0.011973634772834944,constant,0.13092580522793287,512,adamw,,PRUNED
394,0.8549107142857142,2026-04-21 14:49:04.210316,2026-04-21 14:49:21.613078,0 days 00:00:17.402762,block_20,0.0050754200599379806,cosine_warmup,0.15690253517855537,512,adamw,9.0,PRUNED
395,0.8282908163265307,2026-04-21 14:49:21.767252,2026-04-21 14:49:39.119921,0 days 00:00:17.352669,block_12,0.0701373005000671,constant,0.35277648771649917,512,adamw,,PRUNED
396,0.9173852040816327,2026-04-21 14:49:39.275281,2026-04-21 14:50:05.218039,0 days 00:00:25.942758,block_16,0.015141290142717532,constant,0.10669360745912723,2048,adamw,,PRUNED
397,0.9149107142857144,2026-04-21 14:50:05.377962,2026-04-21 14:50:28.491245,0 days 00:00:23.113283,block_16,0.007387287003742907,constant,0.15621479568011007,2048,adamw,,PRUNED
398,0.9172448979591837,2026-04-21 14:50:28.624045,2026-04-21 14:50:54.470125,0 days 00:00:25.846080,block_16,0.03718334081051981,constant,0.32334659441096814,2048,adamw,,PRUNED
399,0.9172321428571428,2026-04-21 14:50:54.615981,2026-04-21 14:51:20.549772,0 days 00:00:25.933791,block_16,0.017601858827985133,constant,0.2353171136532879,2048,adamw,,PRUNED
400,0.9078443877551021,2026-04-21 14:51:20.703152,2026-04-21 14:51:38.005549,0 days 00:00:17.302397,block_16,0.012076894560765146,cosine_warmup,0.17275681967642442,2048,adamw,4.0,PRUNED
401,0.9114285714285715,2026-04-21 14:51:38.143991,2026-04-21 14:52:01.126472,0 days 00:00:22.982481,block_16,0.03237320222498984,constant,0.39363169773397555,2048,adamw,,PRUNED
402,0.8983290816326529,2026-04-21 14:52:01.280604,2026-04-21 14:52:18.633984,0 days 00:00:17.353380,block_16,0.05843535548991698,constant,0.19951479167366082,1024,adamw,,PRUNED
403,0.8656632653061224,2026-04-21 14:52:18.771462,2026-04-21 14:52:36.222666,0 days 00:00:17.451204,block_20,0.0053835334965958576,cosine_warmup,0.07560534165796778,2048,adamw,13.0,PRUNED
404,0.9095918367346939,2026-04-21 14:52:36.394446,2026-04-21 14:52:53.975777,0 days 00:00:17.581331,block_16,0.012138743282491165,constant,0.19693684289658983,512,adamw,,PRUNED
405,0.9299489795918368,2026-04-21 14:52:54.135662,2026-04-21 14:54:07.153383,0 days 00:01:13.017721,block_16,0.010269239736282949,constant,0.22226741029978375,2048,adamw,,COMPLETE
406,0.9181250000000001,2026-04-21 14:54:07.310857,2026-04-21 14:54:33.324972,0 days 00:00:26.014115,block_16,0.011777627852291191,constant,0.26521236065498976,2048,adamw,,PRUNED
407,0.9291454081632653,2026-04-21 14:54:33.480591,2026-04-21 14:55:46.888689,0 days 00:01:13.408098,block_16,0.009789734770845503,constant,0.21716184429825047,2048,adamw,,COMPLETE
408,0.9150255102040816,2026-04-21 14:55:47.056621,2026-04-21 14:56:10.021528,0 days 00:00:22.964907,block_16,0.008157938811977853,constant,0.22748265104311852,2048,adamw,,PRUNED
409,0.9185331632653061,2026-04-21 14:56:10.169653,2026-04-21 14:56:35.920061,0 days 00:00:25.750408,block_16,0.008988479767498316,constant,0.2126642008003222,2048,adamw,,PRUNED
410,0.9142602040816327,2026-04-21 14:56:36.080295,2026-04-21 14:56:59.058435,0 days 00:00:22.978140,block_16,0.010595091690997748,constant,0.24042922119997823,2048,adamw,,PRUNED
411,0.8196556122448979,2026-04-21 14:56:59.209140,2026-04-21 14:57:16.622260,0 days 00:00:17.413120,pre_proj,0.007141809029249483,constant,0.12137623203291872,512,adamw,,PRUNED
412,0.913545918367347,2026-04-21 14:57:16.772421,2026-04-21 14:57:39.797249,0 days 00:00:23.024828,block_16,0.005671299969954201,constant,0.23654531161077902,2048,adamw,,PRUNED
413,0.8195918367346938,2026-04-21 14:57:39.962953,2026-04-21 14:57:57.356949,0 days 00:00:17.393996,pre_proj,0.005454038637967568,constant,0.2414820018639928,512,adamw,,PRUNED
414,0.8999617346938775,2026-04-21 14:57:57.502926,2026-04-21 14:58:14.852712,0 days 00:00:17.349786,block_16,0.06688556858834001,cosine_warmup,0.3249483693737572,512,adamw,7.0,PRUNED
415,0.8725382653061224,2026-04-21 14:58:15.008259,2026-04-21 14:58:32.294495,0 days 00:00:17.286236,block_20,0.03265686026686528,constant,0.23793596827590072,1024,adamw,,PRUNED
416,0.8188265306122449,2026-04-21 14:58:32.434003,2026-04-21 14:58:49.838994,0 days 00:00:17.404991,pre_proj,0.021030779806743977,constant,0.2376735917612971,2048,adamw,,PRUNED
417,0.9107397959183674,2026-04-21 14:58:50.003868,2026-04-21 14:59:07.315926,0 days 00:00:17.312058,block_16,0.015734222236231863,constant,0.2233257606239966,2048,adamw,,PRUNED
418,0.8283545918367348,2026-04-21 14:59:07.469171,2026-04-21 14:59:24.835814,0 days 00:00:17.366643,pre_proj,0.008735621603667393,constant,0.3528849927128993,2048,adamw,,PRUNED
419,0.9155867346938775,2026-04-21 14:59:24.981125,2026-04-21 14:59:47.902016,0 days 00:00:22.920891,block_16,0.01612912073670896,constant,0.34142413747454875,2048,adamw,,PRUNED
420,0.9173341836734694,2026-04-21 14:59:48.053594,2026-04-21 15:00:14.007731,0 days 00:00:25.954137,block_16,0.012183430109214466,constant,0.28962452036165054,2048,adamw,,PRUNED
421,0.9155994897959184,2026-04-21 15:00:14.162672,2026-04-21 15:00:37.089367,0 days 00:00:22.926695,block_16,0.01378129233772188,constant,0.18290957382231934,2048,adamw,,PRUNED
422,0.9034183673469388,2026-04-21 15:00:37.232623,2026-04-21 15:00:54.553173,0 days 00:00:17.320550,block_16,0.03374984889239579,constant,0.2405373667271207,2048,adamw,,PRUNED
423,0.9050255102040817,2026-04-21 15:00:54.678530,2026-04-21 15:01:11.985188,0 days 00:00:17.306658,block_16,0.025934599044839253,constant,0.24862874045506322,512,adamw,,PRUNED
424,0.9222576530612245,2026-04-21 15:01:12.145321,2026-04-21 15:01:52.071869,0 days 00:00:39.926548,block_16,0.043423468786037055,constant,0.06768836439919138,1024,adamw,,PRUNED
425,0.9220280612244898,2026-04-21 15:01:52.228406,2026-04-21 15:02:26.571812,0 days 00:00:34.343406,block_16,0.007483725299171517,constant,0.2490205049053902,2048,adamw,,PRUNED
426,0.9085586734693878,2026-04-21 15:02:26.712163,2026-04-21 15:02:43.901245,0 days 00:00:17.189082,block_16,0.023435510301465068,constant,0.25799184408265496,2048,adamw,,PRUNED
427,0.9140688775510204,2026-04-21 15:02:44.026404,2026-04-21 15:03:06.920427,0 days 00:00:22.894023,block_16,0.013413297816223078,constant,0.22981609439133927,2048,adamw,,PRUNED
428,0.9259183673469388,2026-04-21 15:03:07.058523,2026-04-21 15:04:00.300751,0 days 00:00:53.242228,block_16,0.010851355242023832,constant,0.20045275659250283,2048,adamw,,PRUNED
429,0.9158928571428572,2026-04-21 15:04:00.458109,2026-04-21 15:04:23.255985,0 days 00:00:22.797876,block_16,0.010247479987976194,constant,0.30092323475622185,2048,adamw,,PRUNED
430,0.864375,2026-04-21 15:04:23.393472,2026-04-21 15:04:40.301546,0 days 00:00:16.908074,block_12,0.023393853397334467,cosine_warmup,0.3715288621162681,1024,adamw,14.0,PRUNED
431,0.9111224489795918,2026-04-21 15:04:40.430704,2026-04-21 15:04:57.352940,0 days 00:00:16.922236,block_16,0.03570843954202265,constant,0.1750941238483726,2048,adamw,,PRUNED
432,0.9058290816326531,2026-04-21 15:04:57.493152,2026-04-21 15:05:14.390069,0 days 00:00:16.896917,block_16,0.017052361946203003,constant,0.3286477399490956,2048,adamw,,PRUNED
433,0.9246045918367346,2026-04-21 15:05:14.530878,2026-04-21 15:06:04.817718,0 days 00:00:50.286840,block_16,0.00832892965019986,constant,0.17975307571593027,2048,adamw,,PRUNED
434,0.9079209183673469,2026-04-21 15:06:04.984133,2026-04-21 15:06:21.938849,0 days 00:00:16.954716,block_16,0.07764836529830715,constant,0.2644330313360564,2048,adamw,,PRUNED
435,0.9102551020408164,2026-04-21 15:06:22.080795,2026-04-21 15:06:38.960641,0 days 00:00:16.879846,block_16,0.020424223135811492,constant,0.19730028838493222,2048,adamw,,PRUNED
436,0.8024489795918368,2026-04-21 15:06:39.101545,2026-04-21 15:06:56.078374,0 days 00:00:16.976829,pre_proj,0.024150187440384885,cosine_warmup,0.1488275729834666,512,adamw,11.0,PRUNED
437,0.8941198979591838,2026-04-21 15:06:56.226112,2026-04-21 15:07:13.125379,0 days 00:00:16.899267,block_16,0.0738780602068503,constant,0.11313084983141089,1024,adamw,,PRUNED
438,0.9255229591836734,2026-04-21 15:07:13.260897,2026-04-21 15:07:52.466678,0 days 00:00:39.205781,block_16,0.0152233289196948,constant,0.17188078068220825,2048,adamw,,PRUNED
439,0.9070408163265306,2026-04-21 15:07:52.617426,2026-04-21 15:08:09.531075,0 days 00:00:16.913649,block_16,0.03139595312144976,constant,0.134040383495031,512,adamw,,PRUNED
440,0.8847193877551021,2026-04-21 15:08:09.679933,2026-04-21 15:08:26.577402,0 days 00:00:16.897469,block_16,0.06912710493353372,constant,0.25381395233666815,1024,adamw,,PRUNED
441,0.8814795918367347,2026-04-21 15:08:26.717847,2026-04-21 15:08:43.642227,0 days 00:00:16.924380,block_16,0.045510734516773926,constant,0.30394420642043846,2048,adamw,,PRUNED
442,0.8610969387755101,2026-04-21 15:08:43.796261,2026-04-21 15:09:00.828883,0 days 00:00:17.032622,block_20,0.02056266523413652,constant,0.2775079068631235,2048,adamw,,PRUNED
443,0.9176530612244899,2026-04-21 15:09:00.991743,2026-04-21 15:09:26.321874,0 days 00:00:25.330131,block_16,0.009677573036904146,constant,0.23680622942358345,2048,adamw,,PRUNED
444,0.8731122448979591,2026-04-21 15:09:26.473240,2026-04-21 15:09:43.420397,0 days 00:00:16.947157,block_20,0.032657385698939355,cosine_warmup,0.07260437845714351,1024,adamw,5.0,PRUNED
445,0.815765306122449,2026-04-21 15:09:43.573753,2026-04-21 15:10:00.574492,0 days 00:00:17.000739,pre_proj,0.011077406998848993,constant,0.0029272220566716467,1024,adamw,,PRUNED
446,0.9067091836734694,2026-04-21 15:10:00.707005,2026-04-21 15:10:17.746477,0 days 00:00:17.039472,block_16,0.020423204766664725,constant,0.3032891377311752,2048,adamw,,PRUNED
447,0.8081250000000001,2026-04-21 15:10:17.898652,2026-04-21 15:10:35.000719,0 days 00:00:17.102067,pre_proj,0.05544613964399392,cosine_warmup,0.23070725844870266,2048,adamw,9.0,PRUNED
448,0.9066454081632652,2026-04-21 15:10:35.144822,2026-04-21 15:10:52.099544,0 days 00:00:16.954722,block_16,0.007241524933093179,constant,0.22006975684628438,512,adamw,,PRUNED
449,0.905982142857143,2026-04-21 15:10:52.233065,2026-04-21 15:11:09.107175,0 days 00:00:16.874110,block_16,0.035070670074519916,constant,0.11027327563534439,2048,adamw,,PRUNED
450,0.9053316326530613,2026-04-21 15:11:09.228039,2026-04-21 15:11:26.134533,0 days 00:00:16.906494,block_16,0.06414670329510908,cosine_warmup,0.24737318674089082,2048,adamw,12.0,PRUNED
451,0.917844387755102,2026-04-21 15:11:26.261943,2026-04-21 15:11:51.549151,0 days 00:00:25.287208,block_16,0.008202844672803085,constant,0.1953075348875569,2048,adamw,,PRUNED
452,0.9113010204081633,2026-04-21 15:11:51.682949,2026-04-21 15:12:08.601158,0 days 00:00:16.918209,block_16,0.012113445918701293,constant,0.3238260561750221,2048,adamw,,PRUNED
453,0.8936352040816328,2026-04-21 15:12:08.738696,2026-04-21 15:12:25.661929,0 days 00:00:16.923233,block_12,0.006578251322858845,constant,0.13016061191337203,2048,adamw,,PRUNED
454,0.8628698979591837,2026-04-21 15:12:25.804712,2026-04-21 15:12:42.766107,0 days 00:00:16.961395,block_20,0.03982086677251065,constant,0.031853724410231904,1024,adamw,,PRUNED
455,0.9108545918367347,2026-04-21 15:12:42.938782,2026-04-21 15:12:59.855776,0 days 00:00:16.916994,block_16,0.015211593402531873,constant,0.19629315521437107,2048,adamw,,PRUNED
456,0.9130484693877551,2026-04-21 15:13:00.008912,2026-04-21 15:13:22.512416,0 days 00:00:22.503504,block_16,0.006436043752318025,constant,0.1728790026594423,2048,adamw,,PRUNED
457,0.8780357142857143,2026-04-21 15:13:22.655875,2026-04-21 15:13:39.579165,0 days 00:00:16.923290,block_12,0.034314183262129656,cosine_warmup,0.1396528622830788,512,adamw,7.0,PRUNED
458,0.9136734693877551,2026-04-21 15:13:39.706316,2026-04-21 15:14:02.252113,0 days 00:00:22.545797,block_16,0.007629763539311727,constant,0.38494071729542223,2048,adamw,,PRUNED
459,0.917283163265306,2026-04-21 15:14:02.375368,2026-04-21 15:14:27.745676,0 days 00:00:25.370308,block_16,0.013099829385678854,constant,0.1564871430624159,2048,adamw,,PRUNED
460,0.8274999999999999,2026-04-21 15:14:27.900539,2026-04-21 15:14:44.988821,0 days 00:00:17.088282,pre_proj,0.006387301905454098,constant,0.22585195805383376,2048,adamw,,PRUNED
461,0.8845280612244899,2026-04-21 15:14:45.130639,2026-04-21 15:15:02.278313,0 days 00:00:17.147674,block_12,0.014788204890116419,constant,0.2846638725401442,2048,adamw,,PRUNED
462,0.8819897959183673,2026-04-21 15:15:02.424663,2026-04-21 15:15:19.476662,0 days 00:00:17.051999,block_12,0.048798333387052646,constant,0.1810536909644569,1024,adamw,,PRUNED
463,0.9071938775510204,2026-04-21 15:15:19.631256,2026-04-21 15:15:36.641247,0 days 00:00:17.009991,block_16,0.02841459025372381,constant,0.2541324382766998,2048,adamw,,PRUNED
464,0.8989795918367347,2026-04-21 15:15:36.794712,2026-04-21 15:15:53.740250,0 days 00:00:16.945538,block_16,0.0410364327891803,constant,0.15345447391819345,1024,adamw,,PRUNED
465,0.9224234693877551,2026-04-21 15:15:53.889047,2026-04-21 15:16:27.400197,0 days 00:00:33.511150,block_16,0.00824402092488266,constant,0.2650768880004863,2048,adamw,,PRUNED
466,0.8751913265306123,2026-04-21 15:16:27.543841,2026-04-21 15:16:44.845043,0 days 00:00:17.301202,block_20,0.06262743641217511,cosine_warmup,0.04445687813959334,2048,adamw,10.0,PRUNED
467,0.9074234693877551,2026-04-21 15:16:45.048419,2026-04-21 15:17:02.460054,0 days 00:00:17.411635,block_16,0.018797206009288664,constant,0.2587849837494822,512,adamw,,PRUNED
468,0.9043367346938775,2026-04-21 15:17:02.622581,2026-04-21 15:17:19.848512,0 days 00:00:17.225931,block_16,0.02409126922760983,constant,0.37236612882199194,2048,adamw,,PRUNED
469,0.9212882653061225,2026-04-21 15:17:20.002792,2026-04-21 15:17:54.059049,0 days 00:00:34.056257,block_16,0.006635723415471417,constant,0.07749356891410505,2048,adamw,,PRUNED
470,0.9052933673469388,2026-04-21 15:17:54.202619,2026-04-21 15:18:11.382647,0 days 00:00:17.180028,block_16,0.020136799008255636,cosine_warmup,0.22672780678784676,1024,adamw,4.0,PRUNED
471,0.915765306122449,2026-04-21 15:18:11.526559,2026-04-21 15:18:34.230372,0 days 00:00:22.703813,block_16,0.013625457696352051,constant,0.26138250680807396,2048,adamw,,PRUNED
472,0.9224872448979592,2026-04-21 15:18:34.370788,2026-04-21 15:19:08.390844,0 days 00:00:34.020056,block_16,0.008094747459982633,constant,0.15383010921415635,2048,adamw,,PRUNED
473,0.9023724489795919,2026-04-21 15:19:08.547845,2026-04-21 15:19:25.618416,0 days 00:00:17.070571,block_16,0.018871316153139316,cosine_warmup,0.3995732074163066,2048,adamw,6.0,PRUNED
474,0.9255229591836734,2026-04-21 15:19:25.760680,2026-04-21 15:20:16.554690,0 days 00:00:50.794010,block_16,0.010844032754520502,constant,0.20163874016211988,2048,adamw,,PRUNED
475,0.9038647959183673,2026-04-21 15:20:16.715002,2026-04-21 15:20:33.794887,0 days 00:00:17.079885,block_16,0.02635642170869069,constant,0.15768472006651543,2048,adamw,,PRUNED
476,0.8905229591836736,2026-04-21 15:20:33.961749,2026-04-21 15:20:50.986749,0 days 00:00:17.025000,block_16,0.09401198542949889,cosine_warmup,0.01899419436640773,2048,adamw,14.0,PRUNED
477,0.9037499999999999,2026-04-21 15:20:51.124127,2026-04-21 15:21:08.289404,0 days 00:00:17.165277,block_16,0.03622050446825343,constant,0.31055253216446227,2048,adamw,,PRUNED
478,0.8940051020408163,2026-04-21 15:21:08.450637,2026-04-21 15:21:25.598818,0 days 00:00:17.148181,block_16,0.04571318264712888,cosine_warmup,0.01027314954981981,512,adamw,8.0,PRUNED
479,0.9111989795918367,2026-04-21 15:21:25.737317,2026-04-21 15:21:42.900369,0 days 00:00:17.163052,block_16,0.015270816528854215,constant,0.3623498124855479,2048,adamw,,PRUNED
480,0.9149234693877552,2026-04-21 15:21:43.073261,2026-04-21 15:22:05.896301,0 days 00:00:22.823040,block_16,0.005721900190140552,constant,0.22446567117263888,2048,adamw,,PRUNED
481,0.9075127551020408,2026-04-21 15:22:06.044532,2026-04-21 15:22:23.320359,0 days 00:00:17.275827,block_16,0.020178469532036884,constant,0.2678204434087616,2048,adamw,,PRUNED
482,0.9181632653061225,2026-04-21 15:22:23.454017,2026-04-21 15:22:49.050518,0 days 00:00:25.596501,block_16,0.012500682363372588,constant,0.1910764621853439,2048,adamw,,PRUNED
483,0.9176913265306121,2026-04-21 15:22:49.191567,2026-04-21 15:23:14.791594,0 days 00:00:25.600027,block_16,0.010623094572899767,constant,0.11995847330299991,2048,adamw,,PRUNED
484,0.909030612244898,2026-04-21 15:23:14.930426,2026-04-21 15:23:32.267851,0 days 00:00:17.337425,block_16,0.02132048440712416,constant,0.19081508364765604,2048,adamw,,PRUNED
485,0.915905612244898,2026-04-21 15:23:32.422796,2026-04-21 15:23:55.214074,0 days 00:00:22.791278,block_16,0.01031982651600112,constant,0.27344475105491356,2048,adamw,,PRUNED
486,0.9006377551020408,2026-04-21 15:23:55.371696,2026-04-21 15:24:12.443840,0 days 00:00:17.072144,block_16,0.005898508944716523,cosine_warmup,0.13977544908583903,2048,adamw,12.0,PRUNED
