number,value,datetime_start,datetime_complete,duration,params_clip_layer,params_lr,params_lr_scheduler,params_mlp_dropout,params_mlp_hidden_dim,params_optimizer_type,params_warmup_epochs,state
243,0.8174107142857142,2026-04-21 13:52:13.444466,2026-04-21 13:52:30.608711,0 days 00:00:17.164245,pre_proj,0.00970000077789471,cosine_warmup,0.21784936892734877,2048,adamw,5.0,PRUNED
244,0.9144642857142857,2026-04-21 13:52:30.772454,2026-04-21 13:52:53.692440,0 days 00:00:22.919986,block_16,0.006774446357832623,constant,0.26250071993688207,2048,adamw,,PRUNED
245,0.9125765306122451,2026-04-21 13:52:53.830738,2026-04-21 13:53:16.926196,0 days 00:00:23.095458,block_16,0.006527096211327973,constant,0.18088706906995078,2048,adamw,,PRUNED
246,0.8797704081632653,2026-04-21 13:53:17.087707,2026-04-21 13:53:34.423756,0 days 00:00:17.336049,block_20,0.013256577595138971,constant,0.37390211047095423,2048,adamw,,PRUNED
247,0.9100892857142856,2026-04-21 13:53:34.554932,2026-04-21 13:53:51.898474,0 days 00:00:17.343542,block_16,0.012651746537018102,constant,0.2076326431726681,2048,adamw,,PRUNED
248,0.9250382653061224,2026-04-21 13:53:52.056573,2026-04-21 13:54:32.804815,0 days 00:00:40.748242,block_16,0.008574951106055068,constant,0.18592653932120723,2048,adamw,,PRUNED
249,0.7850765306122449,2026-04-21 13:54:32.980054,2026-04-21 13:54:50.668983,0 days 00:00:17.688929,pre_proj,0.06280672241254637,constant,0.32727646881233674,1024,adamw,,PRUNED
250,0.9132908163265305,2026-04-21 13:54:50.823651,2026-04-21 13:55:14.280407,0 days 00:00:23.456756,block_16,0.005368695938412084,constant,0.3252786032189476,2048,adamw,,PRUNED
251,0.9148086734693878,2026-04-21 13:55:14.428631,2026-04-21 13:55:40.440674,0 days 00:00:26.012043,block_16,0.013316841463937698,constant,0.26065583265154496,2048,adamw,,PRUNED
252,0.9258163265306123,2026-04-21 13:55:40.604035,2026-04-21 13:56:33.162688,0 days 00:00:52.558653,block_16,0.010992478909476402,constant,0.009082762274298856,2048,adamw,,PRUNED
253,0.9072831632653061,2026-04-21 13:56:33.319095,2026-04-21 13:56:51.066324,0 days 00:00:17.747229,block_16,0.014925218652129915,constant,0.1319756667531779,1024,adamw,,PRUNED
254,0.9146938775510204,2026-04-21 13:56:51.230592,2026-04-21 13:57:14.581549,0 days 00:00:23.350957,block_16,0.009274868467552792,constant,0.23202417464843034,2048,adamw,,PRUNED
255,0.856313775510204,2026-04-21 13:57:14.739027,2026-04-21 13:57:32.304831,0 days 00:00:17.565804,block_12,0.014304873495684434,cosine_warmup,0.2720267111609455,512,adamw,14.0,PRUNED
256,0.8638775510204083,2026-04-21 13:57:32.460696,2026-04-21 13:57:49.851956,0 days 00:00:17.391260,block_12,0.06913703912258826,cosine_warmup,0.33057391974389205,2048,adamw,8.0,PRUNED
257,0.926390306122449,2026-04-21 13:57:50.004902,2026-04-21 13:58:42.143650,0 days 00:00:52.138748,block_16,0.036475932162862164,constant,0.007744315463971696,2048,adamw,,PRUNED
258,0.9016326530612245,2026-04-21 13:58:42.306465,2026-04-21 13:58:59.867855,0 days 00:00:17.561390,block_16,0.0193418764818114,cosine_warmup,0.08578345776555657,512,adamw,12.0,PRUNED
259,0.8850255102040817,2026-04-21 13:59:00.020315,2026-04-21 13:59:17.389044,0 days 00:00:17.368729,block_16,0.0056805949068695644,cosine_warmup,0.13576019374054898,1024,adamw,6.0,PRUNED
260,0.9246811224489796,2026-04-21 13:59:17.536044,2026-04-21 13:59:57.767631,0 days 00:00:40.231587,block_16,0.01072966766714036,constant,0.14213697136225978,2048,adamw,,PRUNED
261,0.9068112244897959,2026-04-21 13:59:57.907221,2026-04-21 14:00:15.399718,0 days 00:00:17.492497,block_16,0.023476231288269308,constant,0.23378477522674804,2048,adamw,,PRUNED
262,0.926281887755102,2026-04-21 14:00:15.554109,2026-04-21 14:01:07.269209,0 days 00:00:51.715100,block_16,0.016559387774095814,constant,0.15131367787362682,2048,adamw,,PRUNED
263,0.8846938775510204,2026-04-21 14:01:07.437705,2026-04-21 14:01:24.940303,0 days 00:00:17.502598,block_20,0.005344019896696669,constant,0.25614655606706416,2048,adamw,,PRUNED
264,0.8011543367346938,2026-04-21 14:01:25.088792,2026-04-21 14:01:42.621766,0 days 00:00:17.532974,pre_proj,0.03896201285495784,cosine_warmup,0.18430204170522693,1024,adamw,10.0,PRUNED
265,0.8725382653061224,2026-04-21 14:01:42.794583,2026-04-21 14:02:00.096370,0 days 00:00:17.301787,block_20,0.006389805607944181,constant,0.18503784434508658,512,adamw,,PRUNED
266,0.8848979591836735,2026-04-21 14:02:00.233490,2026-04-21 14:02:17.530378,0 days 00:00:17.296888,block_12,0.005018145151997657,constant,0.14476648746197543,1024,adamw,,PRUNED
267,0.9299744897959183,2026-04-21 14:02:17.695054,2026-04-21 14:03:30.811163,0 days 00:01:13.116109,block_16,0.010021071766811464,constant,0.307686779390853,2048,adamw,,COMPLETE
268,0.8770535714285714,2026-04-21 14:03:30.964457,2026-04-21 14:03:48.334538,0 days 00:00:17.370081,block_20,0.04338719252243745,constant,0.31648441884477674,512,adamw,,PRUNED
269,0.9146428571428572,2026-04-21 14:03:48.489253,2026-04-21 14:04:11.557421,0 days 00:00:23.068168,block_16,0.009641374036589778,constant,0.3653544328464298,2048,adamw,,PRUNED
270,0.9028826530612245,2026-04-21 14:04:11.713656,2026-04-21 14:04:29.048114,0 days 00:00:17.334458,block_16,0.05090313340868927,constant,0.1499863626501924,512,adamw,,PRUNED
271,0.9154464285714285,2026-04-21 14:04:29.194790,2026-04-21 14:04:52.310538,0 days 00:00:23.115748,block_16,0.009562362612805774,constant,0.33025535643939674,2048,adamw,,PRUNED
272,0.9075637755102041,2026-04-21 14:04:52.459048,2026-04-21 14:05:09.950430,0 days 00:00:17.491382,block_16,0.018676276843267996,constant,0.3212968221683967,2048,adamw,,PRUNED
273,0.8918494897959183,2026-04-21 14:05:10.106222,2026-04-21 14:05:27.772220,0 days 00:00:17.665998,block_12,0.006398093743722145,constant,0.32246303458880443,2048,adamw,,PRUNED
274,0.9095918367346938,2026-04-21 14:05:27.935519,2026-04-21 14:05:45.545648,0 days 00:00:17.610129,block_16,0.034304097968783476,constant,0.1834709181246587,1024,adamw,,PRUNED
275,0.914859693877551,2026-04-21 14:05:45.708416,2026-04-21 14:06:09.101022,0 days 00:00:23.392606,block_16,0.05165897560319469,constant,0.2795395401731925,2048,adamw,,PRUNED
276,0.9178188775510204,2026-04-21 14:06:09.260643,2026-04-21 14:06:35.455115,0 days 00:00:26.194472,block_16,0.012033236826535468,constant,0.31143883982902,2048,adamw,,PRUNED
277,0.8923469387755102,2026-04-21 14:06:35.613999,2026-04-21 14:06:53.276479,0 days 00:00:17.662480,block_16,0.03449858171640737,constant,0.33025117224901857,1024,adamw,,PRUNED
278,0.8204209183673469,2026-04-21 14:06:53.434673,2026-04-21 14:07:11.091590,0 days 00:00:17.656917,pre_proj,0.01131460239265015,constant,0.2376964948076734,2048,adamw,,PRUNED
279,0.6916964285714285,2026-04-21 14:07:11.251812,2026-04-21 14:07:28.914064,0 days 00:00:17.662252,pre_proj,0.07011766659652989,constant,0.23577789240243857,512,adamw,,PRUNED
280,0.8976913265306122,2026-04-21 14:07:29.093270,2026-04-21 14:07:46.699141,0 days 00:00:17.605871,block_16,0.023910117986143183,constant,0.01647929081295725,1024,adamw,,PRUNED
281,0.914438775510204,2026-04-21 14:07:46.861589,2026-04-21 14:08:10.315945,0 days 00:00:23.454356,block_16,0.014164812974000383,constant,0.09560317249296976,2048,adamw,,PRUNED
282,0.7737499999999999,2026-04-21 14:08:10.479712,2026-04-21 14:08:28.180701,0 days 00:00:17.700989,pre_proj,0.09897951598483275,cosine_warmup,0.3678413241630412,2048,adamw,4.0,PRUNED
283,0.8873852040816326,2026-04-21 14:08:28.330684,2026-04-21 14:08:45.863548,0 days 00:00:17.532864,block_12,0.011599075316202839,constant,0.14300720836794467,2048,adamw,,PRUNED
284,0.8849872448979591,2026-04-21 14:08:46.009319,2026-04-21 14:09:03.584592,0 days 00:00:17.575273,block_16,0.038389461153446505,constant,0.1161734655100516,2048,adamw,,PRUNED
285,0.9049489795918366,2026-04-21 14:09:03.734476,2026-04-21 14:09:21.166287,0 days 00:00:17.431811,block_16,0.02653668434842886,constant,0.23481902029805438,2048,adamw,,PRUNED
286,0.8595918367346939,2026-04-21 14:09:21.294447,2026-04-21 14:09:38.894983,0 days 00:00:17.600536,block_12,0.03607011243379356,constant,0.04252031598138696,2048,adamw,,PRUNED
287,0.9043877551020408,2026-04-21 14:09:39.043994,2026-04-21 14:09:56.550827,0 days 00:00:17.506833,block_16,0.02483566134003837,constant,0.3670440145240444,2048,adamw,,PRUNED
288,0.9223469387755102,2026-04-21 14:09:56.705907,2026-04-21 14:10:31.370488,0 days 00:00:34.664581,block_16,0.010412667805452176,constant,0.1561686954559603,2048,adamw,,PRUNED
289,0.9147576530612245,2026-04-21 14:10:31.505000,2026-04-21 14:10:55.016693,0 days 00:00:23.511693,block_16,0.016624782419722844,constant,0.20755851008702078,2048,adamw,,PRUNED
290,0.9149107142857142,2026-04-21 14:10:55.172175,2026-04-21 14:11:21.499012,0 days 00:00:26.326837,block_16,0.012625931554098267,constant,0.26333684593998663,2048,adamw,,PRUNED
291,0.9135841836734694,2026-04-21 14:11:21.648698,2026-04-21 14:11:44.870046,0 days 00:00:23.221348,block_16,0.006389358522764328,constant,0.12346817033682593,2048,adamw,,PRUNED
292,0.817155612244898,2026-04-21 14:11:45.023081,2026-04-21 14:12:02.568790,0 days 00:00:17.545709,pre_proj,0.012075076079384399,constant,0.15477382810962328,1024,adamw,,PRUNED
293,0.8661224489795918,2026-04-21 14:12:02.731471,2026-04-21 14:12:20.240371,0 days 00:00:17.508900,block_12,0.021179396745637777,constant,0.3421838523651981,512,adamw,,PRUNED
294,0.9010841836734694,2026-04-21 14:12:20.385312,2026-04-21 14:12:37.824565,0 days 00:00:17.439253,block_16,0.012736678243281913,cosine_warmup,0.31559925645716774,512,adamw,8.0,PRUNED
295,0.9067091836734694,2026-04-21 14:12:37.981191,2026-04-21 14:12:55.384121,0 days 00:00:17.402930,block_16,0.03782779228986437,constant,0.31030527236740607,2048,adamw,,PRUNED
296,0.8515688775510204,2026-04-21 14:12:55.529799,2026-04-21 14:13:13.038286,0 days 00:00:17.508487,block_20,0.006198697906157388,cosine_warmup,0.1109535808310224,1024,adamw,12.0,PRUNED
297,0.9069005102040817,2026-04-21 14:13:13.198401,2026-04-21 14:13:30.561012,0 days 00:00:17.362611,block_16,0.022568610348083128,constant,0.13725937882388428,512,adamw,,PRUNED
298,0.9159693877551021,2026-04-21 14:13:30.700711,2026-04-21 14:13:56.711421,0 days 00:00:26.010710,block_16,0.011029163675935491,constant,0.19672781149764443,2048,adamw,,PRUNED
299,0.8607397959183674,2026-04-21 14:13:56.841030,2026-04-21 14:14:14.286137,0 days 00:00:17.445107,block_20,0.015913218963002844,cosine_warmup,0.2064259164126257,1024,adamw,6.0,PRUNED
300,0.8,2026-04-21 14:14:14.435632,2026-04-21 14:14:31.940245,0 days 00:00:17.504613,pre_proj,0.022118919073849375,cosine_warmup,0.2723389050953493,512,adamw,10.0,PRUNED
301,0.908533163265306,2026-04-21 14:14:32.083324,2026-04-21 14:14:49.541356,0 days 00:00:17.458032,block_16,0.06228593218070488,constant,0.17172271845475562,1024,adamw,,PRUNED
302,0.9054591836734693,2026-04-21 14:14:49.682514,2026-04-21 14:15:07.171781,0 days 00:00:17.489267,block_16,0.02580663415688585,constant,0.1710550311600294,2048,adamw,,PRUNED
303,0.9056760204081633,2026-04-21 14:15:07.326456,2026-04-21 14:15:24.786488,0 days 00:00:17.460032,block_16,0.008992923306702129,constant,0.2954451775246233,512,adamw,,PRUNED
304,0.8094515306122451,2026-04-21 14:15:24.938493,2026-04-21 14:15:42.459637,0 days 00:00:17.521144,pre_proj,0.03672854812714742,constant,0.1583913958178663,2048,adamw,,PRUNED
305,0.9278571428571429,2026-04-21 14:15:42.620726,2026-04-21 14:16:37.120144,0 days 00:00:54.499418,block_16,0.007472222847234448,constant,0.25757449469314836,2048,adamw,,PRUNED
306,0.9134566326530612,2026-04-21 14:16:37.274325,2026-04-21 14:17:00.379069,0 days 00:00:23.104744,block_16,0.015276241424800439,constant,0.3078915324122793,2048,adamw,,PRUNED
307,0.8723724489795918,2026-04-21 14:17:00.535508,2026-04-21 14:17:17.899841,0 days 00:00:17.364333,block_20,0.022083310279866226,constant,0.22079701107756577,512,adamw,,PRUNED
308,0.9142474489795918,2026-04-21 14:17:18.058735,2026-04-21 14:17:41.152343,0 days 00:00:23.093608,block_16,0.013078266100231458,constant,0.16955626375584598,2048,adamw,,PRUNED
309,0.9265943877551021,2026-04-21 14:17:41.294903,2026-04-21 14:18:32.897675,0 days 00:00:51.602772,block_16,0.0121413609361713,constant,0.09806588220652969,2048,adamw,,PRUNED
310,0.878545918367347,2026-04-21 14:18:33.065229,2026-04-21 14:18:50.478875,0 days 00:00:17.413646,block_20,0.0173928585811258,constant,0.14765662714719885,2048,adamw,,PRUNED
311,0.8754464285714285,2026-04-21 14:18:50.621814,2026-04-21 14:19:07.895951,0 days 00:00:17.274137,block_20,0.03885243594602589,cosine_warmup,0.29842637493147994,2048,adamw,13.0,PRUNED
312,0.8715816326530613,2026-04-21 14:19:08.040462,2026-04-21 14:19:25.397024,0 days 00:00:17.356562,block_20,0.041437619171887353,cosine_warmup,0.21242158850643922,512,adamw,4.0,PRUNED
313,0.8185586734693877,2026-04-21 14:19:25.548337,2026-04-21 14:19:42.957447,0 days 00:00:17.409110,pre_proj,0.023027288704348524,cosine_warmup,0.11278797549956746,2048,adamw,8.0,PRUNED
314,0.9137882653061224,2026-04-21 14:19:43.104460,2026-04-21 14:20:06.160293,0 days 00:00:23.055833,block_16,0.011352344690941416,constant,0.35780958273697594,2048,adamw,,PRUNED
315,0.9152806122448979,2026-04-21 14:20:06.316321,2026-04-21 14:20:29.445739,0 days 00:00:23.129418,block_16,0.007893482417156093,constant,0.30906461922883527,2048,adamw,,PRUNED
316,0.905982142857143,2026-04-21 14:20:29.601486,2026-04-21 14:20:46.949854,0 days 00:00:17.348368,block_16,0.039451595673133395,constant,0.20071207780167125,2048,adamw,,PRUNED
317,0.8348214285714285,2026-04-21 14:20:47.099316,2026-04-21 14:21:04.487544,0 days 00:00:17.388228,block_12,0.0958400351589818,constant,0.1371465348769203,2048,adamw,,PRUNED
318,0.9110714285714285,2026-04-21 14:21:04.646949,2026-04-21 14:21:24.875610,0 days 00:00:20.228661,block_16,0.019671379709968576,constant,0.045317962157308024,2048,adamw,,PRUNED
319,0.8674999999999999,2026-04-21 14:21:25.040794,2026-04-21 14:21:42.509687,0 days 00:00:17.468893,block_20,0.039839468904485136,constant,0.2862619104158947,2048,adamw,,PRUNED
320,0.9154464285714285,2026-04-21 14:21:42.666876,2026-04-21 14:22:05.718590,0 days 00:00:23.051714,block_16,0.00515979525245851,constant,0.17472039828332916,2048,adamw,,PRUNED
321,0.9220025510204082,2026-04-21 14:22:05.856994,2026-04-21 14:22:40.452527,0 days 00:00:34.595533,block_16,0.01074354084548722,constant,0.19326707805208473,2048,adamw,,PRUNED
322,0.9056505102040817,2026-04-21 14:22:40.625046,2026-04-21 14:22:58.086180,0 days 00:00:17.461134,block_16,0.019930256107275557,constant,0.1864641083257923,512,adamw,,PRUNED
323,0.9007525510204082,2026-04-21 14:22:58.245407,2026-04-21 14:23:15.764248,0 days 00:00:17.518841,block_16,0.05622735363951521,constant,0.28587127803033974,1024,adamw,,PRUNED
324,0.9159183673469389,2026-04-21 14:23:15.907692,2026-04-21 14:23:41.979093,0 days 00:00:26.071401,block_16,0.029636247870734947,constant,0.3043428607609702,2048,adamw,,PRUNED
325,0.9137117346938776,2026-04-21 14:23:42.133766,2026-04-21 14:24:05.263047,0 days 00:00:23.129281,block_16,0.022110494737798084,cosine_warmup,0.12993749855874576,2048,adamw,14.0,PRUNED
326,0.8763392857142858,2026-04-21 14:24:05.388029,2026-04-21 14:24:22.890933,0 days 00:00:17.502904,block_20,0.02265691167194517,constant,0.04634812888840617,512,adamw,,PRUNED
327,0.9032142857142856,2026-04-21 14:24:23.043859,2026-04-21 14:24:40.572273,0 days 00:00:17.528414,block_16,0.010276276920782002,cosine_warmup,0.25142436556452435,2048,adamw,11.0,PRUNED
328,0.9018877551020409,2026-04-21 14:24:40.709796,2026-04-21 14:24:58.201155,0 days 00:00:17.491359,block_16,0.012142737579418092,constant,0.23661455394352307,1024,adamw,,PRUNED
329,0.9083673469387755,2026-04-21 14:24:58.368961,2026-04-21 14:25:15.855707,0 days 00:00:17.486746,block_16,0.018578102399085656,constant,0.39846907845355833,2048,adamw,,PRUNED
330,0.9265688775510205,2026-04-21 14:25:15.984307,2026-04-21 14:26:07.986272,0 days 00:00:52.001965,block_16,0.010273602328910874,constant,0.13474543583838006,2048,adamw,,PRUNED
331,0.9321173469387755,2026-04-21 14:26:08.133708,2026-04-21 14:27:21.559103,0 days 00:01:13.425395,block_16,0.01589407745099209,constant,0.23666444136026313,2048,adamw,,COMPLETE
332,0.9178698979591837,2026-04-21 14:27:21.692621,2026-04-21 14:27:47.752001,0 days 00:00:26.059380,block_16,0.021081105089049007,constant,0.284347616150378,2048,adamw,,PRUNED
333,0.914655612244898,2026-04-21 14:27:47.894632,2026-04-21 14:28:11.093935,0 days 00:00:23.199303,block_16,0.017389386072634537,constant,0.2425687520154756,2048,adamw,,PRUNED
334,0.8676658163265306,2026-04-21 14:28:11.257139,2026-04-21 14:28:28.643046,0 days 00:00:17.385907,block_12,0.08544037583950792,cosine_warmup,0.14170332285236673,2048,adamw,6.0,PRUNED
335,0.9075,2026-04-21 14:28:28.767512,2026-04-21 14:28:46.093437,0 days 00:00:17.325925,block_16,0.020251519316740397,constant,0.21985800391129276,2048,adamw,,PRUNED
336,0.8994897959183674,2026-04-21 14:28:46.231994,2026-04-21 14:29:03.577911,0 days 00:00:17.345917,block_16,0.07281740795453016,constant,0.027375484209074513,1024,adamw,,PRUNED
337,0.8715561224489795,2026-04-21 14:29:03.733848,2026-04-21 14:29:21.155085,0 days 00:00:17.421237,block_12,0.03151318388150874,constant,0.17108707634678327,512,adamw,,PRUNED
338,0.8167474489795918,2026-04-21 14:29:21.298824,2026-04-21 14:29:38.732214,0 days 00:00:17.433390,pre_proj,0.014867885311309502,constant,0.13256783035537237,2048,adamw,,PRUNED
339,0.9063647959183675,2026-04-21 14:29:38.893048,2026-04-21 14:29:56.230508,0 days 00:00:17.337460,block_16,0.02362732881306618,constant,0.12941320917183063,2048,adamw,,PRUNED
340,0.9039158163265306,2026-04-21 14:29:56.385497,2026-04-21 14:30:13.609532,0 days 00:00:17.224035,block_16,0.06805848781514923,constant,0.33366726302439026,2048,adamw,,PRUNED
341,0.9160331632653063,2026-04-21 14:30:13.734489,2026-04-21 14:30:39.465363,0 days 00:00:25.730874,block_16,0.01156554116016283,constant,0.22289772368582852,2048,adamw,,PRUNED
342,0.9099999999999999,2026-04-21 14:30:39.590294,2026-04-21 14:30:56.892994,0 days 00:00:17.302700,block_16,0.05235462391791133,constant,0.15370206741910522,1024,adamw,,PRUNED
343,0.9140688775510204,2026-04-21 14:30:57.030774,2026-04-21 14:31:20.036830,0 days 00:00:23.006056,block_16,0.009148048174521332,constant,0.20406595412030162,2048,adamw,,PRUNED
344,0.9161607142857142,2026-04-21 14:31:20.172844,2026-04-21 14:31:45.904286,0 days 00:00:25.731442,block_16,0.013697528280042125,constant,0.18256086643697123,2048,adamw,,PRUNED
345,0.9063137755102041,2026-04-21 14:31:46.065840,2026-04-21 14:32:03.268442,0 days 00:00:17.202602,block_16,0.020587488756141956,constant,0.3421686331449915,512,adamw,,PRUNED
346,0.8013265306122449,2026-04-21 14:32:03.421901,2026-04-21 14:32:20.695457,0 days 00:00:17.273556,pre_proj,0.00819786684239459,cosine_warmup,0.38936654998195747,1024,adamw,8.0,PRUNED
347,0.9265178571428572,2026-04-21 14:32:20.831502,2026-04-21 14:33:12.278420,0 days 00:00:51.446918,block_16,0.014819021239219769,constant,0.25313295375581363,2048,adamw,,PRUNED
348,0.8538010204081632,2026-04-21 14:33:12.424909,2026-04-21 14:33:29.807359,0 days 00:00:17.382450,block_12,0.038723550567930295,constant,0.29420952480924634,2048,adamw,,PRUNED
349,0.9274617346938775,2026-04-21 14:33:29.952131,2026-04-21 14:34:23.865147,0 days 00:00:53.913016,block_16,0.00823661255902567,constant,0.11277046872537325,2048,adamw,,PRUNED
350,0.9082525510204082,2026-04-21 14:34:24.025998,2026-04-21 14:34:41.362721,0 days 00:00:17.336723,block_16,0.017394977909278547,constant,0.3562087932206373,1024,adamw,,PRUNED
351,0.8851658163265306,2026-04-21 14:34:41.522076,2026-04-21 14:34:59.032781,0 days 00:00:17.510705,block_16,0.05473304954216101,cosine_warmup,0.37393947891264323,2048,adamw,10.0,PRUNED
352,0.9106122448979592,2026-04-21 14:34:59.173074,2026-04-21 14:35:19.373276,0 days 00:00:20.200202,block_16,0.03499577897308637,constant,0.23986113422706784,2048,adamw,,PRUNED
353,0.8785969387755102,2026-04-21 14:35:19.532160,2026-04-21 14:35:36.907750,0 days 00:00:17.375590,block_12,0.0264282467922108,constant,0.1563842411284359,2048,adamw,,PRUNED
354,0.9099617346938775,2026-04-21 14:35:37.049313,2026-04-21 14:35:54.404831,0 days 00:00:17.355518,block_16,0.02103716239761788,constant,0.13764495236194055,2048,adamw,,PRUNED
355,0.9168239795918367,2026-04-21 14:35:54.561953,2026-04-21 14:36:20.450480,0 days 00:00:25.888527,block_16,0.010373996740709577,constant,0.17050049863614328,2048,adamw,,PRUNED
356,0.8901913265306123,2026-04-21 14:36:20.618354,2026-04-21 14:36:38.093861,0 days 00:00:17.475507,block_16,0.021980843432999667,cosine_warmup,0.2064792286579815,512,adamw,4.0,PRUNED
357,0.9087244897959184,2026-04-21 14:36:38.219932,2026-04-21 14:36:55.784560,0 days 00:00:17.564628,block_16,0.02294587357970611,constant,0.32779366320886505,2048,adamw,,PRUNED
358,0.9027933673469388,2026-04-21 14:36:55.914658,2026-04-21 14:37:13.239596,0 days 00:00:17.324938,block_16,0.021104638311848296,cosine_warmup,0.2948631774490316,2048,adamw,14.0,PRUNED
359,0.8957780612244898,2026-04-21 14:37:13.397823,2026-04-21 14:37:30.889849,0 days 00:00:17.492026,block_16,0.0064598179561683716,cosine_warmup,0.020104790481753315,512,adamw,7.0,PRUNED
360,0.877563775510204,2026-04-21 14:37:31.062755,2026-04-21 14:37:48.667727,0 days 00:00:17.604972,block_12,0.013634697415478151,constant,0.09665898496534439,1024,adamw,,PRUNED
361,0.918329081632653,2026-04-21 14:37:48.828394,2026-04-21 14:38:14.633240,0 days 00:00:25.804846,block_16,0.010415817267817156,constant,0.30180728234466325,2048,adamw,,PRUNED
362,0.7951530612244898,2026-04-21 14:38:14.794850,2026-04-21 14:38:32.158967,0 days 00:00:17.364117,pre_proj,0.005168565352875454,cosine_warmup,0.07053975953974964,1024,adamw,12.0,PRUNED
363,0.9141198979591837,2026-04-21 14:38:32.297870,2026-04-21 14:38:55.327768,0 days 00:00:23.029898,block_16,0.008831141981381973,constant,0.1656859032689706,2048,adamw,,PRUNED
364,0.9061607142857143,2026-04-21 14:38:55.464945,2026-04-21 14:39:12.816284,0 days 00:00:17.351339,block_16,0.03424560647888612,constant,0.20993902939976083,512,adamw,,PRUNED
