number,value,datetime_start,datetime_complete,duration,params_attn_dropout,params_clip_layer,params_dim_feedforward,params_lr,params_lr_scheduler,params_mlp_dropout,params_mlp_hidden_dim,params_n_heads,params_num_layers,params_optimizer_type,params_warmup_epochs,params_weight_decay,system_attrs_completed_rung_0,system_attrs_completed_rung_1,system_attrs_completed_rung_2,system_attrs_completed_rung_3,state
493,0.6621556122448979,2026-04-21 17:17:06.055852,2026-04-21 17:17:12.501031,0 days 00:00:06.445179,0.5010753918942803,block_16,256,0.00013754101806259065,cosine_warmup,0.5014132183106298,128,2,8,adam,13.0,0.003107068313912059,0.6621556122448979,,,,PRUNED
494,0.9487500000000001,2026-04-21 17:17:12.680058,2026-04-21 17:19:18.719562,0 days 00:02:06.039504,0.18720567763109958,block_16,1024,8.746542428155667e-05,cosine,0.15405771795424728,1024,4,9,adam,,0.0033096424770468623,0.9476020408163266,,,,COMPLETE
495,0.877920918367347,2026-04-21 17:19:18.870644,2026-04-21 17:19:31.633260,0 days 00:00:12.762616,0.5583798771003887,pre_proj,256,0.0001789202845724692,cosine,0.36395998760135845,512,4,11,adam,,0.001034894495036915,0.877920918367347,,,,PRUNED
496,0.7825382653061225,2026-04-21 17:19:31.796791,2026-04-21 17:19:38.345128,0 days 00:00:06.548337,0.4065462270432181,block_16,1024,0.0003347359905664333,cosine,0.40932221789729756,64,16,8,adam,,0.0080057662616539,0.7825382653061225,,,,PRUNED
497,0.927155612244898,2026-04-21 17:19:38.493861,2026-04-21 17:20:17.200002,0 days 00:00:38.706141,0.36364230562967026,block_16,1024,6.276932310242598e-05,cosine,0.30686251260248404,64,8,14,adam,,0.0004088890690474505,0.927155612244898,,,,PRUNED
498,0.8270663265306123,2026-04-21 17:20:17.382457,2026-04-21 17:20:24.647559,0 days 00:00:07.265102,0.20912683199965834,pre_proj,256,5.4190148801724985e-05,cosine,0.398803381914953,1024,8,15,adam,,0.004345748540090586,0.8270663265306123,,,,PRUNED
499,0.9478316326530611,2026-04-21 17:20:24.804573,2026-04-21 17:22:26.352818,0 days 00:02:01.548245,0.4428318527961963,block_16,1024,0.00010450380635341915,cosine,0.24537382830392512,128,4,6,adam,,0.0004971590341750205,0.9326275510204082,0.9472959183673468,,,COMPLETE
500,0.7416964285714286,2026-04-21 17:22:26.489899,2026-04-21 17:22:33.333092,0 days 00:00:06.843193,0.38650536398124746,block_16,1024,0.0006556542954994515,cosine_warmup,0.1978838567498993,512,4,10,adam,4.0,0.0047813721433835376,0.7416964285714286,,,,PRUNED
501,0.5759056122448979,2026-04-21 17:22:33.506925,2026-04-21 17:22:40.407152,0 days 00:00:06.900227,0.037271456230650105,pre_proj,1024,3.582856093634143e-05,cosine_warmup,0.5730775698194798,512,8,10,adam,10.0,0.0004689908451563391,0.5759056122448979,,,,PRUNED
502,0.9343494897959184,2026-04-21 17:22:40.570352,2026-04-21 17:23:10.981911,0 days 00:00:30.411559,0.5385948217630061,block_20,1024,9.512099522280434e-05,constant,0.2856334100546913,256,8,9,adam,,0.009338800053679918,0.9117091836734694,0.9343494897959184,,,PRUNED
503,0.8339158163265306,2026-04-21 17:23:11.139163,2026-04-21 17:23:17.625102,0 days 00:00:06.485939,0.5006304248857556,block_20,1024,0.0006166025290542721,cosine_warmup,0.20650514440910894,1024,4,6,adam,7.0,0.004085427803375414,0.8339158163265306,,,,PRUNED
504,0.8380867346938775,2026-04-21 17:23:17.788110,2026-04-21 17:23:24.250943,0 days 00:00:06.462833,0.44550939727549466,block_16,1024,0.00012708404609477333,cosine,0.1088915496906481,128,8,8,adam,,0.0050447431435594586,0.8380867346938775,,,,PRUNED
505,0.9463775510204082,2026-04-21 17:23:24.436654,2026-04-21 17:24:50.109153,0 days 00:01:25.672499,0.47341818760667254,block_16,1024,0.0002898834375059188,cosine,0.1956048300276249,1024,4,7,adam,,0.0010449100312447037,0.8718622448979593,0.918826530612245,0.9365561224489796,0.9463775510204082,PRUNED
506,0.6063392857142857,2026-04-21 17:24:50.282192,2026-04-21 17:25:04.271831,0 days 00:00:13.989639,0.2455316043076118,block_16,1024,1.6869927111643184e-05,cosine_warmup,0.3306394371614576,512,16,10,adam,9.0,9.02659047635315e-06,0.6063392857142857,,,,PRUNED
507,0.8162244897959184,2026-04-21 17:25:04.461748,2026-04-21 17:25:11.097569,0 days 00:00:06.635821,0.5131214356905138,pre_proj,256,5.038757307202269e-05,cosine,0.4963395833434853,512,2,12,adam,,0.003337420630210954,0.8162244897959184,,,,PRUNED
508,0.5263265306122449,2026-04-21 17:25:11.283106,2026-04-21 17:25:17.914706,0 days 00:00:06.631600,0.5147005041483572,block_16,256,2.986878467325626e-05,cosine_warmup,0.4678357897648658,512,2,12,adam,11.0,0.00030745163666946317,0.5263265306122449,,,,PRUNED
509,0.9443622448979592,2026-04-21 17:25:18.086859,2026-04-21 17:27:13.015068,0 days 00:01:54.928209,0.319014697258755,block_16,2048,3.642815103273648e-05,cosine,0.2417556963212152,1024,8,11,adam,,0.0025227766732206,0.9353826530612244,0.9443622448979592,,,PRUNED
510,0.9422066326530611,2026-04-21 17:27:13.210642,2026-04-21 17:28:37.722562,0 days 00:01:24.511920,0.4454007231948759,block_16,1024,0.000197607672550453,constant,0.5709311247298392,1024,4,6,adam,,0.00018013556555022693,0.8714285714285714,0.9206632653061225,0.9376913265306122,0.9422066326530611,PRUNED
511,0.6636479591836735,2026-04-21 17:28:37.893438,2026-04-21 17:28:44.433620,0 days 00:00:06.540182,0.16624909159936835,pre_proj,1024,5.0604450360491825e-05,cosine_warmup,0.37328893008704855,512,8,6,adam,8.0,2.405922372916906e-06,0.6636479591836735,,,,PRUNED
512,0.8340688775510203,2026-04-21 17:28:44.601522,2026-04-21 17:28:53.071796,0 days 00:00:08.470274,0.061110648844269644,block_20,1024,3.967636260730572e-05,cosine,0.2920430205905701,1024,8,14,adam,,0.0023559592609743406,0.8340688775510203,,,,PRUNED
513,0.8715561224489795,2026-04-21 17:28:53.272084,2026-04-21 17:29:09.815015,0 days 00:00:16.542931,0.22758018560391435,block_16,2048,1.6348732331555356e-05,cosine,0.45361512989401476,128,16,10,adam,,1.2755638461434284e-05,0.8715561224489795,,,,PRUNED
514,0.9413392857142857,2026-04-21 17:29:10.002177,2026-04-21 17:30:36.698184,0 days 00:01:26.696007,0.420478377718596,block_16,256,3.3834185301704816e-05,cosine,0.384151554871846,256,2,12,adam,,0.0014437293399364203,0.9413392857142857,,,,PRUNED
515,0.9127933673469387,2026-04-21 17:30:36.892250,2026-04-21 17:30:50.396888,0 days 00:00:13.504638,0.20899941796225463,block_16,1024,3.920790987010716e-05,cosine,0.1458211468797773,1024,8,10,adam,,0.001331949571354703,0.8661479591836735,0.9127933673469387,,,PRUNED
516,0.9034438775510204,2026-04-21 17:30:50.557611,2026-04-21 17:31:03.719464,0 days 00:00:13.161853,0.1588472879544521,block_16,512,2.8554274963974005e-05,cosine,0.3466670897438845,1024,8,11,adam,,0.005700637479191729,0.8589923469387756,0.9034438775510204,,,PRUNED
517,0.9493112244897959,2026-04-21 17:31:03.932910,2026-04-21 17:33:07.931302,0 days 00:02:03.998392,0.2814694504321563,block_16,1024,0.00010169861647221258,constant,0.25433825428387274,1024,8,7,adam,,0.002755194062749601,0.8842346938775512,0.9225127551020408,0.9398724489795918,0.9491836734693879,COMPLETE
518,0.8360714285714286,2026-04-21 17:33:08.109369,2026-04-21 17:33:16.176552,0 days 00:00:08.067183,0.28394832947413823,block_16,1024,1.7222288402076643e-05,cosine,0.2023807045055067,1024,2,13,adam,,0.000268580400802336,0.8360714285714286,,,,PRUNED
519,0.6992091836734694,2026-04-21 17:33:16.366724,2026-04-21 17:33:22.915856,0 days 00:00:06.549132,0.13216565407436912,block_12,1024,0.00013332077684568766,cosine_warmup,0.4682037244528771,256,8,8,adam,13.0,1.4690129488929379e-05,0.6992091836734694,,,,PRUNED
520,0.8420535714285714,2026-04-21 17:33:23.107252,2026-04-21 17:33:32.147292,0 days 00:00:09.040040,0.10990281931508022,block_16,1024,2.538337453098034e-05,cosine,0.3706985808557637,1024,2,15,adam,,0.0066795651625087,0.8420535714285714,,,,PRUNED
521,0.9480102040816325,2026-04-21 17:33:32.354844,2026-04-21 17:34:58.254797,0 days 00:01:25.899953,0.4523817755723054,block_16,1024,0.00010528904335689034,cosine,0.1363286928545168,1024,8,9,adam,,0.006662933022161746,0.8891581632653062,0.9250510204081632,0.9377295918367348,0.9480102040816325,PRUNED
522,0.7835841836734694,2026-04-21 17:34:58.411668,2026-04-21 17:35:18.126506,0 days 00:00:19.714838,0.1266795998901833,block_16,2048,4.287312298708536e-05,cosine_warmup,0.4513147325846584,512,4,14,adam,10.0,1.6630745241280445e-05,0.7835841836734694,,,,PRUNED
523,0.9261989795918367,2026-04-21 17:35:18.347213,2026-04-21 17:35:49.722120,0 days 00:00:31.374907,0.5573268450567811,block_16,1024,0.00035670241727291167,cosine_warmup,0.3327248589847666,512,16,8,adam,9.0,0.003535137588175979,0.9261989795918367,,,,PRUNED
524,0.9066071428571428,2026-04-21 17:35:49.910411,2026-04-21 17:36:02.603360,0 days 00:00:12.692949,0.4764450314241528,block_16,1024,8.135431127282688e-05,cosine,0.1249891934164478,512,4,8,adam,,0.0013549137965138184,0.8633673469387755,0.9066071428571428,,,PRUNED
525,0.8991071428571429,2026-04-21 17:36:02.784484,2026-04-21 17:36:17.526544,0 days 00:00:14.742060,0.3273514585100353,block_16,1024,2.048612506566116e-05,cosine,0.24546289186164313,1024,8,12,adam,,0.008348722734983154,0.8991071428571429,,,,PRUNED
526,0.8933928571428572,2026-04-21 17:36:17.721372,2026-04-21 17:36:35.989730,0 days 00:00:18.268358,0.38923913750626254,block_16,1024,7.999121477356238e-05,cosine,0.40831125179617583,128,2,16,adam,,0.0031376589698904507,0.8933928571428572,,,,PRUNED
527,0.7864668367346939,2026-04-21 17:36:36.180650,2026-04-21 17:36:42.769103,0 days 00:00:06.588453,0.5750443373280679,block_16,1024,0.0007715577980140692,constant,0.1896126828585941,1024,8,7,adam,,0.0011706930210833295,0.7864668367346939,,,,PRUNED
528,0.7780994897959185,2026-04-21 17:36:42.940997,2026-04-21 17:36:49.644218,0 days 00:00:06.703221,0.5822797609928967,block_16,1024,3.558043825814748e-05,cosine,0.5977963804844483,256,4,9,adam,,8.437714405266224e-05,0.7780994897959185,,,,PRUNED
529,0.839094387755102,2026-04-21 17:36:49.811989,2026-04-21 17:36:56.382922,0 days 00:00:06.570933,0.4674488652967368,pre_proj,256,0.000496386436071073,cosine,0.4144479751670418,256,2,9,adam,,0.008169193836647883,0.839094387755102,,,,PRUNED
530,0.9073979591836735,2026-04-21 17:36:56.581924,2026-04-21 17:37:09.786078,0 days 00:00:13.204154,0.3295666017910723,block_16,2048,0.00015314329186302567,cosine,0.1242314807659616,256,8,7,adam,,0.0017877452356989307,0.9073979591836735,,,,PRUNED
531,0.9508801020408163,2026-04-21 17:37:09.968451,2026-04-21 17:39:13.971761,0 days 00:02:04.003310,0.269775319943112,block_16,1024,0.00019939195460785534,cosine,0.14212366126725193,1024,2,8,adam,,0.005516569453118378,0.9363647959183674,0.9483928571428573,,,COMPLETE
532,0.8064923469387756,2026-04-21 17:39:14.123679,2026-04-21 17:39:20.533920,0 days 00:00:06.410241,0.19573125007998654,block_16,1024,0.0004691354278465752,cosine,0.10320726794369686,1024,2,7,adam,,0.002535928784253675,0.8064923469387756,,,,PRUNED
533,0.6147959183673469,2026-04-21 17:39:20.696668,2026-04-21 17:39:27.149345,0 days 00:00:06.452677,0.06868540575850143,block_12,256,3.064161838068279e-05,cosine_warmup,0.4286446512802969,512,8,10,adam,6.0,8.073994272725632e-06,0.6147959183673469,,,,PRUNED
534,0.8836479591836736,2026-04-21 17:39:27.325922,2026-04-21 17:39:57.987397,0 days 00:00:30.661475,0.2935324371372917,pre_proj,1024,0.00036900696426627513,cosine,0.20031093405179867,128,2,7,adam,,0.002860786582734801,0.8836479591836736,,,,PRUNED
535,0.9518367346938776,2026-04-21 17:39:58.143722,2026-04-21 17:42:03.828342,0 days 00:02:05.684620,0.442070832396458,block_16,256,5.407542096456331e-05,cosine,0.43072632200794164,512,4,12,adam,,0.0023154224853659654,0.9493494897959184,,,,COMPLETE
536,0.9483418367346939,2026-04-21 17:42:03.995996,2026-04-21 17:43:43.255700,0 days 00:01:39.259704,0.20950432463888172,block_16,1024,0.0002103217860455757,cosine,0.176653512200717,1024,2,12,adam,,0.0017228205349088391,0.8594260204081633,0.9154464285714285,0.9383418367346938,0.9483418367346939,PRUNED
537,0.9318367346938776,2026-04-21 17:43:43.440793,2026-04-21 17:44:15.039973,0 days 00:00:31.599180,0.5579402102245543,block_16,256,0.00011472748974637651,cosine,0.3343604629394078,512,4,13,adam,,0.008086774013795659,0.9177551020408163,0.9318367346938776,,,PRUNED
538,0.9092984693877552,2026-04-21 17:44:15.197767,2026-04-21 17:44:28.105651,0 days 00:00:12.907884,0.46466761892456765,block_16,256,3.737341151544414e-05,cosine,0.5092988591565386,512,4,13,adam,,0.00039961745429867366,0.8747704081632653,0.9092984693877552,,,PRUNED
539,0.6171109693877551,2026-04-21 17:44:28.281756,2026-04-21 17:44:34.770516,0 days 00:00:06.488760,0.19871748161820618,block_12,2048,0.00014607899739478545,cosine_warmup,0.29035474375242,512,8,6,adam,12.0,5.012331250859179e-06,0.6171109693877551,,,,PRUNED
540,0.6437181122448979,2026-04-21 17:44:34.943131,2026-04-21 17:44:41.623675,0 days 00:00:06.680544,0.5166253789428777,block_16,2048,0.0005305858936735216,constant,0.41356996240656646,1024,8,7,adam,,5.807306505564625e-06,0.6437181122448979,,,,PRUNED
541,0.9447704081632653,2026-04-21 17:44:41.806748,2026-04-21 17:46:44.810770,0 days 00:02:03.004022,0.5008586489652628,block_16,256,0.0002531107425899047,constant,0.4714020653743499,512,8,8,adam,,3.7143029254536112e-06,0.9353698979591837,0.947984693877551,,,COMPLETE
542,0.9540561224489796,2026-04-21 17:46:44.964063,2026-04-21 17:49:01.282296,0 days 00:02:16.318233,0.5554856888671009,block_16,1024,0.0004618440618566113,cosine,0.20241314743859784,1024,16,10,adam,,0.00617363204815352,0.9354846938775511,0.9519770408163265,,,COMPLETE
543,0.9154336734693878,2026-04-21 17:49:01.451966,2026-04-21 17:49:31.951405,0 days 00:00:30.499439,0.12038240292017782,block_12,1024,8.197391130804102e-05,cosine_warmup,0.4830735353900447,512,8,6,adam,5.0,1.2302299335911237e-06,0.9154336734693878,,,,PRUNED
544,0.8278571428571428,2026-04-21 17:49:32.111182,2026-04-21 17:49:38.795634,0 days 00:00:06.684452,0.597944537851469,pre_proj,1024,0.0003769758412376523,cosine,0.40291916591129673,1024,16,8,adam,,0.0029805550389596864,0.8278571428571428,,,,PRUNED
545,0.9462117346938776,2026-04-21 17:49:38.970194,2026-04-21 17:51:24.724989,0 days 00:01:45.754795,0.5273595534578561,block_16,1024,0.0002637573438588932,cosine,0.22488385769167993,1024,16,12,adam,,0.0007988383941773083,0.9139285714285715,0.9363775510204082,0.9462117346938776,,PRUNED
546,0.951530612244898,2026-04-21 17:51:24.914255,2026-04-21 17:53:32.018680,0 days 00:02:07.104425,0.5760469639668475,block_16,1024,0.00021615020039320956,cosine,0.22106397804205008,1024,16,9,adam,,0.007950182678591246,0.8831887755102041,0.9180867346938775,0.9367984693877551,0.9492984693877551,COMPLETE
547,0.9125765306122449,2026-04-21 17:53:32.174689,2026-04-21 17:53:45.182812,0 days 00:00:13.008123,0.3043828144057027,block_20,1024,0.00023785471408339963,cosine,0.2102474582155719,1024,2,10,adam,,0.003702175611966761,0.8546301020408164,0.9125765306122449,,,PRUNED
548,0.8097448979591837,2026-04-21 17:53:45.345335,2026-04-21 17:54:00.173165,0 days 00:00:14.827830,0.5962266471188263,block_16,1024,0.0003227069323644265,cosine,0.27822448647904974,128,16,12,adam,,0.0070705739762572375,0.8097448979591837,,,,PRUNED
549,0.9143112244897958,2026-04-21 17:54:00.332805,2026-04-21 17:54:12.686779,0 days 00:00:12.353974,0.2207392732435171,block_16,256,0.0002266906551162473,cosine,0.3339161081413971,512,4,12,adam,,0.00032132493536647633,0.8509821428571428,0.9143112244897958,,,PRUNED
550,0.9510841836734694,2026-04-21 17:54:12.845886,2026-04-21 17:56:18.322756,0 days 00:02:05.476870,0.5449532344451595,block_16,1024,0.00026546281515077414,cosine,0.17359790254097948,1024,16,9,adam,,0.00385100218219198,0.9366454081632654,0.948686224489796,,,COMPLETE
551,0.8484183673469389,2026-04-21 17:56:18.452387,2026-04-21 17:56:24.801729,0 days 00:00:06.349342,0.4500885926356413,block_16,1024,0.00015694251561820203,cosine,0.48655569032475166,1024,16,7,adam,,0.009773625301101612,0.8484183673469389,,,,PRUNED
552,0.9089158163265306,2026-04-21 17:56:24.962197,2026-04-21 17:56:40.600562,0 days 00:00:15.638365,0.2197804868981687,block_16,1024,0.00010699392373572503,cosine,0.43062728044434667,1024,8,14,adam,,0.003530950555784421,0.9089158163265306,,,,PRUNED
553,0.7725382653061224,2026-04-21 17:56:40.777991,2026-04-21 17:56:47.846678,0 days 00:00:07.068687,0.4454134039476967,block_12,1024,0.00037037043709628925,cosine,0.5047132302494681,512,2,11,adam,,0.002066124614911172,0.7725382653061224,,,,PRUNED
554,0.9365178571428572,2026-04-21 17:56:48.018015,2026-04-21 17:58:38.458107,0 days 00:01:50.440092,0.39854394351404276,block_16,1024,0.0001298504201957227,cosine,0.12526826666882812,256,16,14,adam,,0.0006421451824662497,0.9381632653061225,0.9365178571428572,,,PRUNED
555,0.9317602040816327,2026-04-21 17:58:38.623925,2026-04-21 17:59:09.936398,0 days 00:00:31.312473,0.21888265019180703,block_16,256,3.263223692928179e-05,cosine,0.4447892345999019,512,4,13,adam,,0.0064394951848435475,0.9126275510204082,0.9317602040816327,,,PRUNED
556,0.8416071428571429,2026-04-21 17:59:10.113672,2026-04-21 17:59:16.433696,0 days 00:00:06.320024,0.2475813001459875,pre_proj,512,0.0006828903443105397,cosine,0.21860888951047872,1024,8,6,adam,,0.0016902223933103378,0.8416071428571429,,,,PRUNED
557,0.8302423469387755,2026-04-21 17:59:16.594477,2026-04-21 17:59:25.433460,0 days 00:00:08.838983,0.23752725635458893,block_12,1024,2.2434163881481755e-05,cosine,0.339728291711959,1024,8,16,adam,,0.0019861646862593045,0.8302423469387755,,,,PRUNED
558,0.7669005102040816,2026-04-21 17:59:25.603679,2026-04-21 17:59:32.036866,0 days 00:00:06.433187,0.47969856234455355,block_16,512,0.0008222244624503018,cosine,0.13233236099507187,1024,16,10,adam,,0.0060924817112782545,0.7669005102040816,,,,PRUNED
559,0.8478061224489796,2026-04-21 17:59:32.211080,2026-04-21 17:59:42.101324,0 days 00:00:09.890244,0.11363418887108441,block_16,2048,1.7238932971686103e-05,constant,0.3665806910347564,1024,8,14,adam,,0.0011098150629735436,0.8478061224489796,,,,PRUNED
560,0.8138010204081633,2026-04-21 17:59:42.281257,2026-04-21 17:59:48.615982,0 days 00:00:06.334725,0.3987834136914101,block_16,1024,0.0005765779287072781,cosine,0.15293497627359456,512,8,6,adam,,0.007163607096939499,0.8138010204081633,,,,PRUNED
561,0.9054974489795918,2026-04-21 17:59:48.782356,2026-04-21 18:00:01.085673,0 days 00:00:12.303317,0.4097855758262955,block_16,256,3.0010208799049223e-05,cosine,0.3230358255345411,512,4,10,adam,,0.0011629068563176344,0.9054974489795918,,,,PRUNED
562,0.9415688775510204,2026-04-21 18:00:01.242211,2026-04-21 18:01:24.261746,0 days 00:01:23.019535,0.36307004089858513,block_16,256,0.00011461008427003121,cosine,0.4590465348358183,64,2,9,adam,,0.000585657557007028,0.9415688775510204,,,,PRUNED
563,0.8854591836734694,2026-04-21 18:01:24.427245,2026-04-21 18:02:48.056033,0 days 00:01:23.628788,0.07713432273067375,pre_proj,1024,1.8990406101864745e-05,cosine_warmup,0.5794180981317476,512,8,7,adam,7.0,7.274375808872389e-06,0.8854591836734694,,,,PRUNED
564,0.8051530612244898,2026-04-21 18:02:48.231156,2026-04-21 18:02:54.828539,0 days 00:00:06.597383,0.5735575827597533,block_16,1024,0.00041722695040503465,cosine,0.16030848647244433,64,16,9,adam,,0.0013803324033630526,0.8051530612244898,,,,PRUNED
565,0.8973469387755102,2026-04-21 18:02:54.994630,2026-04-21 18:03:09.911056,0 days 00:00:14.916426,0.32957074434982747,block_16,1024,9.635933818567382e-05,cosine,0.36042280868668963,128,8,13,adam,,0.001874128011992406,0.8973469387755102,,,,PRUNED
566,0.8398596938775511,2026-04-21 18:03:10.093809,2026-04-21 18:03:17.862551,0 days 00:00:07.768742,0.33688482644148093,block_16,1024,9.2849911488035e-05,constant,0.28666964264279127,1024,8,13,adam,,0.002725318458344243,0.8398596938775511,,,,PRUNED
567,0.9516071428571429,2026-04-21 18:03:18.029945,2026-04-21 18:05:30.325026,0 days 00:02:12.295081,0.5274567108925338,block_16,1024,0.00016972261354092946,cosine,0.10175177797043808,1024,16,10,adam,,0.007949581891935592,0.9340306122448979,0.9495918367346938,,,COMPLETE
568,0.9145918367346939,2026-04-21 18:05:30.485056,2026-04-21 18:05:42.808014,0 days 00:00:12.322958,0.5678292823867708,block_16,1024,0.0002942053263960082,cosine,0.2012648798127431,256,16,7,adam,,0.007428260574287462,0.8801020408163265,0.9145918367346939,,,PRUNED
569,0.8317602040816328,2026-04-21 18:05:42.969432,2026-04-21 18:05:50.018120,0 days 00:00:07.048688,0.5305009272122571,block_16,1024,0.00032869760817694,cosine,0.2160947823712102,1024,16,10,adam,,0.0058888672901934655,0.8317602040816328,,,,PRUNED
570,0.7024617346938774,2026-04-21 18:05:50.170842,2026-04-21 18:05:56.560574,0 days 00:00:06.389732,0.5866539044623745,block_12,512,0.0008079150514109785,cosine,0.13232345272374824,1024,8,7,adam,,0.002107354565999511,0.7024617346938774,,,,PRUNED
571,0.8905229591836735,2026-04-21 18:05:56.736714,2026-04-21 18:06:09.252241,0 days 00:00:12.515527,0.5026031391251103,block_20,256,9.106454384736622e-05,cosine,0.5592008332993195,128,2,12,adam,,0.007690423661788742,0.8524489795918367,0.8905229591836735,,,PRUNED
572,0.7944897959183674,2026-04-21 18:06:09.415247,2026-04-21 18:06:16.316923,0 days 00:00:06.901676,0.42695920568745604,block_12,256,1.8562855510613817e-05,cosine,0.24617708897644155,512,4,14,adam,,0.004832051768604137,0.7944897959183674,,,,PRUNED
573,0.8640178571428572,2026-04-21 18:06:16.478590,2026-04-21 18:06:32.577243,0 days 00:00:16.098653,0.48122711481388447,pre_proj,1024,0.00026846313017993636,cosine,0.15038284646229647,512,16,13,adam,,0.002893220199926506,0.8640178571428572,,,,PRUNED
574,0.8053061224489797,2026-04-21 18:06:32.756542,2026-04-21 18:06:45.600199,0 days 00:00:12.843657,0.28078919867178354,pre_proj,1024,2.8080158960365682e-05,cosine_warmup,0.1688960338070434,1024,4,8,adam,5.0,0.00020867079855851046,0.8053061224489797,,,,PRUNED
575,0.9513775510204081,2026-04-21 18:06:45.750719,2026-04-21 18:08:55.133397,0 days 00:02:09.382678,0.5411695758044,block_16,1024,0.00020738756991009433,cosine,0.3074295471004683,1024,16,9,adam,,0.005895509550914056,0.8827295918367347,0.9219132653061224,0.936875,0.9489923469387754,COMPLETE
