number,value,datetime_start,datetime_complete,duration,params_attn_dropout,params_clip_layer,params_dim_feedforward,params_lr,params_lr_scheduler,params_mlp_dropout,params_mlp_hidden_dim,params_n_heads,params_num_layers,params_optimizer_type,params_warmup_epochs,params_weight_decay,system_attrs_completed_rung_0,system_attrs_completed_rung_1,system_attrs_completed_rung_2,system_attrs_completed_rung_3,state
164,0.8936352040816326,2026-04-21 13:37:31.425865,2026-04-21 13:37:49.072446,0 days 00:00:17.646581,0.5332543799970183,block_16,2048,3.581337099446378e-05,cosine,0.5755159404429933,1024,4,13,adam,,4.486296645338176e-05,0.8936352040816326,,,,PRUNED
165,0.9470280612244898,2026-04-21 13:37:49.255108,2026-04-21 13:39:12.552547,0 days 00:01:23.297439,0.23387820980823743,block_16,1024,8.405526571843485e-05,cosine,0.5178934811481918,1024,8,6,adam,,3.4766077834946434e-06,0.8616326530612244,0.9177423469387755,0.9371428571428572,0.9470280612244898,PRUNED
166,0.9018494897959184,2026-04-21 13:39:12.689771,2026-04-21 13:39:25.122842,0 days 00:00:12.433071,0.12888136335495348,block_20,1024,9.217149727269893e-05,constant,0.5742075918344334,128,8,7,adam,,1.0866683992685623e-05,0.8711607142857143,0.9018494897959184,,,PRUNED
167,0.9027678571428571,2026-04-21 13:39:25.271087,2026-04-21 13:39:37.627817,0 days 00:00:12.356730,0.4627579696109162,block_12,1024,0.0001083868255418218,cosine,0.34346076921846935,1024,8,7,adam,,4.452056879735631e-06,0.8547321428571428,0.9027678571428571,,,PRUNED
168,0.6551530612244898,2026-04-21 13:39:37.776972,2026-04-21 13:39:44.185358,0 days 00:00:06.408386,0.5042078499124207,block_16,1024,0.00012494837011762453,cosine_warmup,0.5026360177940767,1024,2,7,adam,14.0,3.4168565947907545e-05,0.6551530612244898,,,,PRUNED
169,0.9026530612244897,2026-04-21 13:39:44.329497,2026-04-21 13:39:56.626341,0 days 00:00:12.296844,0.25077788487725183,block_16,1024,0.00010217406430656656,cosine,0.48731110041190184,128,8,7,adam,,2.355777698212673e-05,0.8460331632653061,0.9026530612244897,,,PRUNED
170,0.8104081632653062,2026-04-21 13:39:56.793667,2026-04-21 13:40:15.790508,0 days 00:00:18.996841,0.3186259213031423,block_16,2048,0.0003298540137475874,constant,0.16629614507158758,64,16,14,adam,,0.00019914007523400356,0.8104081632653062,,,,PRUNED
171,0.9417219387755102,2026-04-21 13:40:15.984463,2026-04-21 13:41:40.209425,0 days 00:01:24.224962,0.2920768223963857,block_16,2048,5.2513177635082056e-05,cosine,0.5918042663506717,128,8,6,adam,,3.4503723029432713e-06,0.9111862244897959,0.9367219387755101,0.9417219387755102,,PRUNED
172,0.9309311224489796,2026-04-21 13:41:40.376224,2026-04-21 13:43:04.978747,0 days 00:01:24.602523,0.45066253911579685,block_20,256,0.00011639076057568911,cosine,0.4366948229864506,128,4,8,adam,,1.8852917569570173e-06,0.9101020408163266,0.933545918367347,0.9309311224489796,,PRUNED
173,0.8655867346938776,2026-04-21 13:43:05.134730,2026-04-21 13:43:22.660036,0 days 00:00:17.525306,0.5112841362538784,pre_proj,2048,7.37291778696165e-05,cosine,0.5648742932200732,1024,16,12,adam,,2.4243907691250618e-05,0.8655867346938776,,,,PRUNED
174,0.6144897959183673,2026-04-21 13:43:22.846171,2026-04-21 13:43:30.663311,0 days 00:00:07.817140,0.4149042254917238,block_16,2048,6.0647025278980214e-05,cosine_warmup,0.579633262110092,64,4,10,adam,8.0,0.00022979921398846265,0.6144897959183673,,,,PRUNED
175,0.9295790816326531,2026-04-21 13:43:30.841545,2026-04-21 13:44:01.038366,0 days 00:00:30.196821,0.2218444756937601,block_16,256,0.00015518156373065146,cosine_warmup,0.5112228661597584,128,8,6,adam,4.0,1.6000704864437536e-06,0.9295790816326531,,,,PRUNED
176,0.924936224489796,2026-04-21 13:44:01.182166,2026-04-21 13:44:31.684205,0 days 00:00:30.502039,0.2885294169154371,block_16,512,3.59715118183196e-05,constant,0.5620042893283452,256,16,10,adam,,1.217248631248854e-06,0.924936224489796,,,,PRUNED
177,0.8752295918367347,2026-04-21 13:44:31.853511,2026-04-21 13:44:44.452779,0 days 00:00:12.599268,0.2964876052846769,pre_proj,256,0.0003646780332300949,cosine,0.3724441576727394,1024,8,6,adam,,1.5751821664898605e-05,0.8566709183673469,0.8752295918367347,,,PRUNED
178,0.8997321428571429,2026-04-21 13:44:44.591791,2026-04-21 13:46:31.892989,0 days 00:01:47.301198,0.3555552141419906,block_12,2048,0.00040899303972289275,constant,0.1875588597104626,64,4,11,adam,,0.000240593434856728,0.8997321428571429,,,,PRUNED
179,0.6704272959183674,2026-04-21 13:46:32.074865,2026-04-21 13:46:38.382740,0 days 00:00:06.307875,0.3755879880335864,block_16,256,0.0008855814724431444,cosine,0.34169212677933897,128,8,6,adam,,3.870475456249122e-05,0.6704272959183674,,,,PRUNED
180,0.8968622448979591,2026-04-21 13:46:38.523410,2026-04-21 13:46:51.043218,0 days 00:00:12.519808,0.4258566783840869,block_16,1024,0.00011427981532137494,cosine,0.5704768198203812,128,16,7,adam,,6.0625942823267756e-06,0.8415178571428571,0.8968622448979591,,,PRUNED
181,0.8192219387755102,2026-04-21 13:46:51.224030,2026-04-21 13:46:57.639828,0 days 00:00:06.415798,0.4878531794807097,block_16,1024,6.158839921449454e-05,cosine,0.40028338616489934,512,16,6,adam,,3.0691267282933304e-06,0.8192219387755102,,,,PRUNED
182,0.9490178571428571,2026-04-21 13:46:57.788176,2026-04-21 13:49:00.089569,0 days 00:02:02.301393,0.5098748507728816,block_16,1024,0.00028330015338348327,cosine,0.4122859400924222,1024,8,6,adam,,0.001007681597965257,0.9189923469387755,0.9344005102040817,0.9457525510204081,,COMPLETE
183,,2026-04-21 13:49:00.235464,2026-04-21 13:49:35.994865,0 days 00:00:35.759401,0.32976065040828834,block_16,1024,0.0008601734291808982,cosine,0.3578443091178666,256,8,7,adam,,0.0004719293737762342,,,,,FAIL
184,0.8849872448979592,2026-04-21 13:52:05.105486,2026-04-21 13:52:18.640824,0 days 00:00:13.535338,0.48408457208838285,block_12,1024,0.00017522284282755332,cosine,0.5440533800558068,1024,16,6,adam,,8.234077152105808e-06,0.8849872448979592,,,,PRUNED
185,0.8997704081632653,2026-04-21 13:52:18.800317,2026-04-21 13:52:31.029063,0 days 00:00:12.228746,0.39376600076049006,block_16,1024,0.00024255308776083563,cosine,0.38853958421908696,128,8,7,adam,,0.0019420113827948845,0.8997704081632653,,,,PRUNED
186,0.9307397959183674,2026-04-21 13:52:31.181495,2026-04-21 13:53:01.257307,0 days 00:00:30.075812,0.234961162589987,block_16,256,6.723638631789752e-05,cosine,0.3344466154936937,128,8,9,adam,,2.99815323527087e-06,0.8653954081632653,0.9112882653061224,0.9307397959183674,,PRUNED
187,0.9095153061224489,2026-04-21 13:53:01.422119,2026-04-21 13:53:13.953232,0 days 00:00:12.531113,0.4365957854409758,block_16,1024,0.00018156517511143134,cosine,0.3560687244070197,1024,8,9,adam,,0.000498776949606462,0.8498341836734693,0.9095153061224489,,,PRUNED
188,0.9321811224489795,2026-04-21 13:53:14.103924,2026-04-21 13:53:44.330582,0 days 00:00:30.226658,0.5838477802218811,block_20,1024,7.039636518077271e-05,cosine,0.4967245923456573,1024,8,6,adam,,9.473959150266556e-05,0.914030612244898,0.9321811224489795,,,PRUNED
189,0.9454974489795919,2026-04-21 13:53:44.509090,2026-04-21 13:55:10.111763,0 days 00:01:25.602673,0.5369660154242744,block_16,1024,0.00010697085375609929,cosine,0.46016508197207573,1024,8,8,adam,,1.692837876191671e-05,0.9212882653061225,0.9376785714285714,0.9454974489795919,,PRUNED
190,0.7824234693877552,2026-04-21 13:55:10.276479,2026-04-21 13:55:16.649087,0 days 00:00:06.372608,0.4874799752207948,block_16,512,0.00024391603316782276,constant,0.37196436154880724,64,8,6,adam,,6.127022840975657e-06,0.7824234693877552,,,,PRUNED
191,0.8086607142857143,2026-04-21 13:55:16.802815,2026-04-21 13:55:23.144232,0 days 00:00:06.341417,0.46050656894064024,block_16,1024,0.0002661538242834118,cosine,0.5835141690664875,128,8,6,adam,,1.9675712764232747e-06,0.8086607142857143,,,,PRUNED
192,0.7989030612244897,2026-04-21 13:55:23.282008,2026-04-21 13:55:35.866907,0 days 00:00:12.584899,0.29180641753899056,block_16,1024,3.95399684313499e-05,cosine_warmup,0.5890793506127743,64,8,9,adam,6.0,2.9603285602799873e-06,0.7989030612244897,,,,PRUNED
193,0.9464923469387756,2026-04-21 13:55:36.039452,2026-04-21 13:57:39.717446,0 days 00:02:03.677994,0.38989131528741733,block_16,1024,5.377438775200481e-05,constant,0.5958094575056512,1024,16,7,adam,,3.849571902602834e-06,0.9462755102040816,,,,COMPLETE
194,0.8996173469387756,2026-04-21 13:57:39.885397,2026-04-21 13:57:53.943667,0 days 00:00:14.058270,0.5159155639481932,block_20,2048,4.5318577274267846e-05,cosine,0.5529361696653183,1024,2,9,adam,,3.0924258341004246e-05,0.8494387755102041,0.8996173469387756,,,PRUNED
195,0.9328571428571428,2026-04-21 13:57:54.108307,2026-04-21 13:58:24.777486,0 days 00:00:30.669179,0.37692589088428624,block_16,256,0.000156249021956954,cosine,0.5472551244247099,128,16,7,adam,,1.7112780902391409e-06,0.8590816326530613,0.915420918367347,0.9328571428571428,,PRUNED
196,0.9022066326530612,2026-04-21 13:58:24.966099,2026-04-21 13:58:37.667549,0 days 00:00:12.701450,0.4424222351694223,block_16,512,4.346182773756225e-05,cosine,0.5684238500953785,512,16,9,adam,,1.049102647727328e-06,0.8695790816326531,0.9022066326530612,,,PRUNED
197,0.8107780612244897,2026-04-21 13:58:37.844892,2026-04-21 13:58:46.127889,0 days 00:00:08.282997,0.016585841356468914,block_12,2048,3.3400958449349934e-05,cosine,0.5753617616623443,512,8,10,adam,,1.415810647283372e-06,0.8107780612244897,,,,PRUNED
198,0.6903762755102041,2026-04-21 13:58:46.317097,2026-04-21 13:58:52.916207,0 days 00:00:06.599110,0.3600468105711328,block_16,256,0.0007278509767206961,cosine,0.32792877573691015,128,4,11,adam,,7.658020037153503e-06,0.6903762755102041,,,,PRUNED
199,0.8629974489795919,2026-04-21 13:58:53.087202,2026-04-21 13:59:05.600520,0 days 00:00:12.513318,0.5059109008688016,pre_proj,1024,3.8590871165363e-05,cosine,0.40161848542125533,1024,8,7,adam,,7.225356894530412e-05,0.8629974489795919,,,,PRUNED
200,0.7960841836734696,2026-04-21 13:59:05.753241,2026-04-21 13:59:12.188316,0 days 00:00:06.435075,0.047731565769919444,block_12,2048,2.9732454623710333e-05,cosine,0.5519387789304817,128,2,6,adam,,1.5798503696515282e-06,0.7960841836734696,,,,PRUNED
201,0.7408418367346938,2026-04-21 13:59:12.366005,2026-04-21 13:59:18.766980,0 days 00:00:06.400975,0.5211566622476966,block_16,1024,0.0006637576019592659,cosine,0.37851218904633394,1024,8,6,adam,,0.000169023750866042,0.7408418367346938,,,,PRUNED
202,0.931670918367347,2026-04-21 13:59:18.916479,2026-04-21 13:59:49.393012,0 days 00:00:30.476533,0.4975990489430404,block_20,1024,0.0002973334462171727,constant,0.3383943497853406,1024,8,7,adam,,0.0007206933498441365,0.8719897959183673,0.9178826530612245,0.931670918367347,,PRUNED
203,0.908329081632653,2026-04-21 13:59:49.551144,2026-04-21 14:00:01.937294,0 days 00:00:12.386150,0.3279858660854686,block_16,1024,8.132812525950656e-05,cosine,0.5734774868189684,64,8,6,adam,,1.0336479468874296e-05,0.8515178571428572,0.908329081632653,,,PRUNED
204,0.95125,2026-04-21 14:00:02.102788,2026-04-21 14:02:05.127454,0 days 00:02:03.024666,0.47734738486003475,block_16,1024,0.0002738614386487833,cosine,0.42038569166178225,1024,16,8,adam,,0.004879901940660705,0.9216709183673469,0.9352678571428572,0.9491454081632653,,COMPLETE
205,0.9353698979591837,2026-04-21 14:02:05.263908,2026-04-21 14:02:35.338415,0 days 00:00:30.074507,0.33339976071263205,block_16,256,0.0004289499702901652,cosine,0.188544866412306,256,8,8,adam,,3.6275124589688644e-05,0.8534821428571429,0.9104209183673468,0.9353698979591837,,PRUNED
206,0.9390306122448979,2026-04-21 14:02:35.509429,2026-04-21 14:04:40.987384,0 days 00:02:05.477955,0.26401105551910525,block_16,2048,0.0005367145253286581,constant,0.330231037645488,64,8,13,adam,,0.00012541619973255972,0.9390306122448979,,,,PRUNED
207,0.952359693877551,2026-04-21 14:04:41.168239,2026-04-21 14:06:44.550114,0 days 00:02:03.381875,0.47862541038419004,block_16,1024,0.0002381818709906273,cosine,0.28963537016844315,1024,16,8,adam,,0.006280874239068157,0.876594387755102,0.9238392857142858,0.9376020408163266,0.9509311224489796,COMPLETE
208,0.7258163265306122,2026-04-21 14:06:44.695455,2026-04-21 14:06:51.188551,0 days 00:00:06.493096,0.4521342080420479,block_16,1024,0.0005825252044206855,cosine,0.36581511994797367,256,16,8,adam,,0.002071741772039647,0.7258163265306122,,,,PRUNED
209,0.9347831632653062,2026-04-21 14:06:51.345252,2026-04-21 14:07:22.237100,0 days 00:00:30.891848,0.4266283503233771,block_16,1024,0.00026928961087274993,cosine,0.44495032221274544,1024,16,9,adam,,0.0012570194768371774,0.8676658163265306,0.913954081632653,0.9347831632653062,,PRUNED
210,0.9353443877551021,2026-04-21 14:07:22.387872,2026-04-21 14:07:53.214694,0 days 00:00:30.826822,0.47037403615216844,block_16,1024,5.0259089800844374e-05,constant,0.2736532217152033,1024,16,7,adam,,0.00273942569333573,0.8676403061224489,0.9148086734693878,0.9353443877551021,,PRUNED
211,0.9423979591836733,2026-04-21 14:07:53.380875,2026-04-21 14:09:18.486984,0 days 00:01:25.106109,0.46362456964883647,block_16,1024,0.00026830036354341327,cosine_warmup,0.14246041572437174,1024,16,8,adam,11.0,0.0007780963815772386,0.9423979591836733,,,,PRUNED
212,0.7517729591836735,2026-04-21 14:09:18.665873,2026-04-21 14:09:25.129124,0 days 00:00:06.463251,0.5370777909745572,block_16,1024,0.0007500922172770749,cosine,0.3446746621437205,1024,16,7,adam,,0.0045304456258304935,0.7517729591836735,,,,PRUNED
213,0.8624617346938774,2026-04-21 14:09:25.301770,2026-04-21 14:09:37.758093,0 days 00:00:12.456323,0.48638874475255717,block_12,1024,5.68812258194846e-05,cosine,0.5625553679213339,128,8,6,adam,,9.109062797672178e-05,0.8624617346938774,,,,PRUNED
214,0.7930484693877552,2026-04-21 14:09:37.904870,2026-04-21 14:09:50.388258,0 days 00:00:12.483388,0.36586602060879425,block_20,1024,6.749842168518049e-05,cosine_warmup,0.17893154647517218,128,8,7,adam,9.0,2.6468443878816046e-06,0.7930484693877552,,,,PRUNED
215,0.7879974489795918,2026-04-21 14:09:50.541622,2026-04-21 14:09:58.691161,0 days 00:00:08.149539,0.2536978163359955,block_12,2048,5.535975709043731e-05,constant,0.562773405779376,512,8,11,adam,,1.0226622759500864e-06,0.7879974489795918,,,,PRUNED
216,0.9488775510204082,2026-04-21 14:09:58.859777,2026-04-21 14:12:01.744647,0 days 00:02:02.884870,0.527043591923971,block_16,1024,0.0001562468574488191,cosine,0.4705828367274185,1024,8,6,adam,,0.0006434092161896167,0.9209311224489796,0.9366964285714285,0.9458673469387755,,COMPLETE
217,0.7843877551020408,2026-04-21 14:12:01.871389,2026-04-21 14:12:15.077377,0 days 00:00:13.205988,0.34486640478032904,block_16,512,0.00032992742822601356,constant,0.2421790345086318,64,4,13,adam,,0.00021726063430551587,0.7843877551020408,,,,PRUNED
218,0.9478061224489795,2026-04-21 14:12:15.256346,2026-04-21 14:14:17.734276,0 days 00:02:02.477930,0.4140588592886755,block_16,1024,0.0002539382906721045,cosine,0.1904420524187304,512,16,8,adam,,0.001115191000381248,0.9091964285714286,0.936670918367347,0.945969387755102,,COMPLETE
219,0.947576530612245,2026-04-21 14:14:17.895121,2026-04-21 14:16:20.024040,0 days 00:02:02.128919,0.36717626031088213,block_16,1024,2.4289522772710338e-05,cosine,0.5771559664134447,128,8,8,adam,,7.875259255716203e-06,0.945625,,,,COMPLETE
220,0.7448852040816327,2026-04-21 14:16:20.163235,2026-04-21 14:16:26.552920,0 days 00:00:06.389685,0.4410918898938212,block_16,1024,2.6754238255523683e-05,cosine,0.5488031505909061,128,8,7,adam,,2.0432051993072574e-05,0.7448852040816327,,,,PRUNED
221,0.9456760204081632,2026-04-21 14:16:26.708766,2026-04-21 14:17:51.398981,0 days 00:01:24.690215,0.36238421263731674,block_16,1024,0.00037242212575588863,cosine,0.15883302943701094,512,16,9,adam,,0.0008470878400019342,0.9359311224489796,0.9456760204081632,,,PRUNED
222,0.9099107142857144,2026-04-21 14:17:51.571586,2026-04-21 14:18:03.937556,0 days 00:00:12.365970,0.4765955182217389,block_16,256,0.0006272857313444974,cosine_warmup,0.43946090855708697,1024,16,9,adam,6.0,0.0045143119592556,0.8739413265306122,0.9099107142857144,,,PRUNED
223,0.7326913265306123,2026-04-21 14:18:04.092026,2026-04-21 14:18:10.530062,0 days 00:00:06.438036,0.596520976574258,block_16,1024,0.00012795803356887648,cosine_warmup,0.43779302240554663,1024,16,9,adam,9.0,0.0026829104892185725,0.7326913265306123,,,,PRUNED
224,0.9329209183673469,2026-04-21 14:18:10.702592,2026-04-21 14:18:41.409754,0 days 00:00:30.707162,0.2671105290991605,block_16,512,3.5677101995230815e-05,cosine,0.5843597698248959,128,8,11,adam,,4.206603790357012e-05,0.8627423469387755,0.9109056122448981,0.9329209183673469,,PRUNED
225,0.9523214285714285,2026-04-21 14:18:41.563570,2026-04-21 14:20:42.776869,0 days 00:02:01.213299,0.5668057840945666,block_16,1024,0.00017655992658457517,cosine,0.18627966065850732,1024,16,6,adam,,0.00881164852878179,0.9189540816326531,0.937436224489796,0.9495663265306122,,COMPLETE
226,0.9502933673469387,2026-04-21 14:20:42.930765,2026-04-21 14:22:44.262617,0 days 00:02:01.331852,0.5183112732938812,block_16,1024,0.00014047526010722107,cosine,0.2015156151934849,1024,2,6,adam,,0.005088494803334677,0.8830357142857144,0.920548469387755,0.9373852040816327,0.9487755102040816,COMPLETE
227,0.9496811224489796,2026-04-21 14:22:44.400267,2026-04-21 14:24:46.367354,0 days 00:02:01.967087,0.5032188128309292,block_16,1024,0.00037871778571794084,cosine,0.17851534012670195,1024,16,6,adam,,0.001961959603727882,0.8772193877551021,0.9224107142857143,0.9370280612244898,0.9482270408163265,COMPLETE
228,0.9501658163265307,2026-04-21 14:24:46.517375,2026-04-21 14:26:48.506129,0 days 00:02:01.988754,0.5000294802799565,block_16,1024,0.00012717478622543488,cosine,0.24025718006757832,1024,2,6,adam,,0.002113752836619056,0.9190816326530612,0.938686224489796,0.9477295918367348,,COMPLETE
229,0.932155612244898,2026-04-21 14:26:48.635483,2026-04-21 14:27:18.995540,0 days 00:00:30.360057,0.5718071241834699,block_16,512,0.00022889961578643212,cosine,0.2768990472899638,1024,16,8,adam,,0.0015923633751153046,0.8737372448979591,0.9170025510204082,0.932155612244898,,PRUNED
230,0.9492219387755103,2026-04-21 14:27:19.137009,2026-04-21 14:29:21.790855,0 days 00:02:02.653846,0.5374120496143457,block_16,1024,8.50744614197759e-05,cosine,0.16826647666373262,1024,2,9,adam,,0.003050149447370579,0.9194260204081633,0.9363010204081632,0.9475892857142858,,COMPLETE
231,0.9341836734693877,2026-04-21 14:29:21.946650,2026-04-21 14:29:52.534793,0 days 00:00:30.588143,0.5904466133595876,block_16,1024,0.00031168872963553636,cosine,0.20032914806884874,1024,2,10,adam,,0.004765288928276042,0.8537372448979591,0.9150510204081632,0.9341836734693877,,PRUNED
232,0.9505102040816327,2026-04-21 14:29:52.689784,2026-04-21 14:31:53.371655,0 days 00:02:00.681871,0.5171640118576973,block_16,1024,6.497072041043584e-05,cosine,0.1918479595880923,1024,2,7,adam,,0.0003786524446759943,0.8649617346938775,0.9134821428571429,0.9375510204081632,0.9500892857142857,COMPLETE
233,0.8377295918367347,2026-04-21 14:31:53.509528,2026-04-21 14:31:59.800111,0 days 00:00:06.290583,0.45092695572520614,block_16,1024,9.998869237318558e-05,cosine,0.17793880414748456,512,2,6,adam,,0.008141903301551609,0.8377295918367347,,,,PRUNED
234,0.9356887755102041,2026-04-21 14:31:59.941160,2026-04-21 14:32:30.027490,0 days 00:00:30.086330,0.44852964454233213,block_16,1024,3.78646691469113e-05,cosine,0.17978327494102048,1024,2,8,adam,,0.0006320590738750975,0.9120918367346939,0.9356887755102041,,,PRUNED
235,0.9335586734693877,2026-04-21 14:32:30.184377,2026-04-21 14:33:00.288958,0 days 00:00:30.104581,0.3680596965618868,block_16,256,0.00013636672069030384,cosine,0.21452139433794046,1024,2,8,adam,,0.00923152564219395,0.8875765306122448,0.9208928571428571,0.9335586734693877,,PRUNED
236,0.934795918367347,2026-04-21 14:33:00.460472,2026-04-21 14:33:32.016629,0 days 00:00:31.556157,0.3773455180909414,block_16,1024,0.00012646264379251556,cosine,0.18353368267707076,1024,16,10,adam,,0.0063311774546411384,0.8487882653061225,0.9136096938775511,0.934795918367347,,PRUNED
237,0.9031122448979593,2026-04-21 14:33:32.171920,2026-04-21 14:33:44.359767,0 days 00:00:12.187847,0.5534543492062874,block_16,1024,0.0005954014655444665,cosine,0.10554212206999755,1024,16,6,adam,,0.00022421925699799136,0.9031122448979593,,,,PRUNED
238,0.8482142857142857,2026-04-21 14:33:44.516564,2026-04-21 14:33:53.199411,0 days 00:00:08.682847,0.38046202546575547,block_16,2048,4.883803659497428e-05,cosine,0.566493483171738,128,16,12,adam,,3.7194682863955505e-06,0.8482142857142857,,,,PRUNED
239,0.9107525510204082,2026-04-21 14:33:53.381399,2026-04-21 14:34:06.313433,0 days 00:00:12.932034,0.5620153866840685,block_16,2048,7.523944807236311e-05,cosine,0.16089905495131426,1024,2,8,adam,,0.004267127261639472,0.8546938775510204,0.9107525510204082,,,PRUNED
240,0.9480994897959184,2026-04-21 14:34:06.488360,2026-04-21 14:35:29.868809,0 days 00:01:23.380449,0.4714718828112486,block_16,1024,0.0002065728259810916,cosine,0.20872582876954943,1024,16,6,adam,,0.002166739979503049,0.8716836734693878,0.9233163265306122,0.938329081632653,0.9480994897959184,PRUNED
241,0.8266454081632653,2026-04-21 14:35:30.030054,2026-04-21 14:35:36.451525,0 days 00:00:06.421471,0.4869140056210907,block_12,1024,0.0001239759761753245,cosine,0.24619336446610512,512,16,8,adam,,0.00509636595196997,0.8266454081632653,,,,PRUNED
242,0.8311352040816327,2026-04-21 14:35:36.621761,2026-04-21 14:35:42.941483,0 days 00:00:06.319722,0.477913372963382,block_16,1024,0.00023385806788243956,cosine,0.3127702461402987,1024,2,6,adam,,0.0033154708878241398,0.8311352040816327,,,,PRUNED
243,0.8211607142857142,2026-04-21 14:35:43.073826,2026-04-21 14:35:49.521775,0 days 00:00:06.447949,0.41650997354486674,block_12,1024,0.00013309682195183215,cosine,0.2508448673218987,128,2,8,adam,,0.0071996719578669875,0.8211607142857142,,,,PRUNED
244,0.7202933673469387,2026-04-21 14:35:49.670966,2026-04-21 14:35:56.107182,0 days 00:00:06.436216,0.46605178903709205,block_16,2048,0.00022021498204550727,cosine_warmup,0.3602566827838814,1024,8,6,adam,12.0,0.0022437665324582315,0.7202933673469387,,,,PRUNED
