number,value,datetime_start,datetime_complete,duration,params_attn_dropout,params_clip_layer,params_dim_feedforward,params_lr,params_lr_scheduler,params_mlp_dropout,params_mlp_hidden_dim,params_n_heads,params_num_layers,params_optimizer_type,params_warmup_epochs,params_weight_decay,system_attrs_completed_rung_0,system_attrs_completed_rung_1,system_attrs_completed_rung_2,system_attrs_completed_rung_3,state
827,0.822576530612245,2026-04-21 20:05:38.953752,2026-04-21 20:05:46.632858,0 days 00:00:07.679106,0.32740447734032463,block_16,2048,0.0001414798793077191,cosine,0.4343983153407577,128,4,10,adam,,1.5453710188567958e-06,0.822576530612245,,,,PRUNED
828,0.9474489795918368,2026-04-21 20:05:46.790291,2026-04-21 20:07:46.943859,0 days 00:02:00.153568,0.43821493350749624,block_16,1024,5.937366569452972e-05,cosine,0.17642708369320426,1024,16,9,adam,,8.08648827766013e-05,0.9124234693877552,0.9365688775510204,0.9482142857142857,,COMPLETE
829,0.8242474489795918,2026-04-21 20:07:47.078699,2026-04-21 20:07:54.578141,0 days 00:00:07.499442,0.11846171509095133,block_16,1024,0.00023959109395565534,cosine,0.19381802387030433,128,4,13,adam,,0.0059538551998053,0.8242474489795918,,,,PRUNED
830,0.681875,2026-04-21 20:07:54.736998,2026-04-21 20:08:01.507352,0 days 00:00:06.770354,0.5123573188879327,block_16,1024,0.0002149599293842953,cosine_warmup,0.11316582221762247,256,8,11,adam,14.0,0.0008071323905259301,0.681875,,,,PRUNED
831,0.8395280612244898,2026-04-21 20:08:01.683860,2026-04-21 20:08:08.529412,0 days 00:00:06.845552,0.16219458556406036,block_12,1024,0.0007476729683133165,cosine_warmup,0.19545586685960417,1024,8,11,adam,11.0,0.005221393187965797,0.8395280612244898,,,,PRUNED
832,0.7972959183673469,2026-04-21 20:08:08.679132,2026-04-21 20:08:14.895380,0 days 00:00:06.216248,0.20294150753759643,block_12,1024,4.460279066737736e-05,cosine,0.3964949219437319,512,4,9,adam,,2.9124151864252085e-06,0.7972959183673469,,,,PRUNED
833,0.8428698979591837,2026-04-21 20:08:15.076710,2026-04-21 20:08:21.181755,0 days 00:00:06.105045,0.47818188097366127,block_16,256,2.744269199460568e-05,cosine,0.3977901532236487,512,2,8,adam,,0.00235061587009184,0.8428698979591837,,,,PRUNED
834,0.8199107142857142,2026-04-21 20:08:21.326560,2026-04-21 20:08:27.512886,0 days 00:00:06.186326,0.445511780122346,block_16,1024,4.017666811930416e-05,cosine,0.113956394671198,128,4,9,adam,,0.00033514493750016723,0.8199107142857142,,,,PRUNED
835,0.8476913265306123,2026-04-21 20:08:27.656681,2026-04-21 20:08:39.642245,0 days 00:00:11.985564,0.16071890299719882,pre_proj,1024,0.0007060577508097167,cosine,0.17078187706361314,1024,8,9,adam,,0.006661789680344472,0.8476913265306123,,,,PRUNED
836,0.9511734693877552,2026-04-21 20:08:39.780086,2026-04-21 20:10:36.729250,0 days 00:01:56.949164,0.36867970460151844,block_16,256,0.00015257831406712748,constant,0.216807281077061,64,8,12,adam,,0.0066753205716696545,0.9480739795918367,,,,COMPLETE
837,0.5735841836734694,2026-04-21 20:10:36.866498,2026-04-21 20:10:48.758937,0 days 00:00:11.892439,0.18129165321672402,block_12,1024,1.4060316962244814e-05,cosine_warmup,0.5620286764156814,512,8,8,adam,11.0,7.394348647804555e-06,0.5735841836734694,,,,PRUNED
838,0.9529464285714285,2026-04-21 20:10:48.906236,2026-04-21 20:12:45.642249,0 days 00:01:56.736013,0.11322570541959184,block_16,1024,0.00022052158594474124,cosine,0.10068654628628879,1024,8,9,adam,,0.007543352132214297,0.9507270408163264,,,,COMPLETE
839,0.9473469387755102,2026-04-21 20:12:45.833769,2026-04-21 20:14:06.684074,0 days 00:01:20.850305,0.11733900868575356,block_16,1024,9.074259445086757e-05,cosine,0.14766414726502822,1024,8,8,adam,,0.00743647201516744,0.935,0.9473469387755102,,,PRUNED
840,0.8425255102040816,2026-04-21 20:14:06.830515,2026-04-21 20:14:14.189920,0 days 00:00:07.359405,0.5673292320006447,block_16,1024,0.0005204659872766924,cosine_warmup,0.21515705507551985,1024,16,12,adam,6.0,0.009326472131713295,0.8425255102040816,,,,PRUNED
841,0.8371938775510205,2026-04-21 20:14:14.339382,2026-04-21 20:14:20.866980,0 days 00:00:06.527598,0.0389713669308214,block_16,1024,0.00035699491309066646,cosine,0.13378396052573838,1024,8,10,adam,,0.0008440957946284804,0.8371938775510205,,,,PRUNED
842,0.9100127551020408,2026-04-21 20:14:21.023121,2026-04-21 20:14:32.965761,0 days 00:00:11.942640,0.3819646961822125,block_16,256,0.00018163127316455206,cosine,0.3749917338884443,1024,8,12,adam,,0.0029966459126561902,0.8570918367346939,0.9100127551020408,,,PRUNED
843,0.7424617346938774,2026-04-21 20:14:33.104107,2026-04-21 20:14:39.571927,0 days 00:00:06.467820,0.36067737489279106,block_16,1024,0.0005239770069673113,cosine,0.38501128927833045,512,2,10,adam,,0.003597696321837904,0.7424617346938774,,,,PRUNED
844,0.8891454081632654,2026-04-21 20:14:39.718835,2026-04-21 20:14:53.443047,0 days 00:00:13.724212,0.17220889753041127,block_12,1024,0.00011219203864573944,cosine,0.13895779697870214,1024,8,12,adam,,0.003588934030950234,0.8891454081632654,,,,PRUNED
845,0.9110459183673469,2026-04-21 20:14:53.634801,2026-04-21 20:15:05.591346,0 days 00:00:11.956545,0.11731344615058298,block_16,256,0.00018857113791349105,cosine,0.21905850082525805,64,8,8,adam,,0.004466157576354739,0.8629464285714286,0.9110459183673469,,,PRUNED
846,0.7657908163265306,2026-04-21 20:15:05.720745,2026-04-21 20:15:12.247136,0 days 00:00:06.526391,0.5584346092599904,block_16,256,0.0009337402231760708,cosine,0.13220247152052805,512,2,14,adam,,0.003941354934495408,0.7657908163265306,,,,PRUNED
847,0.7004081632653061,2026-04-21 20:15:12.391356,2026-04-21 20:15:28.109453,0 days 00:00:15.718097,0.5636374142388074,block_16,2048,0.0004812571544320173,cosine,0.482598325810232,512,2,11,adam,,0.0003531313998949359,0.7004081632653061,,,,PRUNED
848,0.8466836734693877,2026-04-21 20:15:28.259145,2026-04-21 20:15:35.112961,0 days 00:00:06.853816,0.3267273579975917,block_16,1024,0.00014163121062529054,cosine,0.20311259885169503,1024,8,11,adam,,0.007503060909768449,0.8466836734693877,,,,PRUNED
849,0.8645408163265306,2026-04-21 20:15:35.259522,2026-04-21 20:15:49.632789,0 days 00:00:14.373267,0.4692481702302709,block_16,1024,0.0001684341649698391,cosine,0.10545776300267325,128,2,13,adam,,0.00815213902184849,0.8645408163265306,,,,PRUNED
850,0.7537244897959183,2026-04-21 20:15:49.773194,2026-04-21 20:15:57.787102,0 days 00:00:08.013908,0.590021767627439,block_16,1024,0.0007004255775800189,cosine,0.12837472098755992,512,2,15,adam,,0.0054603346526603015,0.7537244897959183,,,,PRUNED
851,0.9033290816326531,2026-04-21 20:15:57.946355,2026-04-21 20:16:09.854620,0 days 00:00:11.908265,0.42886912886180906,block_16,256,9.709258897068468e-05,cosine,0.5057126702079322,256,4,11,adam,,0.00012381745774517206,0.9033290816326531,,,,PRUNED
852,0.554859693877551,2026-04-21 20:16:10.009105,2026-04-21 20:16:16.178409,0 days 00:00:06.169304,0.02985161717652866,block_12,2048,3.3362187347705936e-05,cosine_warmup,0.4864929459204022,1024,8,6,adam,10.0,2.1680165708420736e-06,0.554859693877551,,,,PRUNED
