number,value,datetime_start,datetime_complete,duration,params_attn_dropout,params_clip_layer,params_dim_feedforward,params_lr,params_lr_scheduler,params_mlp_dropout,params_mlp_hidden_dim,params_n_heads,params_num_layers,params_optimizer_type,params_warmup_epochs,params_weight_decay,system_attrs_completed_rung_0,system_attrs_completed_rung_1,system_attrs_completed_rung_2,system_attrs_completed_rung_3,state
576,0.8362755102040816,2026-04-21 18:08:55.303892,2026-04-21 18:09:01.938651,0 days 00:00:06.634759,0.5974901894974902,block_16,256,0.00012049678570662122,cosine,0.3901451095560975,128,2,12,adam,,0.00636225064533797,0.8362755102040816,,,,PRUNED
577,0.9128571428571428,2026-04-21 18:09:02.105530,2026-04-21 18:09:16.647257,0 days 00:00:14.541727,0.4989038115083801,block_16,256,0.0002265458968245916,cosine,0.41801817032889266,512,16,14,adam,,0.00010830736122614126,0.8537627551020408,0.9128571428571428,,,PRUNED
578,0.9356760204081633,2026-04-21 18:09:16.804681,2026-04-21 18:09:51.586794,0 days 00:00:34.782113,0.2703863806441714,block_16,512,0.0001299022736540733,cosine,0.11400936950185082,1024,4,13,adam,,0.0037542335963266587,0.8953698979591836,0.9174872448979592,0.9356760204081633,,PRUNED
579,0.6230102040816327,2026-04-21 18:09:51.783882,2026-04-21 18:10:00.686939,0 days 00:00:08.903057,0.3490810848496554,block_16,2048,7.595367958502393e-05,cosine_warmup,0.427912900678055,512,16,11,adam,7.0,1.0543475474259822e-05,0.6230102040816327,,,,PRUNED
580,0.9044005102040815,2026-04-21 18:10:00.892495,2026-04-21 18:10:22.110140,0 days 00:00:21.217645,0.45746377124614246,block_16,2048,5.188079192162282e-05,cosine,0.259732021595931,1024,8,16,adam,,0.0009546970215611182,0.8751020408163266,0.9044005102040815,,,PRUNED
581,0.5622066326530613,2026-04-21 18:10:22.303371,2026-04-21 18:10:28.777695,0 days 00:00:06.474324,0.13499090869866698,block_12,512,2.0436336998774137e-05,cosine_warmup,0.49919480959778245,512,8,9,adam,8.0,2.9027662569213355e-06,0.5622066326530613,,,,PRUNED
582,0.9347704081632653,2026-04-21 18:10:28.947590,2026-04-21 18:11:02.747681,0 days 00:00:33.800091,0.39581876763471324,block_16,1024,8.939798954922134e-05,cosine,0.17533806800710539,1024,4,11,adam,,0.0011266870724475412,0.9140433673469388,0.9347704081632653,,,PRUNED
583,0.6053826530612245,2026-04-21 18:11:02.899985,2026-04-21 18:11:12.274443,0 days 00:00:09.374458,0.15622405580968537,block_16,2048,4.7279949673909105e-05,cosine_warmup,0.4304962168758547,512,16,12,adam,7.0,2.5247568221875075e-06,0.6053826530612245,,,,PRUNED
584,0.9146683673469388,2026-04-21 18:11:12.464956,2026-04-21 18:11:25.357901,0 days 00:00:12.892945,0.43766733241103467,block_16,512,0.00015814475639239098,cosine,0.2924443664251649,128,8,7,adam,,2.154547638512911e-06,0.8810076530612244,0.9146683673469388,,,PRUNED
585,0.7872704081632652,2026-04-21 18:11:25.558529,2026-04-21 18:11:32.259952,0 days 00:00:06.701423,0.5660359095450452,block_16,1024,0.0005583601884378446,cosine,0.13553689643466688,1024,8,8,adam,,0.003517029334611516,0.7872704081632652,,,,PRUNED
586,0.9363137755102041,2026-04-21 18:11:32.449576,2026-04-21 18:12:03.369704,0 days 00:00:30.920128,0.5101285157401758,block_16,1024,6.009966253477504e-05,cosine,0.35347433373081416,1024,16,7,adam,,0.0008647899271836223,0.8646045918367349,0.916951530612245,0.9363137755102041,,PRUNED
587,0.8505102040816327,2026-04-21 18:12:03.531986,2026-04-21 18:12:16.393184,0 days 00:00:12.861198,0.34040294460139875,block_16,256,1.041258287311064e-05,cosine,0.506105292757107,512,2,12,adam,,0.00802429502165692,0.8505102040816327,,,,PRUNED
588,0.6309311224489796,2026-04-21 18:12:16.582097,2026-04-21 18:12:24.711494,0 days 00:00:08.129397,0.5487614657850947,block_16,1024,4.411963206093611e-05,cosine_warmup,0.18334686064167494,1024,16,12,adam,9.0,0.008967429169580559,0.6309311224489796,,,,PRUNED
589,0.8996938775510204,2026-04-21 18:12:24.896496,2026-04-21 18:13:10.990290,0 days 00:00:46.093794,0.14691485286373512,block_16,2048,1.0954571087684543e-05,cosine_warmup,0.4526111385452035,512,2,13,adam,6.0,2.2303005919838272e-05,0.8996938775510204,,,,PRUNED
590,0.9423086734693877,2026-04-21 18:13:11.173851,2026-04-21 18:14:42.514685,0 days 00:01:31.340834,0.494436648997329,block_16,1024,9.099580665926607e-05,constant,0.20919471846513207,256,8,10,adam,,0.005805151580433722,0.9423086734693877,,,,PRUNED
591,0.8455739795918368,2026-04-21 18:14:42.696280,2026-04-21 18:14:49.407353,0 days 00:00:06.711073,0.5100419471923459,block_16,256,0.0006554215528981616,cosine_warmup,0.4543326752461632,512,2,12,adam,4.0,0.0016125017264141761,0.8455739795918368,,,,PRUNED
592,0.8156505102040815,2026-04-21 18:14:49.570962,2026-04-21 18:14:57.642059,0 days 00:00:08.071097,0.259595325411615,block_16,1024,2.043904228743047e-05,cosine,0.4194714906686968,256,8,13,adam,,0.004016739181631671,0.8156505102040815,,,,PRUNED
593,0.908686224489796,2026-04-21 18:14:57.826856,2026-04-21 18:15:13.419298,0 days 00:00:15.592442,0.5252478810681562,block_20,1024,0.000621353225010642,constant,0.18259057190102834,1024,16,12,adam,,0.002310361483206785,0.853609693877551,0.908686224489796,,,PRUNED
594,0.9318367346938774,2026-04-21 18:15:13.611500,2026-04-21 18:15:46.273344,0 days 00:00:32.661844,0.3964816992941642,block_16,256,0.00012792556190024284,cosine,0.4425926527047274,512,4,13,adam,,0.001857694680804878,0.8752678571428572,0.9166709183673469,0.9318367346938774,,PRUNED
595,0.8378188775510205,2026-04-21 18:15:46.438190,2026-04-21 18:15:53.824302,0 days 00:00:07.386112,0.20336237336773683,block_16,1024,2.3024003672836603e-05,cosine,0.377644472904735,64,8,11,adam,,0.004967590380604357,0.8378188775510205,,,,PRUNED
596,0.9340816326530612,2026-04-21 18:15:54.000286,2026-04-21 18:16:24.762849,0 days 00:00:30.762563,0.3757435888410363,block_16,256,9.570553003350203e-05,constant,0.31409506562386175,512,4,9,adam,,0.004929087325548537,0.8866836734693878,0.922015306122449,0.9340816326530612,,PRUNED
597,0.8456760204081633,2026-04-21 18:16:24.957023,2026-04-21 18:16:41.271611,0 days 00:00:16.314588,0.5470382690887353,pre_proj,1024,0.00023015294406902523,cosine,0.1832282339550981,1024,16,13,adam,,0.00291054001293336,0.8456760204081633,,,,PRUNED
598,0.910625,2026-04-21 18:16:41.433088,2026-04-21 18:16:54.732232,0 days 00:00:13.299144,0.5363770727569404,block_20,256,5.1164965310235093e-05,cosine,0.3563765812048988,512,2,13,adam,,0.0011921851162875578,0.8725127551020408,0.910625,,,PRUNED
599,0.9227295918367348,2026-04-21 18:16:54.900405,2026-04-21 18:17:27.798509,0 days 00:00:32.898104,0.599299605006661,block_12,2048,0.00032324786108757275,cosine,0.1808053232552098,1024,16,7,adam,,0.009154413336985334,0.9227295918367348,,,,PRUNED
600,0.8481377551020408,2026-04-21 18:17:27.961954,2026-04-21 18:17:34.465450,0 days 00:00:06.503496,0.576710566072421,block_16,256,2.3403541649445015e-05,cosine,0.2803266656563062,1024,4,8,adam,,0.0003190559134118348,0.8481377551020408,,,,PRUNED
601,0.937142857142857,2026-04-21 18:17:34.648219,2026-04-21 18:18:59.695088,0 days 00:01:25.046869,0.5602909065529473,block_20,512,0.0003601534138011792,constant,0.4525231005991351,128,8,7,adam,,2.416315485060717e-05,0.937142857142857,,,,PRUNED
602,0.894298469387755,2026-04-21 18:18:59.883795,2026-04-21 18:19:14.659669,0 days 00:00:14.775874,0.5987376282307018,block_16,512,0.00035519489608998783,cosine_warmup,0.2076703284720032,1024,16,13,adam,9.0,0.002071842897618629,0.894298469387755,,,,PRUNED
603,0.8336607142857143,2026-04-21 18:19:14.841569,2026-04-21 18:19:23.443641,0 days 00:00:08.602072,0.5265378604213534,block_16,2048,0.00019052486169004573,cosine,0.10770141934177017,128,16,10,adam,,0.005573703592270938,0.8336607142857143,,,,PRUNED
604,0.812844387755102,2026-04-21 18:19:23.629166,2026-04-21 18:19:30.946912,0 days 00:00:07.317746,0.42886826151120533,block_12,1024,1.3616141719783488e-05,cosine,0.14872805342411108,1024,16,10,adam,,0.003603557955152173,0.812844387755102,,,,PRUNED
605,0.8678316326530613,2026-04-21 18:19:31.147972,2026-04-21 18:19:43.676218,0 days 00:00:12.528246,0.5966119000928354,pre_proj,512,0.00016745923403017237,constant,0.3608547518516406,128,4,7,adam,,1.4161490051008178e-06,0.8678316326530613,,,,PRUNED
606,0.9361862244897959,2026-04-21 18:19:43.863326,2026-04-21 18:20:14.467118,0 days 00:00:30.603792,0.5878413824465993,block_16,1024,0.00023749447246840109,cosine,0.21780895323593236,1024,16,6,adam,,0.009663172543768684,0.8571428571428571,0.9199107142857144,0.9361862244897959,,PRUNED
607,0.8022576530612245,2026-04-21 18:20:14.629584,2026-04-21 18:20:21.057442,0 days 00:00:06.427858,0.5145924259955565,block_16,512,0.00046054704533598064,constant,0.18871659762471266,128,4,6,adam,,5.927826668227849e-06,0.8022576530612245,,,,PRUNED
608,0.9292602040816327,2026-04-21 18:20:21.235737,2026-04-21 18:22:07.073457,0 days 00:01:45.837720,0.44603028226400787,block_20,1024,0.0001283274346669738,cosine,0.1092112895005591,256,8,13,adam,,0.0024438644678052607,0.9339795918367347,0.9292602040816327,,,PRUNED
609,0.8441836734693878,2026-04-21 18:22:07.269682,2026-04-21 18:22:13.836436,0 days 00:00:06.566754,0.5685903680248997,pre_proj,1024,0.00011701565338053445,cosine,0.17007563021946526,256,8,8,adam,,0.004221923519859832,0.8441836734693878,,,,PRUNED
610,0.5799489795918368,2026-04-21 18:22:14.044504,2026-04-21 18:22:21.162593,0 days 00:00:07.118089,0.13037568681758926,block_16,512,6.388088203611745e-05,cosine_warmup,0.39199200464966566,64,16,12,adam,8.0,2.29503053888716e-05,0.5799489795918368,,,,PRUNED
611,0.9350127551020408,2026-04-21 18:22:21.333342,2026-04-21 18:22:51.488238,0 days 00:00:30.154896,0.487182424047651,block_16,512,0.00016405934952373695,constant,0.3832203058064039,128,2,6,adam,,7.41185116660223e-05,0.883405612244898,0.9195535714285714,0.9350127551020408,,PRUNED
612,0.8082908163265305,2026-04-21 18:22:51.668096,2026-04-21 18:23:04.358608,0 days 00:00:12.690512,0.024259440934683896,block_12,1024,8.406984582719713e-05,cosine_warmup,0.3822714218755853,64,8,8,adam,10.0,6.080945957268086e-06,0.8082908163265305,,,,PRUNED
613,0.9430102040816326,2026-04-21 18:23:04.507392,2026-04-21 18:24:29.584842,0 days 00:01:25.077450,0.39130776577193693,block_16,512,0.00018743541142609774,cosine,0.3755766933407538,128,16,9,adam,,0.0014794275931983177,0.9170663265306122,0.9386607142857143,0.9430102040816326,,PRUNED
614,0.8421173469387754,2026-04-21 18:24:29.748102,2026-04-21 18:24:36.293353,0 days 00:00:06.545251,0.33788291402178,block_20,1024,2.7657037090054352e-05,cosine,0.16087522674297142,1024,8,9,adam,,0.009980012187588112,0.8421173469387754,,,,PRUNED
615,0.8484566326530613,2026-04-21 18:24:36.450449,2026-04-21 18:24:52.999367,0 days 00:00:16.548918,0.48484449065483637,pre_proj,1024,9.059448672124961e-05,cosine,0.34450219589345565,1024,8,15,adam,,0.008416577743797593,0.8484566326530613,,,,PRUNED
616,0.8022066326530612,2026-04-21 18:24:53.209527,2026-04-21 18:25:05.623846,0 days 00:00:12.414319,0.3212916104335921,block_20,1024,3.987417772662477e-05,cosine_warmup,0.4738020795356611,512,16,6,adam,7.0,7.106354350907106e-06,0.8022066326530612,,,,PRUNED
617,0.5306122448979592,2026-04-21 18:25:05.798838,2026-04-21 18:25:13.045266,0 days 00:00:07.246428,0.09281636000166475,block_12,2048,3.435852125943914e-05,cosine_warmup,0.5113863697762889,512,8,8,adam,10.0,2.455459925234404e-05,0.5306122448979592,,,,PRUNED
618,0.9079336734693878,2026-04-21 18:25:13.228858,2026-04-21 18:25:28.961867,0 days 00:00:15.733009,0.566766391199905,block_16,1024,7.307574833609425e-05,cosine,0.19466799006349955,512,16,13,adam,,0.00234004456458533,0.9079336734693878,,,,PRUNED
619,0.8348979591836734,2026-04-21 18:25:29.150029,2026-04-21 18:25:42.874250,0 days 00:00:13.724221,0.3104383034896908,block_16,512,3.166216759070688e-05,cosine_warmup,0.3160189334353555,512,16,12,adam,8.0,7.774708988795978e-06,0.8348979591836734,,,,PRUNED
620,0.9294005102040815,2026-04-21 18:25:43.034703,2026-04-21 18:26:13.421647,0 days 00:00:30.386944,0.529095403305097,block_20,256,0.0003468365090910584,cosine,0.1287864842738178,1024,16,10,adam,,0.0014551820440139235,0.8778316326530612,0.9207015306122449,0.9294005102040815,,PRUNED
621,0.5803826530612245,2026-04-21 18:26:13.567098,2026-04-21 18:26:20.924665,0 days 00:00:07.357567,0.3277539861568109,block_16,512,2.4734457856729537e-05,cosine_warmup,0.41740660582374345,512,4,14,adam,11.0,0.0003798561975690329,0.5803826530612245,,,,PRUNED
622,0.9387244897959184,2026-04-21 18:26:21.088904,2026-04-21 18:28:25.343044,0 days 00:02:04.254140,0.1717427370909705,block_12,2048,1.7855121668234957e-05,cosine_warmup,0.4381728588857245,512,16,12,adam,9.0,3.723835951454777e-06,0.9387244897959184,,,,PRUNED
623,0.9107142857142857,2026-04-21 18:28:25.527342,2026-04-21 18:28:41.666709,0 days 00:00:16.139367,0.5263292995179358,block_16,2048,0.00011714203594636954,cosine,0.17038203196399315,1024,16,10,adam,,0.0033578005310024184,0.8667729591836736,0.9107142857142857,,,PRUNED
624,0.8596683673469387,2026-04-21 18:28:41.877460,2026-04-21 18:28:55.792015,0 days 00:00:13.914555,0.37196501054994024,block_16,256,6.140561093862354e-05,cosine_warmup,0.4626903488841426,512,2,15,adam,5.0,0.006163363337292291,0.8596683673469387,,,,PRUNED
625,0.8421556122448979,2026-04-21 18:28:55.984893,2026-04-21 18:29:04.635013,0 days 00:00:08.650120,0.14208260209397078,block_16,1024,2.1501170898494503e-05,constant,0.33943798408729114,1024,8,15,adam,,0.0055407630954953544,0.8421556122448979,,,,PRUNED
626,0.8123724489795919,2026-04-21 18:29:04.811022,2026-04-21 18:29:11.238403,0 days 00:00:06.427381,0.5374289147316346,block_16,512,0.00034423646937577337,constant,0.41690726179167575,128,8,6,adam,,9.051699749527235e-06,0.8123724489795919,,,,PRUNED
627,0.8992729591836734,2026-04-21 18:29:11.400248,2026-04-21 18:29:24.481688,0 days 00:00:13.081440,0.3949113955974097,block_20,256,3.174216084968255e-05,cosine,0.4443625068305707,512,4,13,adam,,0.00298132388833605,0.8992729591836734,,,,PRUNED
628,0.9505102040816327,2026-04-21 18:29:24.642603,2026-04-21 18:31:45.586590,0 days 00:02:20.943987,0.13618056745029158,block_16,256,0.00010659596892158297,cosine,0.33184600979572026,512,8,16,adam,,0.007453976970316205,0.9484566326530612,,,,COMPLETE
629,0.914923469387755,2026-04-21 18:31:45.738617,2026-04-21 18:31:59.452236,0 days 00:00:13.713619,0.41227162317698013,block_16,512,5.1869750885925745e-05,cosine,0.3601819918310473,1024,8,13,adam,,0.0002920394532485778,0.8803826530612244,0.914923469387755,,,PRUNED
630,0.9447831632653061,2026-04-21 18:31:59.641906,2026-04-21 18:33:24.119955,0 days 00:01:24.478049,0.4738853681066568,block_16,1024,0.00025124355154667086,cosine,0.31649411023818047,1024,16,8,adam,,0.0007048712465871169,0.9447831632653061,,,,PRUNED
631,0.8776147959183673,2026-04-21 18:33:24.275537,2026-04-21 18:33:36.816990,0 days 00:00:12.541453,0.10403635381078731,block_12,1024,3.5506556949039956e-05,constant,0.5078488858716165,512,8,9,adam,,4.306795243004464e-06,0.8776147959183673,,,,PRUNED
632,0.8967346938775511,2026-04-21 18:33:36.979485,2026-04-21 18:33:49.403245,0 days 00:00:12.423760,0.496200935006673,block_12,1024,0.000118556572340365,cosine,0.15628332316842763,1024,16,7,adam,,0.002327427336764112,0.8967346938775511,,,,PRUNED
633,0.9107780612244898,2026-04-21 18:33:49.561030,2026-04-21 18:34:01.766323,0 days 00:00:12.205293,0.5701703005170318,block_16,256,9.109113167844294e-05,cosine,0.19392952208493716,256,4,6,adam,,0.0004852934526181553,0.8758928571428573,0.9107780612244898,,,PRUNED
634,0.7864158163265306,2026-04-21 18:34:01.924609,2026-04-21 18:34:09.986690,0 days 00:00:08.062081,0.5148332691363436,block_16,2048,4.926718762013115e-05,cosine,0.5615347128448346,128,8,10,adam,,1.9405642097477397e-06,0.7864158163265306,,,,PRUNED
635,0.6779846938775511,2026-04-21 18:34:10.160680,2026-04-21 18:34:22.551094,0 days 00:00:12.390414,0.001315566748704821,block_12,1024,1.9662422556658388e-05,cosine_warmup,0.43644576163397714,512,8,7,adam,7.0,1.5947404541426234e-06,0.6779846938775511,,,,PRUNED
636,0.9126658163265307,2026-04-21 18:34:22.699094,2026-04-21 18:34:37.823862,0 days 00:00:15.124768,0.5118545132345627,block_16,1024,9.994812122327931e-05,cosine,0.10621087879664431,1024,16,12,adam,,0.0042448500003872515,0.850344387755102,0.9126658163265307,,,PRUNED
637,0.9132142857142858,2026-04-21 18:34:38.008976,2026-04-21 18:34:50.883264,0 days 00:00:12.874288,0.43705431337514306,block_16,1024,0.00012119494645921996,cosine,0.3225878496471925,1024,16,9,adam,,0.009606888962543508,0.8524362244897958,0.9132142857142858,,,PRUNED
638,0.9179464285714285,2026-04-21 18:34:51.053614,2026-04-21 18:35:32.652552,0 days 00:00:41.598938,0.2895692322920444,block_12,2048,3.880828845446825e-05,cosine,0.45783221398374757,128,16,11,adam,,1.0001482009088175e-06,0.9179464285714285,,,,PRUNED
639,0.9513392857142857,2026-04-21 18:35:32.817252,2026-04-21 18:37:48.946496,0 days 00:02:16.129244,0.2952271854843177,block_16,1024,5.651053039316396e-05,cosine,0.4041335425610292,512,4,11,adam,,0.003783699915403491,0.9343494897959184,0.9481760204081632,,,COMPLETE
640,0.9023214285714286,2026-04-21 18:37:49.096707,2026-04-21 18:38:02.303610,0 days 00:00:13.206903,0.19177401566757252,block_16,1024,5.682765131250147e-05,cosine,0.5492967681801643,512,4,10,adam,,0.008985497414531408,0.9023214285714286,,,,PRUNED
641,0.9053061224489796,2026-04-21 18:38:02.472425,2026-04-21 18:38:14.935326,0 days 00:00:12.462901,0.13575027039756168,block_16,512,0.0002648006888627113,cosine_warmup,0.12351443048064933,1024,8,6,adam,10.0,0.003335391160625965,0.9053061224489796,,,,PRUNED
642,0.8325637755102041,2026-04-21 18:38:15.101911,2026-04-21 18:38:23.686789,0 days 00:00:08.584878,0.4782674316094753,block_16,2048,7.408190193689831e-05,cosine,0.3863052842517084,128,16,10,adam,,4.8049847655149175e-06,0.8325637755102041,,,,PRUNED
643,0.8167091836734693,2026-04-21 18:38:23.864215,2026-04-21 18:38:30.438051,0 days 00:00:06.573836,0.593187800757744,block_16,1024,1.4875622743977778e-05,cosine,0.11191900551529556,1024,4,8,adam,,0.002182853243583003,0.8167091836734693,,,,PRUNED
644,0.7298214285714286,2026-04-21 18:38:30.618399,2026-04-21 18:38:45.438840,0 days 00:00:14.820441,0.46053382123334224,block_16,1024,5.74028644142349e-05,cosine_warmup,0.13099914552067338,512,8,12,adam,14.0,0.003539114385190029,0.7298214285714286,,,,PRUNED
645,0.8311479591836735,2026-04-21 18:38:45.612571,2026-04-21 18:38:53.969094,0 days 00:00:08.356523,0.3025369216369266,block_16,1024,0.00011348393919710206,cosine,0.3170628434857605,512,4,14,adam,,0.007293438875571525,0.8311479591836735,,,,PRUNED
646,0.8079336734693877,2026-04-21 18:38:54.159311,2026-04-21 18:39:04.250254,0 days 00:00:10.090943,0.5315899442106109,block_16,2048,5.4383591440164196e-05,cosine,0.47550239618394047,512,2,14,adam,,0.0030538087328084744,0.8079336734693877,,,,PRUNED
647,0.9409183673469388,2026-04-21 18:39:04.454872,2026-04-21 18:40:29.505213,0 days 00:01:25.050341,0.4857653764709265,block_12,256,0.00024316851015502243,cosine,0.3331501753654233,512,2,12,adam,,0.0037395160870401845,0.9409183673469388,,,,PRUNED
648,0.8121428571428573,2026-04-21 18:40:29.646889,2026-04-21 18:40:36.551497,0 days 00:00:06.904608,0.18354525755104745,block_16,1024,3.5082805112044606e-05,cosine,0.3510634162542185,512,4,11,adam,,0.002902113244697169,0.8121428571428573,,,,PRUNED
649,0.8407525510204081,2026-04-21 18:40:36.706894,2026-04-21 18:40:44.016998,0 days 00:00:07.310104,0.31463961211236585,block_16,1024,0.00015722314197618353,cosine,0.47278225144419994,512,4,12,adam,,0.00028932227705705645,0.8407525510204081,,,,PRUNED
650,0.9072959183673469,2026-04-21 18:40:44.174732,2026-04-21 18:40:56.935139,0 days 00:00:12.760407,0.314067766971355,block_16,1024,3.084666276820002e-05,cosine,0.3061411214806382,64,4,10,adam,,0.00036367320111954215,0.9072959183673469,,,,PRUNED
651,0.9352678571428572,2026-04-21 18:40:57.090531,2026-04-21 18:41:28.761508,0 days 00:00:31.670977,0.5578755081844311,block_16,1024,0.00020827727718784997,constant,0.12955421273517606,1024,16,10,adam,,0.0006475760030114425,0.9159438775510205,0.9352678571428572,,,PRUNED
652,0.8056760204081632,2026-04-21 18:41:28.906880,2026-04-21 18:41:36.173815,0 days 00:00:07.266935,0.2929391539987752,block_16,2048,0.00021164364921137454,cosine,0.20071366333846694,1024,8,9,adam,,0.0008211018318784529,0.8056760204081632,,,,PRUNED
653,0.9308545918367347,2026-04-21 18:41:36.329781,2026-04-21 18:42:05.787087,0 days 00:00:29.457306,0.5103426153150383,block_16,256,0.00011120285987137978,cosine,0.40992886048016763,512,8,10,adam,,0.008095044963810942,0.9215306122448979,0.9308545918367347,,,PRUNED
654,0.8990433673469388,2026-04-21 18:42:05.939252,2026-04-21 18:42:19.093595,0 days 00:00:13.154343,0.4171735219391316,block_16,1024,4.0527672054952663e-05,cosine,0.42394794158058663,512,4,11,adam,,0.008723163706331655,0.8990433673469388,,,,PRUNED
655,0.9273469387755102,2026-04-21 18:42:19.242320,2026-04-21 18:42:48.931016,0 days 00:00:29.688696,0.5585814660954409,block_16,256,5.331763882222702e-05,cosine,0.48063524089169235,1024,2,10,adam,,0.0017576874507677003,0.8799872448979592,0.9154719387755103,0.9273469387755102,,PRUNED
656,0.8254081632653061,2026-04-21 18:42:49.077716,2026-04-21 18:42:57.737516,0 days 00:00:08.659800,0.20660999544568126,block_16,2048,2.2158500831660924e-05,constant,0.402078991727043,512,16,11,adam,,1.3593722955488463e-06,0.8254081632653061,,,,PRUNED
657,0.9315561224489796,2026-04-21 18:42:57.903462,2026-04-21 18:43:30.051856,0 days 00:00:32.148394,0.4308064744061563,block_16,256,0.00015708174163295977,cosine,0.416447017206698,512,16,13,adam,,0.006371260056003517,0.8786479591836734,0.9217474489795918,0.9315561224489796,,PRUNED
658,0.5929336734693879,2026-04-21 18:43:30.194339,2026-04-21 18:43:36.486947,0 days 00:00:06.292608,0.47071996877072586,block_16,1024,3.052360501671509e-05,cosine_warmup,0.25162727096381254,1024,8,9,adam,9.0,0.0020988442925718174,0.5929336734693879,,,,PRUNED
