number,value,datetime_start,datetime_complete,duration,params_lr,params_lr_scheduler,params_mlp_dropout,params_mlp_hidden_dim,params_optimizer_type,params_warmup_epochs,params_weight_decay,state
110,0.8802551020408163,2026-04-20 20:30:30.208760,2026-04-20 20:30:47.310579,0 days 00:00:17.101819,0.007360075042833498,cosine_warmup,0.17336096427888503,1024,adamw,8.0,2.8706586876192757e-05,PRUNED
111,0.9224999999999999,2026-04-20 20:30:47.443686,2026-04-20 20:31:21.534845,0 days 00:00:34.091159,0.008175332740271378,cosine_warmup,0.1520928420104116,1024,adamw,7.0,1.612408663027727e-05,PRUNED
112,0.9277678571428571,2026-04-20 20:31:21.695484,2026-04-20 20:32:23.941411,0 days 00:01:02.245927,0.005811294319842507,constant,0.18330914715521418,256,adamw,,3.029385819132032e-05,PRUNED
113,0.8821683673469388,2026-04-20 20:32:24.084097,2026-04-20 20:32:41.274719,0 days 00:00:17.190622,0.00560633405778612,cosine_warmup,0.13264585263252895,1024,adamw,6.0,0.00010545410816915242,PRUNED
114,0.9333035714285715,2026-04-20 20:32:41.413340,2026-04-20 20:33:53.852192,0 days 00:01:12.438852,0.008994387634666978,cosine_warmup,0.20522241040047606,1024,adamw,7.0,1.3209771840678912e-05,COMPLETE
115,0.4791836734693878,2026-04-20 20:33:53.982035,2026-04-20 20:34:11.150118,0 days 00:00:17.168083,2.9813310124094554e-05,cosine_warmup,0.11109977431553053,256,adamw,8.0,3.7513658645657706e-06,PRUNED
116,0.5687244897959184,2026-04-20 20:34:11.300083,2026-04-20 20:34:28.461904,0 days 00:00:17.161821,9.206495175075886e-05,constant,0.41731724399513226,512,adamw,,1.605635593803154e-05,PRUNED
117,0.8653826530612244,2026-04-20 20:34:28.594498,2026-04-20 20:34:45.708585,0 days 00:00:17.114087,0.006514896748894732,cosine_warmup,0.2269228739950617,256,adamw,7.0,4.944632650016032e-06,PRUNED
118,0.7946301020408163,2026-04-20 20:34:45.866069,2026-04-20 20:35:02.975893,0 days 00:00:17.109824,0.00035465691799027555,cosine,0.37149555719846344,1024,adam,,1.58110690488769e-05,PRUNED
119,0.4898469387755102,2026-04-20 20:35:03.100446,2026-04-20 20:35:20.233878,0 days 00:00:17.133432,2.3307358155052097e-05,cosine,0.13167623489811897,1024,adamw,,5.83512566574686e-05,PRUNED
120,0.8772321428571429,2026-04-20 20:35:20.378245,2026-04-20 20:35:37.485825,0 days 00:00:17.107580,0.0067834479611887585,cosine_warmup,0.3114238339626126,1024,adamw,8.0,1.2852424125332848e-05,PRUNED
121,0.8889030612244897,2026-04-20 20:35:37.624180,2026-04-20 20:35:54.793194,0 days 00:00:17.169014,0.007729101431004885,cosine_warmup,0.2323010516384615,1024,adamw,7.0,8.898110113321036e-06,PRUNED
122,0.9334566326530612,2026-04-20 20:35:54.938959,2026-04-20 20:37:06.991482,0 days 00:01:12.052523,0.00951288428329479,cosine_warmup,0.17579662279227712,1024,adamw,7.0,7.230602247400487e-05,COMPLETE
123,0.9103443877551021,2026-04-20 20:37:07.147355,2026-04-20 20:37:30.011935,0 days 00:00:22.864580,0.005962253054096135,cosine,0.3875472707733048,256,adam,,4.894275619879958e-05,PRUNED
124,0.8765497448979592,2026-04-20 20:37:30.161578,2026-04-20 20:37:47.435170,0 days 00:00:17.273592,0.0057766570903361155,cosine_warmup,0.2959081667296813,512,adamw,7.0,8.478452030574931e-05,PRUNED
125,0.5640880102040817,2026-04-20 20:37:47.581691,2026-04-20 20:38:04.834515,0 days 00:00:17.252824,0.00015351228374569894,constant,0.11700058511085143,128,adam,,0.000358192047805568,PRUNED
126,0.881811224489796,2026-04-20 20:38:04.983965,2026-04-20 20:38:22.217569,0 days 00:00:17.233604,0.0066534042485569085,cosine_warmup,0.11211021384076121,1024,adamw,8.0,0.00011056195677192815,PRUNED
127,0.8873469387755102,2026-04-20 20:38:22.360645,2026-04-20 20:38:39.467324,0 days 00:00:17.106679,0.008343395137655078,cosine_warmup,0.2478063215966641,1024,adamw,8.0,0.0002035186972207494,PRUNED
128,0.9267474489795918,2026-04-20 20:38:39.621936,2026-04-20 20:39:30.577557,0 days 00:00:50.955621,0.006135956254728919,cosine,0.29873372277259713,1024,adamw,,8.461422650732393e-06,PRUNED
129,0.902015306122449,2026-04-20 20:39:30.709664,2026-04-20 20:39:50.766504,0 days 00:00:20.056840,0.009316373009714532,cosine_warmup,0.1885674550150409,512,adamw,7.0,2.8779345407991e-05,PRUNED
130,0.7231122448979591,2026-04-20 20:39:50.909184,2026-04-20 20:40:08.069740,0 days 00:00:17.160556,0.0012673829611133736,cosine_warmup,0.11500729515499837,256,adamw,9.0,0.0007965093153603267,PRUNED
131,0.9328188775510204,2026-04-20 20:40:08.213699,2026-04-20 20:41:20.754493,0 days 00:01:12.540794,0.009806776538410444,cosine_warmup,0.21086576254052194,1024,adamw,6.0,8.955288072102925e-06,COMPLETE
132,0.8551913265306123,2026-04-20 20:41:20.889011,2026-04-20 20:41:38.022385,0 days 00:00:17.133374,0.0009668063552097282,cosine,0.20965630986024922,512,adam,,1.1174300954428922e-06,PRUNED
133,0.8982397959183674,2026-04-20 20:41:38.167955,2026-04-20 20:41:58.225757,0 days 00:00:20.057802,0.006853390087801922,cosine,0.521671556426101,512,adam,,3.2526267465523e-06,PRUNED
134,0.8472321428571428,2026-04-20 20:41:58.372566,2026-04-20 20:42:15.466378,0 days 00:00:17.093812,0.005220766896076688,cosine_warmup,0.223619141394739,128,adamw,7.0,5.572110104711223e-05,PRUNED
135,0.9331760204081633,2026-04-20 20:42:15.602440,2026-04-20 20:43:27.509729,0 days 00:01:11.907289,0.009436089059881697,cosine_warmup,0.16448228968391548,1024,adamw,6.0,0.00012740150195822696,COMPLETE
136,0.4844515306122449,2026-04-20 20:43:27.653424,2026-04-20 20:43:44.915255,0 days 00:00:17.261831,5.085589403945899e-05,cosine_warmup,0.42143259416098466,256,adam,7.0,7.381289705384942e-06,PRUNED
137,0.8880229591836736,2026-04-20 20:43:45.064485,2026-04-20 20:44:02.298145,0 days 00:00:17.233660,0.00821166573074885,cosine_warmup,0.2170536230869927,1024,adamw,8.0,7.918768648959955e-05,PRUNED
138,0.9333545918367347,2026-04-20 20:44:02.440356,2026-04-20 20:45:14.589994,0 days 00:01:12.149638,0.00818051259575955,cosine_warmup,0.16427846446028962,1024,adamw,5.0,0.00019389576071504862,COMPLETE
139,0.8504336734693878,2026-04-20 20:45:14.744411,2026-04-20 20:45:32.016869,0 days 00:00:17.272458,0.0039024888671128537,cosine_warmup,0.17848699853035643,1024,adam,4.0,0.00017544553619224795,PRUNED
140,0.81625,2026-04-20 20:45:32.153722,2026-04-20 20:45:49.312798,0 days 00:00:17.159076,0.0018931659261676686,cosine_warmup,0.38044501367058503,256,adamw,5.0,0.0007312263433938319,PRUNED
141,0.8916709183673469,2026-04-20 20:45:49.454406,2026-04-20 20:46:06.688412,0 days 00:00:17.234006,0.007756887521175083,cosine_warmup,0.15862739725446914,1024,adamw,5.0,6.801601534180346e-05,PRUNED
142,0.4885076530612245,2026-04-20 20:46:06.818846,2026-04-20 20:46:24.018840,0 days 00:00:17.199994,1.1758005002139138e-05,cosine_warmup,0.2384621284299271,128,adamw,6.0,0.00021434300395796834,PRUNED
143,0.5163137755102041,2026-04-20 20:46:24.160308,2026-04-20 20:46:41.372288,0 days 00:00:17.211980,0.00010286897430553773,constant,0.17733738708937483,128,adamw,,1.085405968335387e-05,PRUNED
144,0.8813137755102041,2026-04-20 20:46:41.520297,2026-04-20 20:46:58.740436,0 days 00:00:17.220139,0.007504516150472221,cosine_warmup,0.1669958797772481,1024,adamw,9.0,0.0006222626987474125,PRUNED
145,0.9336096938775511,2026-04-20 20:46:58.875944,2026-04-20 20:48:11.210698,0 days 00:01:12.334754,0.009611175066464547,cosine_warmup,0.10632515969241703,1024,adamw,7.0,0.0005935572233045856,COMPLETE
146,0.7656505102040817,2026-04-20 20:48:11.360433,2026-04-20 20:48:28.442218,0 days 00:00:17.081785,0.0008960932456257612,cosine_warmup,0.5564260291409994,1024,adamw,7.0,2.429934013818787e-06,PRUNED
147,0.9233673469387755,2026-04-20 20:48:28.582550,2026-04-20 20:49:02.513409,0 days 00:00:33.930859,0.00991596240377987,cosine,0.13413139841346672,1024,adamw,,0.0005758543269071491,PRUNED
148,0.8644897959183674,2026-04-20 20:49:02.663503,2026-04-20 20:49:19.844958,0 days 00:00:17.181455,0.0036835366258605516,cosine_warmup,0.10848020208270409,1024,adamw,8.0,0.0002349571651472327,PRUNED
149,0.926454081632653,2026-04-20 20:49:19.991230,2026-04-20 20:50:11.142727,0 days 00:00:51.151497,0.005497817796964719,cosine,0.11738033596367071,1024,adamw,,1.2497792639264538e-05,PRUNED
