number,value,datetime_start,datetime_complete,duration,params_attn_dropout,params_dim_feedforward,params_lr,params_lr_scheduler,params_mlp_dropout,params_mlp_hidden_dim,params_n_heads,params_num_layers,params_optimizer_type,params_warmup_epochs,params_weight_decay,system_attrs_completed_rung_0,system_attrs_completed_rung_1,system_attrs_completed_rung_2,system_attrs_completed_rung_3,state
170,0.9042729591836733,2026-04-20 20:30:09.298373,2026-04-20 20:30:21.297228,0 days 00:00:11.998855,0.25229741163784664,3072,7.169423027203182e-05,constant,0.20937551134742544,1024,8,5,adam,,0.00018697120050438794,0.8694005102040817,0.9042729591836733,,,PRUNED
171,0.7170216836734694,2026-04-20 20:30:21.462453,2026-04-20 20:30:36.719571,0 days 00:00:15.257118,0.09347123874420676,4096,0.0006462346439634377,constant,0.19559278646921935,1024,8,7,adam,,1.8333022283081403e-06,0.7170216836734694,,,,PRUNED
172,0.9111989795918367,2026-04-20 20:30:36.896137,2026-04-20 20:30:53.839113,0 days 00:00:16.942976,0.42669153702546714,4096,0.0002639834146903952,cosine_warmup,0.1592869805808974,1024,16,8,adam,4.0,0.005320579087962067,0.8367857142857144,0.9111989795918367,,,PRUNED
173,0.9014668367346939,2026-04-20 20:30:54.033671,2026-04-20 20:31:06.055753,0 days 00:00:12.022082,0.026297161048190052,1024,0.0009732956659856823,cosine_warmup,0.36667342166881,256,8,9,adam,4.0,0.00025776435939978316,0.8329209183673469,0.9014668367346939,,,PRUNED
174,0.9485841836734694,2026-04-20 20:31:06.205673,2026-04-20 20:32:26.761104,0 days 00:01:20.555431,0.12088950377673395,1024,0.0003103978293730503,cosine_warmup,0.4308493018553975,1024,4,5,adam,4.0,5.5879847661233175e-06,0.9171938775510204,0.9380739795918368,0.9485841836734694,,PRUNED
175,0.766377551020408,2026-04-20 20:32:26.913238,2026-04-20 20:32:33.100441,0 days 00:00:06.187203,0.20057667843550578,1024,0.002140805649431293,cosine_warmup,0.4916733391199441,1024,8,7,adam,5.0,3.7977642956171296e-06,0.766377551020408,,,,PRUNED
176,0.9459438775510205,2026-04-20 20:32:33.265061,2026-04-20 20:33:54.033449,0 days 00:01:20.768388,0.24054729298315183,2048,0.00013016550337304508,cosine_warmup,0.4523018920041008,1024,4,4,adam,3.0,3.237645579179152e-06,0.8819515306122448,0.9359566326530612,0.9459438775510205,,PRUNED
177,0.9443622448979592,2026-04-20 20:33:54.164626,2026-04-20 20:35:14.551078,0 days 00:01:20.386452,0.08805589011024115,1024,0.00034551816035669494,cosine_warmup,0.3242988454524983,1024,4,5,adam,7.0,1.348289689997824e-06,0.9115561224489797,0.9404974489795919,0.9443622448979592,,PRUNED
178,0.9440051020408163,2026-04-20 20:35:14.700684,2026-04-20 20:36:33.900004,0 days 00:01:19.199320,0.12857253983274985,1024,0.0001471618495822245,cosine_warmup,0.5852255404058792,1024,4,2,adam,4.0,1.714577923185252e-06,0.9377933673469387,0.9440051020408163,,,PRUNED
179,0.9540688775510204,2026-04-20 20:36:34.059576,2026-04-20 20:38:30.981929,0 days 00:01:56.922353,0.17368010398336428,1024,0.00026777645380258905,cosine_warmup,0.44438898266377325,1024,16,6,adam,10.0,7.079781318529977e-06,0.9360204081632653,0.9525127551020408,,,COMPLETE
180,0.9049362244897958,2026-04-20 20:38:31.110800,2026-04-20 20:38:44.736574,0 days 00:00:13.625774,0.26181580655566394,3072,0.00018912874199034552,constant,0.10497178868901949,128,8,7,adam,,0.00014860208911338194,0.8353571428571428,0.9049362244897958,,,PRUNED
181,0.9338010204081633,2026-04-20 20:38:44.887813,2026-04-20 20:39:13.582795,0 days 00:00:28.694982,0.13415899992570415,1024,0.0006801573780154433,cosine_warmup,0.5101472333111974,1024,16,3,adam,10.0,2.1740036311521225e-05,0.9078571428571428,0.9338010204081633,,,PRUNED
182,0.9310586734693878,2026-04-20 20:39:13.710011,2026-04-20 20:39:43.378321,0 days 00:00:29.668310,0.06065022959771721,1024,0.0013925888255842444,cosine_warmup,0.37176279129166906,1024,4,10,adam,10.0,2.023090196291917e-05,0.9310586734693878,,,,PRUNED
183,0.9331887755102041,2026-04-20 20:39:43.555689,2026-04-20 20:40:12.557319,0 days 00:00:29.001630,0.22180530505401644,1024,0.0002546273588342078,cosine_warmup,0.4365015821639182,512,16,5,adam,10.0,5.549042975690927e-05,0.9331887755102041,,,,PRUNED
184,0.9466326530612243,2026-04-20 20:40:12.703882,2026-04-20 20:41:33.082738,0 days 00:01:20.378856,0.09850544018943229,1024,0.00016723021078162207,cosine_warmup,0.3588269390961646,1024,16,7,adam,9.0,1.4064445752749927e-05,0.9348852040816327,0.9466326530612243,,,PRUNED
185,0.9287627551020408,2026-04-20 20:41:33.241857,2026-04-20 20:42:02.354279,0 days 00:00:29.112422,0.016169472450652783,1024,4.39205778042167e-05,cosine_warmup,0.2960983863506314,1024,16,6,adam,9.0,2.4342043172548515e-05,0.9287627551020408,,,,PRUNED
186,0.7939668367346938,2026-04-20 20:42:02.512672,2026-04-20 20:42:15.224765,0 days 00:00:12.712093,0.18943746413575802,1024,0.00037905681015066033,cosine,0.5395505606924367,128,4,11,adam,,2.853211984741738e-05,0.7939668367346938,,,,PRUNED
187,0.9275382653061225,2026-04-20 20:42:15.382941,2026-04-20 20:42:44.545074,0 days 00:00:29.162133,0.09720265034801695,2048,6.0698016416747147e-05,cosine_warmup,0.5999652347225622,1024,16,6,adam,9.0,3.6297806593237735e-06,0.9275382653061225,,,,PRUNED
188,0.7585714285714287,2026-04-20 20:42:44.699967,2026-04-20 20:43:26.085403,0 days 00:00:41.385436,0.1091296357260404,4096,0.0027049833636456915,cosine_warmup,0.23735490455736877,1024,16,8,adam,10.0,1.8354936200328064e-05,0.894859693877551,0.7585714285714287,,,PRUNED
189,0.9351530612244898,2026-04-20 20:43:26.268233,2026-04-20 20:43:55.651646,0 days 00:00:29.383413,0.24067817893238463,1024,0.0003629905369679113,cosine_warmup,0.418087436943589,1024,16,7,adam,9.0,3.521184503145336e-05,0.9136607142857143,0.9351530612244898,,,PRUNED
190,0.9351275510204082,2026-04-20 20:43:55.799609,2026-04-20 20:44:24.973658,0 days 00:00:29.174049,0.29766926717046,1024,0.00016062725242439567,cosine_warmup,0.514520121217334,1024,4,7,adam,8.0,4.866643711100246e-06,0.8881249999999999,0.9351275510204082,,,PRUNED
191,0.7943494897959184,2026-04-20 20:44:25.128753,2026-04-20 20:44:32.999039,0 days 00:00:07.870286,0.1540324096585483,2048,0.0003168864083984458,cosine,0.5703047485284001,512,8,11,adam,,9.302113669122412e-06,0.7943494897959184,,,,PRUNED
192,0.613813775510204,2026-04-20 20:44:33.157681,2026-04-20 20:44:41.480342,0 days 00:00:08.322661,0.023055538534664882,2048,1.6693104747848515e-05,cosine_warmup,0.2695833184555197,1024,8,12,adamw,8.0,0.0023681623505747897,0.613813775510204,,,,PRUNED
193,0.7123214285714285,2026-04-20 20:44:41.654249,2026-04-20 20:44:48.907682,0 days 00:00:07.253433,0.20584558153895216,3072,0.00015765761417103625,cosine_warmup,0.3448813493809745,1024,16,7,adam,7.0,1.998137701335014e-06,0.7123214285714285,,,,PRUNED
194,0.657295918367347,2026-04-20 20:44:49.082590,2026-04-20 20:44:56.122616,0 days 00:00:07.040026,0.01333993735628303,2048,0.00019635218632172,cosine_warmup,0.24841312921286826,512,8,9,adam,10.0,0.00219020510425771,0.657295918367347,,,,PRUNED
195,0.7699426020408163,2026-04-20 20:44:56.274639,2026-04-20 20:45:10.658649,0 days 00:00:14.384010,0.06359414777813137,2048,0.0007925076945693173,cosine,0.19093045972664485,256,8,10,adam,,8.13730930411354e-05,0.7699426020408163,,,,PRUNED
196,0.9308801020408164,2026-04-20 20:45:10.828885,2026-04-20 20:45:40.046616,0 days 00:00:29.217731,0.09276321583531495,1024,0.0011450426009589477,cosine_warmup,0.49083285240412,1024,4,6,adam,3.0,1.0804086601646551e-05,0.905701530612245,0.9308801020408164,,,PRUNED
197,0.787704081632653,2026-04-20 20:45:40.188791,2026-04-20 20:45:47.073447,0 days 00:00:06.884656,0.29196876451808973,1024,0.0005480070008776621,cosine,0.17369023367365086,128,8,12,adam,,1.8100309957790028e-05,0.787704081632653,,,,PRUNED
198,0.946811224489796,2026-04-20 20:45:47.234779,2026-04-20 20:47:07.626758,0 days 00:01:20.391979,0.14360418902708255,1024,0.0014136015083371068,cosine_warmup,0.358564928139948,1024,16,7,adam,6.0,2.667022509369892e-06,0.946811224489796,,,,PRUNED
199,0.8108163265306121,2026-04-20 20:47:07.785972,2026-04-20 20:47:14.327450,0 days 00:00:06.541478,0.12379913376161558,1024,0.00018418763471801577,cosine_warmup,0.3332549064050436,1024,16,10,adam,6.0,3.7578898300052887e-06,0.8108163265306121,,,,PRUNED
200,0.793686224489796,2026-04-20 20:47:14.492487,2026-04-20 20:47:20.681017,0 days 00:00:06.188530,0.08517481896592942,1024,0.0019082149407615397,cosine_warmup,0.2791771303787952,1024,16,8,adamw,6.0,6.394555450729347e-05,0.793686224489796,,,,PRUNED
201,0.9310076530612245,2026-04-20 20:47:20.833038,2026-04-20 20:47:49.703898,0 days 00:00:28.870860,0.24159931673180923,1024,5.927952959833782e-05,cosine_warmup,0.36196346791339296,1024,16,4,adam,6.0,2.0414639311114276e-06,0.9310076530612245,,,,PRUNED
202,0.898329081632653,2026-04-20 20:47:49.856924,2026-04-20 20:48:05.022193,0 days 00:00:15.165269,0.10686053104625115,2048,0.00011109594379619688,cosine,0.41966600729914927,128,4,11,adam,,4.764298823223033e-05,0.8335969387755102,0.898329081632653,,,PRUNED
203,0.795765306122449,2026-04-20 20:48:05.198583,2026-04-20 20:48:13.756535,0 days 00:00:08.557952,0.12700563923626526,4096,5.896981848679984e-05,constant,0.19826661174414756,128,8,8,adam,,1.740591593324557e-05,0.795765306122449,,,,PRUNED
204,0.742359693877551,2026-04-20 20:48:13.937307,2026-04-20 20:48:22.206453,0 days 00:00:08.269146,0.26737753138893633,2048,0.00040597528607414505,cosine,0.4862462397522013,256,8,12,adam,,2.4174727170633117e-06,0.742359693877551,,,,PRUNED
205,0.9282397959183672,2026-04-20 20:48:22.370143,2026-04-20 20:49:01.540388,0 days 00:00:39.170245,0.07604901603274938,2048,1.9526468907354957e-05,constant,0.2913866601522274,512,8,12,adam,,0.00046445626880953385,0.899591836734694,0.9282397959183672,,,PRUNED
206,0.9453954081632652,2026-04-20 20:49:01.706022,2026-04-20 20:50:31.609612,0 days 00:01:29.903590,0.18659333910767673,1024,0.001213040439665991,constant,0.16665899735985007,1024,8,12,adam,,0.0002751831452000899,0.9453954081632652,,,,PRUNED
207,0.5,2026-04-20 20:50:31.750959,2026-04-20 20:51:00.242557,0 days 00:00:28.491598,0.10731889647770979,1024,0.0053660894462807,cosine_warmup,0.2883329539311695,1024,16,6,adam,7.0,6.049415133517416e-06,0.5,,,,PRUNED
208,0.8233163265306124,2026-04-20 20:51:00.374124,2026-04-20 20:51:12.071821,0 days 00:00:11.697697,0.15732325752169454,1024,8.491706710004617e-05,cosine_warmup,0.4615523264302059,256,4,6,adam,8.0,0.007478001466377881,0.8233163265306124,,,,PRUNED
209,0.8395408163265305,2026-04-20 20:51:12.215320,2026-04-20 20:51:26.993311,0 days 00:00:14.777991,0.11299935199973248,2048,5.798392133867969e-05,cosine_warmup,0.16323695978247862,128,8,11,adamw,5.0,0.0008156589753433672,0.8395408163265305,,,,PRUNED
210,0.9302168367346938,2026-04-20 20:51:27.160968,2026-04-20 20:51:55.752221,0 days 00:00:28.591253,0.32953495485337364,1024,0.0006443242294073792,cosine_warmup,0.3799130263912377,1024,4,4,adamw,7.0,0.0037175951070490335,0.8356250000000001,0.9131887755102042,0.9302168367346938,,PRUNED
211,0.6089285714285715,2026-04-20 20:51:55.884091,2026-04-20 20:52:03.610119,0 days 00:00:07.726028,0.0074721667604798064,2048,4.990492103959236e-05,cosine_warmup,0.45380175281694,512,4,11,adam,9.0,0.0010369078809247618,0.6089285714285715,,,,PRUNED
212,0.695076530612245,2026-04-20 20:52:03.776569,2026-04-20 20:52:09.741889,0 days 00:00:05.965320,0.3463799836212522,1024,0.0002047331638451942,cosine_warmup,0.29213490356002847,256,4,5,adam,4.0,0.007635967900661258,0.695076530612245,,,,PRUNED
213,0.9380994897959184,2026-04-20 20:52:09.883272,2026-04-20 20:52:39.892957,0 days 00:00:30.009685,0.2864718800445128,4096,7.298359904796342e-05,cosine,0.2943889458012767,1024,4,5,adam,,0.000762104883494395,0.878048469387755,0.9155357142857142,0.9380994897959184,,PRUNED
214,0.9274234693877551,2026-04-20 20:52:40.035025,2026-04-20 20:53:22.819084,0 days 00:00:42.784059,0.25039269882133036,4096,4.479957854182753e-05,cosine_warmup,0.24884080009305307,1024,4,9,adam,4.0,0.009046582024914401,0.8928061224489796,0.9274234693877551,,,PRUNED
215,0.6614923469387755,2026-04-20 20:53:22.983204,2026-04-20 20:53:29.021458,0 days 00:00:06.038254,0.36020707053952083,4096,4.1333512502086585e-05,cosine_warmup,0.24965705122401177,1024,4,4,adam,4.0,0.0006714330832347148,0.6614923469387755,,,,PRUNED
216,0.9469642857142857,2026-04-20 20:53:29.165260,2026-04-20 20:54:47.790075,0 days 00:01:18.624815,0.2741345341837582,1024,0.0005478274792913858,constant,0.4154274313300067,1024,16,7,adam,,4.1873276469922705e-06,0.9124617346938776,0.9363775510204081,0.9469642857142857,,PRUNED
217,0.8552295918367346,2026-04-20 20:54:47.934366,2026-04-20 20:54:59.775425,0 days 00:00:11.841059,0.0690157851074444,1024,0.00041244721588791,cosine,0.43889785021236327,128,16,8,adam,,0.0004270464397866597,0.8552295918367346,,,,PRUNED
218,0.9344005102040817,2026-04-20 20:54:59.914877,2026-04-20 20:55:28.684350,0 days 00:00:28.769473,0.12677716747832793,1024,0.0008588695250650951,cosine_warmup,0.4081773366534263,1024,16,6,adam,7.0,1.212595054125197e-06,0.8558035714285714,0.9122321428571428,0.9344005102040817,,PRUNED
219,0.710561224489796,2026-04-20 20:55:28.814677,2026-04-20 20:55:34.780974,0 days 00:00:05.966297,0.3026204629066228,1024,0.0005898166287073052,constant,0.42095718422496503,1024,16,7,adam,,3.25634777605731e-05,0.710561224489796,,,,PRUNED
220,0.9337372448979592,2026-04-20 20:55:34.926758,2026-04-20 20:56:03.332378,0 days 00:00:28.405620,0.3932826915860226,1024,0.00033972124802182646,cosine,0.5017518341788005,1024,16,7,adam,,1.4407559759644797e-06,0.855140306122449,0.9130229591836735,0.9337372448979592,,PRUNED
221,0.8250255102040817,2026-04-20 20:56:03.470583,2026-04-20 20:56:10.225277,0 days 00:00:06.754694,0.23042380897267642,1024,0.0002563867520395387,constant,0.1778137511724014,128,8,12,adamw,,1.2377064725447765e-05,0.8250255102040817,,,,PRUNED
222,0.8991581632653061,2026-04-20 20:56:10.368572,2026-04-20 20:56:23.727050,0 days 00:00:13.358478,0.2595162844422682,3072,1.9849276890301563e-05,constant,0.13883527945964014,128,4,7,adam,,2.676884723743025e-06,0.8576147959183673,0.8991581632653061,,,PRUNED
223,0.8124234693877551,2026-04-20 20:56:23.883510,2026-04-20 20:56:31.903468,0 days 00:00:08.019958,0.1585700596295356,3072,9.540097394186867e-05,cosine_warmup,0.12510088272960543,128,4,9,adam,3.0,9.797042595103567e-05,0.8124234693877551,,,,PRUNED
224,0.5601913265306122,2026-04-20 20:56:32.064539,2026-04-20 20:56:38.314218,0 days 00:00:06.249679,0.09543622981909156,1024,0.001318973995928643,cosine,0.42286970436931154,128,4,10,adam,,0.00024442963644161485,0.5601913265306122,,,,PRUNED
225,0.9294897959183673,2026-04-20 20:56:38.456971,2026-04-20 20:57:07.014336,0 days 00:00:28.557365,0.007765334283901337,1024,2.6782437139713037e-05,cosine_warmup,0.299550579990012,256,8,8,adamw,4.0,0.0005399415486344925,0.9294897959183673,,,,PRUNED
226,0.7967219387755101,2026-04-20 20:57:07.149556,2026-04-20 20:57:15.694533,0 days 00:00:08.544977,0.2359787086925954,4096,0.0009117742985525486,cosine_warmup,0.5043555414622963,1024,16,8,adam,3.0,2.912390240701834e-06,0.7967219387755101,,,,PRUNED
227,0.6355165816326531,2026-04-20 20:57:15.851692,2026-04-20 20:57:21.864729,0 days 00:00:06.013037,0.2500339369577605,1024,0.001525138218261643,constant,0.4686165745212256,128,16,6,adam,,4.077383745882083e-06,0.6355165816326531,,,,PRUNED
228,0.671313775510204,2026-04-20 20:57:21.994263,2026-04-20 20:57:28.133588,0 days 00:00:06.139325,0.2713539099225045,1024,0.0003949851916274954,cosine_warmup,0.34942903710379397,128,4,8,adam,5.0,0.009117803563593686,0.671313775510204,,,,PRUNED
229,0.9447959183673469,2026-04-20 20:57:28.276350,2026-04-20 20:59:09.566132,0 days 00:01:41.289782,0.4409551461017826,4096,0.0003083418143373076,cosine_warmup,0.21635932095210064,1024,4,7,adam,6.0,0.005295738786409636,0.9018367346938776,0.9366964285714285,0.9447959183673469,,PRUNED
230,0.629234693877551,2026-04-20 20:59:09.720823,2026-04-20 20:59:16.969655,0 days 00:00:07.248832,0.022327899941298725,2048,3.104820916515456e-05,cosine_warmup,0.31006577474878705,256,4,10,adam,8.0,0.00514771611986644,0.629234693877551,,,,PRUNED
231,0.9401658163265307,2026-04-20 20:59:17.118820,2026-04-20 21:00:36.549438,0 days 00:01:19.430618,0.15526522554140285,1024,0.00022064828118855326,cosine_warmup,0.5034586651440399,256,16,6,adam,3.0,7.387995182863171e-06,0.9401658163265307,,,,PRUNED
232,0.946109693877551,2026-04-20 21:00:36.683650,2026-04-20 21:01:54.599237,0 days 00:01:17.915587,0.033449552530302726,2048,0.00011698396244050022,cosine_warmup,0.4268429282350537,1024,4,4,adam,3.0,4.07579210444302e-05,0.9361479591836734,0.946109693877551,,,PRUNED
233,0.7285586734693877,2026-04-20 21:01:54.729805,2026-04-20 21:02:00.644207,0 days 00:00:05.914402,0.06639366773504783,2048,0.0001877387449515301,cosine_warmup,0.3343762253533406,1024,4,3,adam,3.0,0.000639278368460174,0.7285586734693877,,,,PRUNED
234,0.8259948979591837,2026-04-20 21:02:00.772742,2026-04-20 21:02:16.273520,0 days 00:00:15.500778,0.0027378048654015733,2048,2.5305079858066675e-05,cosine_warmup,0.21118586545649648,512,8,12,adamw,4.0,0.005616124602454498,0.8259948979591837,,,,PRUNED
235,0.9315433673469389,2026-04-20 21:02:16.422564,2026-04-20 21:02:55.946193,0 days 00:00:39.523629,0.25107674907271826,4096,0.00034155263320250433,cosine_warmup,0.4688757891992935,1024,4,8,adam,3.0,0.0008694237269923688,0.9059821428571428,0.9315433673469389,,,PRUNED
236,0.9022193877551021,2026-04-20 21:02:56.106042,2026-04-20 21:03:12.090087,0 days 00:00:15.984045,0.0714999532841982,2048,9.19499630368495e-05,cosine,0.4427599621238716,256,16,12,adam,,2.994490349054137e-05,0.8333545918367347,0.9022193877551021,,,PRUNED
237,0.9351020408163265,2026-04-20 21:03:12.244128,2026-04-20 21:03:40.220166,0 days 00:00:27.976038,0.2612898592862079,1024,0.000322462490081708,constant,0.40820326147094155,1024,16,2,adam,,1.1431400357182553e-06,0.8650765306122449,0.9206505102040816,0.9351020408163265,,PRUNED
238,0.7591581632653063,2026-04-20 21:03:40.359255,2026-04-20 21:03:51.852700,0 days 00:00:11.493445,0.371402031993478,1024,0.0008835333364356461,cosine,0.11447972833682746,256,4,7,adam,,0.006825201093771672,0.7591581632653063,,,,PRUNED
239,0.7820790816326532,2026-04-20 21:03:51.985723,2026-04-20 21:03:58.244121,0 days 00:00:06.258398,0.21347541745016513,2048,0.0005587590706973159,constant,0.42487834681282216,1024,16,6,adam,,1.4710943355210289e-06,0.7820790816326532,,,,PRUNED
240,0.6117984693877551,2026-04-20 21:03:58.387131,2026-04-20 21:04:06.064606,0 days 00:00:07.677475,0.04527355471821516,2048,1.993108896742177e-05,cosine_warmup,0.3677918962172678,512,8,11,adam,4.0,0.0023929466864642444,0.6117984693877551,,,,PRUNED
241,0.9434821428571428,2026-04-20 21:04:06.209224,2026-04-20 21:05:25.908459,0 days 00:01:19.699235,0.15653364421164898,1024,0.00023291657929933938,cosine,0.1387665491256722,1024,8,9,adam,,4.0737905841816866e-05,0.916530612244898,0.9356760204081632,0.9434821428571428,,PRUNED
242,0.8006505102040816,2026-04-20 21:05:26.044237,2026-04-20 21:05:32.140249,0 days 00:00:06.096012,0.033335491501506644,2048,0.0004514038782140808,cosine_warmup,0.4127134939943314,1024,4,4,adam,3.0,3.663878959202154e-05,0.8006505102040816,,,,PRUNED
243,0.7314158163265305,2026-04-20 21:05:32.262298,2026-04-20 21:05:38.435752,0 days 00:00:06.173454,0.4513436569102889,2048,9.107376343748421e-05,cosine_warmup,0.3741899188338979,1024,4,6,adam,4.0,2.4167897775385948e-06,0.7314158163265305,,,,PRUNED
244,0.672015306122449,2026-04-20 21:05:38.587506,2026-04-20 21:05:44.567292,0 days 00:00:05.979786,0.013235709899381876,4096,5.3899563664216126e-05,cosine_warmup,0.3783684020617683,1024,4,3,adamw,3.0,9.636393691327186e-06,0.672015306122449,,,,PRUNED
245,0.9356122448979591,2026-04-20 21:05:44.710560,2026-04-20 21:06:13.569115,0 days 00:00:28.858555,0.06293194893750612,4096,0.0006627600360890157,cosine_warmup,0.4633477200141308,512,4,4,adam,3.0,2.3057041332739805e-05,0.8631377551020407,0.9175,0.9356122448979591,,PRUNED
246,0.6328571428571429,2026-04-20 21:06:13.715148,2026-04-20 21:06:19.701495,0 days 00:00:05.986347,0.1552224536470158,2048,6.45154191193075e-05,cosine_warmup,0.3492275543570572,512,4,3,adam,3.0,1.4845590919970094e-05,0.6328571428571429,,,,PRUNED
247,0.9255229591836736,2026-04-20 21:06:19.839889,2026-04-20 21:06:48.666926,0 days 00:00:28.827037,0.3604497910325284,1024,0.0008088763043963945,constant,0.4223126272307726,1024,16,8,adamw,,4.520825053719396e-06,0.9255229591836736,,,,PRUNED
248,0.7044260204081632,2026-04-20 21:06:48.807792,2026-04-20 21:07:00.422016,0 days 00:00:11.614224,0.20465891313368584,2048,2.448191758830614e-05,cosine_warmup,0.4402817552523211,1024,4,4,adam,9.0,2.714067140884176e-05,0.7044260204081632,,,,PRUNED
249,0.6511862244897959,2026-04-20 21:07:00.555028,2026-04-20 21:07:07.170767,0 days 00:00:06.615739,0.05406411849034539,1024,8.936675093350533e-05,cosine_warmup,0.1833884094591389,512,16,11,adamw,3.0,0.0020304360736533955,0.6511862244897959,,,,PRUNED
250,0.9114030612244898,2026-04-20 21:07:07.318469,2026-04-20 21:07:18.831378,0 days 00:00:11.512909,0.15516351991605395,2048,7.939589260439484e-05,constant,0.5801953212200835,1024,4,4,adam,,1.0138097079644668e-06,0.8615433673469387,0.9114030612244898,,,PRUNED
