number,value,datetime_start,datetime_complete,duration,params_attn_dropout,params_clip_layer,params_dim_feedforward,params_lr,params_lr_scheduler,params_mlp_dropout,params_mlp_hidden_dim,params_n_heads,params_num_layers,params_optimizer_type,params_weight_decay,state
189,0.7412425644415069,2026-04-28 15:02:14.363020,2026-04-28 15:02:40.307412,0 days 00:00:25.944392,0.3847072850248975,block_12,1024,2.7111181727066448e-05,cosine,0.022857996676546748,1024,8,9,adam,0.0007614064870998983,PRUNED
190,0.6982815598149372,2026-04-28 15:02:40.451670,2026-04-28 15:03:06.089063,0 days 00:00:25.637393,0.23237299665278752,block_16,1024,3.4364962000109054e-05,cosine,0.0016249926774331153,2048,2,8,adam,1.7156805225585194e-05,PRUNED
191,0.7438697951090547,2026-04-28 15:03:06.223413,2026-04-28 15:03:32.192567,0 days 00:00:25.969154,0.22221561665854017,block_12,1024,2.6953066684461522e-05,cosine,0.10017587185439708,1024,8,10,adam,4.469896235248416e-06,PRUNED
192,0.7554857898215465,2026-04-28 15:03:32.331658,2026-04-28 15:05:48.362997,0 days 00:02:16.031339,0.31444924365736704,block_12,1024,4.936959903261925e-05,cosine,0.011784080705837958,512,8,11,adam,8.527790837210715e-06,COMPLETE
193,0.7447290152015862,2026-04-28 15:05:48.513339,2026-04-28 15:06:15.118620,0 days 00:00:26.605281,0.29605819212515516,block_12,1024,2.932665620193664e-05,cosine,0.046030305566607775,512,8,10,adam,4.880210712983642e-06,PRUNED
194,0.6371777924653007,2026-04-28 15:06:15.290587,2026-04-28 15:06:41.743614,0 days 00:00:26.453027,0.20846001641779774,block_20,1024,0.00014917449721664158,cosine,0.14199070426464508,1024,16,7,adam,1.5681433235320304e-05,PRUNED
195,0.7212161269001984,2026-04-28 15:06:41.924493,2026-04-28 15:09:22.730150,0 days 00:02:40.805657,0.5522139350717906,block_12,1024,0.0002740116397699432,cosine,0.043657335220360555,1024,32,13,adam,2.9619742377490626e-05,COMPLETE
196,0.6816424322538003,2026-04-28 15:09:22.885556,2026-04-28 15:09:49.448712,0 days 00:00:26.563156,0.376381369707203,block_20,1024,5.2165736301815836e-05,cosine,0.08410498634424919,1024,8,10,adam,9.88784970839627e-05,PRUNED
197,0.7598479841374752,2026-04-28 15:09:49.611909,2026-04-28 15:10:23.774705,0 days 00:00:34.162796,0.3819959383623427,block_12,1024,0.0001339572762573923,cosine,0.020420802371631817,512,8,13,adam,7.530824606530605e-05,PRUNED
198,0.7523959021810972,2026-04-28 15:10:23.933430,2026-04-28 15:10:50.115256,0 days 00:00:26.181826,0.3667492677660818,block_12,1024,9.140996379971193e-05,cosine,0.1464091097877117,2048,16,7,adam,9.519204648181788e-06,PRUNED
199,0.7487607402511567,2026-04-28 15:10:50.272937,2026-04-28 15:11:23.263624,0 days 00:00:32.990687,0.21355636744797096,block_12,1024,3.790257087987892e-05,cosine,0.003595501517687664,1024,8,12,adam,3.875553246139406e-06,PRUNED
200,0.715300727032386,2026-04-28 15:11:23.413348,2026-04-28 15:11:52.699382,0 days 00:00:29.286034,0.2603305005841961,block_16,1024,4.3601721890997275e-05,cosine,0.019164975663236085,512,8,13,adam,1.544996951381439e-06,PRUNED
201,0.7393093192333112,2026-04-28 15:11:52.857809,2026-04-28 15:14:14.424382,0 days 00:02:21.566573,0.3506105232019273,block_12,1024,0.00022180558516232527,cosine,0.005077292425615047,1024,32,9,adam,6.9066497269400594e-06,COMPLETE
202,0.7340879048248514,2026-04-28 15:14:14.566740,2026-04-28 15:16:27.168190,0 days 00:02:12.601450,0.2305151894558316,block_12,1024,0.00017326951652274467,cosine,0.005468254959433622,1024,32,7,adam,5.757774963733026e-06,COMPLETE
203,0.7492399206873761,2026-04-28 15:16:27.303042,2026-04-28 15:16:54.707545,0 days 00:00:27.404503,0.2608670127960326,block_12,1024,6.793578058983614e-05,cosine,0.06562076520763628,3072,32,9,adamw,5.495933037897954e-05,PRUNED
204,0.6307997356245869,2026-04-28 15:16:54.873166,2026-04-28 15:17:23.192133,0 days 00:00:28.318967,0.22835220441137352,pre_proj,1024,3.0458473497743427e-05,cosine,0.01110174012278052,1024,8,12,adam,0.0018367868086431483,PRUNED
205,0.7407633840052875,2026-04-28 15:17:23.359293,2026-04-28 15:19:51.032879,0 days 00:02:27.673586,0.3188457653499743,block_12,1024,7.843817295173073e-05,cosine,0.07807046054379008,512,8,13,adam,2.221948768717888e-06,COMPLETE
206,0.7358889623265036,2026-04-28 15:19:51.173538,2026-04-28 15:22:10.691977,0 days 00:02:19.518439,0.5025206105129547,block_12,1024,0.00014629058824526214,cosine,0.13517142229142415,1024,8,11,adam,1.3251984826447137e-06,COMPLETE
207,0.7428949107732982,2026-04-28 15:22:10.837866,2026-04-28 15:24:24.984189,0 days 00:02:14.146323,0.30235726782759614,block_12,1024,6.8175356899703e-05,cosine,0.025603255782456827,1024,8,10,adam,0.00012144594166844929,COMPLETE
208,0.7390945142101785,2026-04-28 15:24:25.136259,2026-04-28 15:24:51.159041,0 days 00:00:26.022782,0.2266395144833748,block_12,1024,3.590659826372982e-05,cosine,0.10633714969552871,512,2,7,adamw,0.00010411963332191204,PRUNED
209,0.721629213483146,2026-04-28 15:24:51.317021,2026-04-28 15:27:01.047473,0 days 00:02:09.730452,0.20777294315069522,block_12,1024,0.00019064202038717164,cosine,0.2042214115020805,1024,8,6,adam,6.546006229728737e-06,COMPLETE
210,0.7328321216126901,2026-04-28 15:27:01.188278,2026-04-28 15:29:25.505511,0 days 00:02:24.317233,0.61961910384504,block_12,1024,6.364056343352119e-05,cosine,0.042384285505745134,1024,16,12,adam,2.0541366079689674e-06,COMPLETE
211,0.7332782551222736,2026-04-28 15:29:25.651508,2026-04-28 15:31:36.237231,0 days 00:02:10.585723,0.2151103765630997,block_12,1024,0.00010287764905697623,cosine,0.05057809844705527,512,2,8,adam,4.7536387207543256e-06,COMPLETE
212,0.7439689358889623,2026-04-28 15:31:36.382036,2026-04-28 15:33:45.671469,0 days 00:02:09.289433,0.21374501824934602,block_12,1024,0.00012250636835968974,cosine,0.013838608894409916,1024,2,7,adam,4.6480279126909034e-06,COMPLETE
213,0.6207204230006609,2026-04-28 15:33:45.809244,2026-04-28 15:34:13.933841,0 days 00:00:28.124597,0.21749934838110838,pre_proj,1024,6.353639779090481e-05,cosine,0.005598983343072068,1024,8,12,adam,4.887589480368408e-06,PRUNED
214,0.721629213483146,2026-04-28 15:34:14.082091,2026-04-28 15:36:29.461486,0 days 00:02:15.379395,0.4540581545152313,block_12,1024,0.00019521051356042107,cosine,0.06507705409888545,1024,2,11,adam,3.763386155694319e-06,COMPLETE
215,0.7385327164573695,2026-04-28 15:36:29.592706,2026-04-28 15:38:40.273287,0 days 00:02:10.680581,0.29075790153060876,block_12,1024,0.00011664165246166107,cosine,0.008890247593844536,1024,2,9,adam,2.3933326142192383e-06,COMPLETE
216,0.755204890945142,2026-04-28 15:38:40.405043,2026-04-28 15:39:10.682727,0 days 00:00:30.277684,0.22257026676285896,block_12,1024,3.735475999733757e-05,cosine,0.06117059974706883,1024,2,8,adam,3.3276576120098793e-06,PRUNED
217,0.720687376074025,2026-04-28 15:39:10.848620,2026-04-28 15:41:21.505303,0 days 00:02:10.656683,0.2844843851577372,block_12,1024,0.00024146248231813382,cosine,0.1904695526954983,1024,32,7,adam,1.1089978072701343e-06,COMPLETE
218,0.7467944481163253,2026-04-28 15:41:21.649489,2026-04-28 15:43:33.073586,0 days 00:02:11.424097,0.20905677601282102,block_12,1024,6.620120739564772e-05,cosine,0.013535802443410091,1024,8,10,adam,1.049634451834613e-06,COMPLETE
219,0.7416391275611368,2026-04-28 15:43:33.210903,2026-04-28 15:45:50.861618,0 days 00:02:17.650715,0.4460751883077849,block_12,1024,5.5619995341905695e-05,cosine,0.006926393476946083,1024,8,12,adam,2.7288785771800232e-06,COMPLETE
220,0.6405651024454726,2026-04-28 15:45:50.997329,2026-04-28 15:46:16.405524,0 days 00:00:25.408195,0.20815169216051646,pre_proj,1024,0.00023223293295563082,cosine,0.05621994861352858,512,32,6,adam,6.024911053928454e-06,PRUNED
221,0.752247191011236,2026-04-28 15:46:16.559994,2026-04-28 15:48:36.375496,0 days 00:02:19.815502,0.3006504584814896,block_12,1024,7.301750623265774e-05,cosine,0.01917564690094669,1024,32,10,adam,2.0126920542742947e-06,COMPLETE
222,0.7460178453403832,2026-04-28 15:48:36.509690,2026-04-28 15:51:08.914233,0 days 00:02:32.404543,0.32469866042175477,block_12,1024,4.551327763316263e-05,cosine,0.07833737565002277,512,8,12,adamw,8.72785863194513e-06,COMPLETE
223,0.6751321877065432,2026-04-28 15:51:09.053309,2026-04-28 15:51:35.206845,0 days 00:00:26.153536,0.3595368524990759,pre_proj,1024,4.305780381442873e-05,cosine,0.10086002916447516,512,8,10,adamw,4.0451503959623925e-06,PRUNED
224,0.727775941837409,2026-04-28 15:51:35.366500,2026-04-28 15:53:46.855710,0 days 00:02:11.489210,0.2714410068298537,block_12,1024,7.558057117367345e-05,cosine,0.09880481082850047,512,8,10,adamw,0.0001539686598288175,COMPLETE
225,0.7450925313945802,2026-04-28 15:53:46.992625,2026-04-28 15:56:09.579865,0 days 00:02:22.587240,0.3207360744466433,block_12,1024,9.523299020113028e-05,cosine,0.044684088114464615,1024,32,10,adam,1.5072660898085974e-06,COMPLETE
226,0.7393258426966292,2026-04-28 15:56:09.737459,2026-04-28 15:58:21.392503,0 days 00:02:11.655044,0.23917898934374388,block_12,1024,8.95671211717771e-05,cosine,0.00409031213945946,1024,8,9,adam,1.829397880241978e-06,COMPLETE
227,0.731361533377396,2026-04-28 15:58:21.529739,2026-04-28 16:00:43.418604,0 days 00:02:21.888865,0.3816105715802081,block_12,1024,0.00013356116637601762,cosine,0.08152939690460137,512,32,10,adam,1.3109998838084457e-05,COMPLETE
228,0.7585095836087243,2026-04-28 16:00:43.557226,2026-04-28 16:01:14.322416,0 days 00:00:30.765190,0.4615724509702702,block_12,1024,2.888317112240635e-05,cosine,0.06250754646019363,512,8,10,adamw,2.641897581130462e-06,PRUNED
229,0.6483807005948448,2026-04-28 16:01:14.472944,2026-04-28 16:01:40.756898,0 days 00:00:26.283954,0.41881046917415216,pre_proj,1024,0.00016971777938689357,cosine,0.08414396712121278,1024,8,9,adam,1.2164978123654899e-05,PRUNED
230,0.7416391275611368,2026-04-28 16:01:40.912659,2026-04-28 16:04:06.516531,0 days 00:02:25.603872,0.25877019903565135,block_12,1024,5.513799909933374e-05,cosine,0.11192968286398572,512,8,13,adamw,2.0498297502640146e-06,COMPLETE
231,0.7610872438863185,2026-04-28 16:04:06.655769,2026-04-28 16:04:42.627846,0 days 00:00:35.972077,0.38769081178662423,block_12,1024,4.132297530637107e-05,cosine,0.050804452282274426,1024,32,12,adam,3.829842874269981e-06,PRUNED
232,0.7221744877726373,2026-04-28 16:04:42.788492,2026-04-28 16:06:52.674455,0 days 00:02:09.885963,0.4159044599929934,block_12,1024,0.0001950136282038168,cosine,0.2801405203781393,1024,32,6,adam,0.0007086968723633067,COMPLETE
233,0.7467283542630535,2026-04-28 16:06:52.830411,2026-04-28 16:07:18.962770,0 days 00:00:26.132359,0.21195141703142475,block_12,1024,2.593196555673656e-05,cosine,0.037984863595331785,512,2,8,adam,1.0555591277156085e-05,PRUNED
234,0.7425644415069397,2026-04-28 16:07:19.125674,2026-04-28 16:09:39.500588,0 days 00:02:20.374914,0.4125608998256611,block_12,1024,7.815572862636543e-05,cosine,0.1531540030325092,2048,8,12,adamw,1.84791483773576e-05,COMPLETE
235,0.7603602115003305,2026-04-28 16:09:39.642660,2026-04-28 16:10:14.530118,0 days 00:00:34.887458,0.3735868412145412,block_12,1024,5.6181614545836125e-05,cosine,0.08642441173634154,512,8,14,adamw,0.00012935572565330445,PRUNED
236,0.7360541969596828,2026-04-28 16:10:14.696702,2026-04-28 16:12:28.082842,0 days 00:02:13.386140,0.29349683798856285,block_12,1024,0.0001278202078594496,cosine,0.06342360412876946,1024,16,10,adamw,1.7931494047817761e-06,COMPLETE
237,0.7538664904163912,2026-04-28 16:12:28.223615,2026-04-28 16:14:43.654210,0 days 00:02:15.430595,0.2565689500269649,block_12,1024,8.440503276859876e-05,cosine,0.03858979938097555,1024,32,9,adam,1.1972394490473688e-06,COMPLETE
238,0.7544282881692004,2026-04-28 16:14:43.790602,2026-04-28 16:17:05.288642,0 days 00:02:21.498040,0.3047035007502723,block_12,1024,0.00010156951693006511,cosine,0.08612131310420729,1024,32,10,adam,1.5288844519375432e-06,COMPLETE
239,0.7480667547918043,2026-04-28 16:17:05.435242,2026-04-28 16:19:17.519165,0 days 00:02:12.083923,0.3391769173760894,block_12,1024,9.375016516765026e-05,cosine,0.028152427957037443,1024,32,9,adam,1.4894873329619034e-06,COMPLETE
240,0.7452247191011236,2026-04-28 16:19:17.635547,2026-04-28 16:21:27.462921,0 days 00:02:09.827374,0.3093390253799271,block_12,1024,6.199286854773764e-05,cosine,0.07523061707459987,1024,32,9,adam,3.351483516854479e-06,COMPLETE
241,0.7288169200264376,2026-04-28 16:21:27.579562,2026-04-28 16:23:31.754216,0 days 00:02:04.174654,0.5446444433510508,block_12,1024,0.00017033899778195666,cosine,0.011618956319934162,1024,16,7,adam,2.754815944248083e-06,COMPLETE
242,0.7484963648380701,2026-04-28 16:23:31.883655,2026-04-28 16:25:47.364310,0 days 00:02:15.480655,0.34848495137222124,block_12,1024,6.457246186505764e-05,cosine,0.020338068706468107,1024,32,10,adam,1.373440996576675e-06,COMPLETE
243,0.7433906146728353,2026-04-28 16:25:47.488779,2026-04-28 16:28:03.109669,0 days 00:02:15.620890,0.2640198499489942,block_12,1024,8.387657210902634e-05,cosine,0.06574370422465857,1024,32,10,adam,1.8162752667422441e-06,COMPLETE
244,0.7484633179114342,2026-04-28 16:28:03.234135,2026-04-28 16:30:13.290839,0 days 00:02:10.056704,0.3701927050141799,block_12,1024,9.309356481157372e-05,cosine,0.10023515374773555,1024,32,9,adam,1.1541950069471546e-05,COMPLETE
245,0.7452081956378057,2026-04-28 16:30:13.418533,2026-04-28 16:32:23.315691,0 days 00:02:09.897158,0.3663691943082312,block_12,1024,7.900044240435827e-05,cosine,0.08273680424267875,1024,32,9,adam,2.733161603361249e-06,COMPLETE
246,0.730403172504957,2026-04-28 16:32:23.436707,2026-04-28 16:34:28.764519,0 days 00:02:05.327812,0.3783179919023727,block_12,1024,4.975695779131396e-05,cosine,0.08049026088171803,1024,32,7,adam,2.2980914864228343e-05,COMPLETE
247,0.744398545935228,2026-04-28 16:34:28.893163,2026-04-28 16:36:38.881506,0 days 00:02:09.988343,0.43982336933252464,block_12,1024,8.170961470783491e-05,cosine,0.05263450914508576,1024,32,9,adam,1.6114850427401164e-05,COMPLETE
248,0.7490085922009254,2026-04-28 16:36:39.003450,2026-04-28 16:38:54.521755,0 days 00:02:15.518305,0.2104936766792275,block_12,1024,0.00012865218008518373,cosine,0.02918177907542962,1024,32,10,adamw,2.121767969557109e-05,COMPLETE
249,0.7254461335095836,2026-04-28 16:38:54.649615,2026-04-28 16:41:01.752517,0 days 00:02:07.102902,0.26436707738155923,block_12,1024,7.569858935840913e-05,cosine,0.008704396949972833,512,8,10,adam,1.865207742331972e-06,COMPLETE
