number,value,datetime_start,datetime_complete,duration,params_gru_dropout,params_gru_num_layers,params_hidden_dim,params_lr,params_lr_scheduler,params_mlp_dropout,params_mlp_hidden_dim,params_optimizer_type,params_warmup_epochs,params_weight_decay,system_attrs_completed_rung_0,system_attrs_completed_rung_1,system_attrs_completed_rung_2,system_attrs_completed_rung_3,state
86,0.8471683673469388,2026-04-20 22:35:52.591696,2026-04-20 22:36:21.852235,0 days 00:00:29.260539,0.21299735063020764,2,512,1.865602988886221e-05,constant,0.2976934751884023,512,adam,,1.3397842633599096e-06,0.8471683673469388,,,,PRUNED
87,0.45973852040816326,2026-04-20 22:36:21.975360,2026-04-20 22:36:30.174195,0 days 00:00:08.198835,0.5076093363913572,4,1024,0.004443501574538886,constant,0.4145077288825718,256,adamw,,1.3621474017563334e-05,0.45973852040816326,,,,PRUNED
88,0.9348086734693878,2026-04-20 22:36:30.331798,2026-04-20 22:37:25.756755,0 days 00:00:55.424957,0.4780815942593216,2,2048,0.00043908530614247544,cosine,0.49176345463143856,256,adam,,1.6692336009775927e-06,0.9352040816326531,0.9348086734693878,,,PRUNED
89,0.9326275510204082,2026-04-20 22:37:25.945725,2026-04-20 22:39:57.464696,0 days 00:02:31.518971,0.5494327826083851,2,2048,0.0012036427402928442,cosine_warmup,0.39888090491287215,128,adamw,4.0,1.2575660840645194e-06,0.9326275510204082,,,,PRUNED
90,0.92375,2026-04-20 22:39:57.660099,2026-04-20 22:41:41.640934,0 days 00:01:43.980835,0.4249826451416463,4,2048,1.7805132966208847e-05,constant,0.1807587092585904,512,adam,,3.8048992126174573e-06,0.92375,,,,PRUNED
91,0.9135586734693877,2026-04-20 22:41:41.912078,2026-04-20 22:42:04.945049,0 days 00:00:23.032971,0.02898600159631995,2,2048,0.001198913647858661,constant,0.11216571815641802,1024,adam,,2.4201529668888632e-06,0.8340816326530613,0.9135586734693877,,,PRUNED
92,0.790076530612245,2026-04-20 22:42:05.122244,2026-04-20 22:42:12.054358,0 days 00:00:06.932114,0.5363629608775968,3,1024,3.532373678454693e-05,cosine,0.5260515947817112,256,adam,,8.7006309994726e-06,0.790076530612245,,,,PRUNED
93,0.9089285714285714,2026-04-20 22:42:12.182079,2026-04-20 22:42:55.141681,0 days 00:00:42.959602,0.5220209337125871,4,2048,6.473234517057556e-05,constant,0.5130467377627461,128,adamw,,1.5049078828533027e-06,0.9089285714285714,,,,PRUNED
94,0.9312882653061224,2026-04-20 22:42:55.424568,2026-04-20 22:44:38.912704,0 days 00:01:43.488136,0.33743145872995395,4,2048,6.289824211743494e-05,constant,0.10365642273391504,1024,adamw,,2.322342995612294e-06,0.9312882653061224,,,,PRUNED
95,0.9125765306122449,2026-04-20 22:44:39.186093,2026-04-20 22:44:51.247427,0 days 00:00:12.061334,0.5647266959682443,3,128,0.0027690591271009013,cosine,0.2769588732170607,128,adam,,3.353158161391895e-06,0.8980102040816327,0.9125765306122449,,,PRUNED
96,0.7907653061224491,2026-04-20 22:44:51.381571,2026-04-20 22:45:06.943135,0 days 00:00:15.561564,0.44441900667512996,4,1024,1.1292649774140773e-05,cosine,0.3912461277317661,256,adamw,,2.634154394575708e-06,0.7907653061224491,,,,PRUNED
97,0.8255102040816327,2026-04-20 22:45:07.081143,2026-04-20 22:45:30.102987,0 days 00:00:23.021844,0.5717968569397798,4,2048,0.00025677624609616554,constant,0.5877406573314959,1024,adamw,,1.345657663686416e-06,0.8255102040816327,,,,PRUNED
98,0.9085076530612245,2026-04-20 22:45:30.372639,2026-04-20 22:45:42.493991,0 days 00:00:12.121352,0.527808399905385,4,256,0.00027189615936477044,constant,0.545809242792718,256,adamw,,1.2357276865913628e-06,0.9085076530612245,,,,PRUNED
99,0.9338903061224489,2026-04-20 22:45:42.608292,2026-04-20 22:47:25.825909,0 days 00:01:43.217617,0.5748069966616329,4,2048,6.815430549399466e-05,constant,0.32770870745040026,256,adamw,,4.58468137539536e-06,0.9207142857142857,0.9338903061224489,,,PRUNED
100,0.9160204081632654,2026-04-20 22:47:26.095349,2026-04-20 22:47:37.953861,0 days 00:00:11.858512,0.17025432764510925,3,256,0.0009220441333704709,cosine,0.15538481061749918,512,adam,,7.0538086837635955e-06,0.8723979591836736,0.9160204081632654,,,PRUNED
101,0.8980357142857144,2026-04-20 22:47:38.076002,2026-04-20 22:48:08.232985,0 days 00:00:30.156983,0.4777494859906004,2,1024,2.8396920762397944e-05,cosine_warmup,0.598540615867205,256,adam,8.0,6.623707128069091e-06,0.8980357142857144,,,,PRUNED
102,0.5523788265306122,2026-04-20 22:48:08.360434,2026-04-20 22:48:20.382342,0 days 00:00:12.021908,0.531148767967178,1,1024,1.3836062353249055e-05,cosine_warmup,0.5505547199836156,128,adamw,4.0,0.00017976259174987854,0.5523788265306122,,,,PRUNED
103,0.8025255102040816,2026-04-20 22:48:20.504982,2026-04-20 22:48:43.675979,0 days 00:00:23.170997,0.2576050836517834,4,2048,2.0885682143095398e-05,cosine,0.14438745959026028,1024,adam,,3.4625018629969384e-06,0.8025255102040816,,,,PRUNED
104,0.5817219387755102,2026-04-20 22:48:43.944003,2026-04-20 22:48:50.281704,0 days 00:00:06.337701,0.484407407244978,1,1024,9.701265777151923e-05,cosine_warmup,0.44145681760718736,128,adam,3.0,3.853052384695887e-05,0.5817219387755102,,,,PRUNED
105,0.9184183673469388,2026-04-20 22:48:50.416744,2026-04-20 22:49:19.761073,0 days 00:00:29.344329,0.5804750786933071,1,1024,7.770543576127943e-05,cosine_warmup,0.5597229854949871,128,adam,5.0,3.6839578375837125e-06,0.9184183673469388,,,,PRUNED
106,0.7446683673469388,2026-04-20 22:49:19.897181,2026-04-20 22:49:26.915971,0 days 00:00:07.018790,0.3851134705281047,3,1024,1.2994089331062028e-05,cosine,0.46529723783585963,1024,adam,,1.9505068189915767e-06,0.7446683673469388,,,,PRUNED
107,0.9107270408163265,2026-04-20 22:49:27.060636,2026-04-20 22:50:10.591531,0 days 00:00:43.530895,0.5866185673117023,4,2048,7.360907660990227e-05,cosine,0.4963252660417256,1024,adam,,1.2865554215663991e-06,0.9107270408163265,,,,PRUNED
108,0.817857142857143,2026-04-20 22:50:10.871479,2026-04-20 22:50:23.077214,0 days 00:00:12.205735,0.5067731675716487,3,512,3.5980429686124475e-05,cosine,0.37380991785068907,256,adam,,3.4739850026779907e-06,0.817857142857143,,,,PRUNED
109,0.8281505102040816,2026-04-20 22:50:23.200395,2026-04-20 22:50:52.178839,0 days 00:00:28.978444,0.5703928847356908,1,128,6.399028004969782e-05,cosine_warmup,0.4701819646864063,512,adam,5.0,2.3073526276981877e-05,0.8281505102040816,,,,PRUNED
110,0.9364413265306123,2026-04-20 22:50:52.301357,2026-04-20 22:51:21.468876,0 days 00:00:29.167519,0.10958412754815759,2,512,0.0005786744210212416,constant,0.2741788739178706,512,adam,,1.8138551017276693e-05,0.8953698979591836,0.9237117346938776,0.9364413265306123,,PRUNED
111,0.5152742346938775,2026-04-20 22:51:21.596160,2026-04-20 22:51:59.258212,0 days 00:00:37.662052,0.49987697179709417,4,1024,0.0019657206496330164,cosine,0.4175977721688819,128,adam,,2.2995285802407213e-06,0.5152742346938775,,,,PRUNED
112,0.5959119897959184,2026-04-20 22:51:59.404801,2026-04-20 22:52:05.542900,0 days 00:00:06.138099,0.08797623041760735,4,256,0.005187200578002165,constant,0.11360384625161754,512,adam,,0.0007530767070166535,0.5959119897959184,,,,PRUNED
113,0.5,2026-04-20 22:52:05.672286,2026-04-20 22:52:28.865434,0 days 00:00:23.193148,0.08535002872417581,4,2048,0.004474023692544375,cosine_warmup,0.1695484214318192,1024,adam,3.0,1.8507875647432114e-05,0.5,,,,PRUNED
114,0.9135969387755103,2026-04-20 22:52:29.164609,2026-04-20 22:53:12.486468,0 days 00:00:43.321859,0.21309761740363437,4,2048,0.00028450247094375004,constant,0.1368272600607104,512,adam,,0.0002040080375254405,0.8805867346938775,0.9135969387755103,,,PRUNED
115,0.5110140306122449,2026-04-20 22:53:12.758577,2026-04-20 22:54:56.576804,0 days 00:01:43.818227,0.20288344631972655,4,2048,0.004077969243953427,constant,0.24117500630042285,512,adam,,0.0012742036724857435,0.5110140306122449,,,,PRUNED
116,0.5547576530612245,2026-04-20 22:54:56.846635,2026-04-20 22:55:19.996319,0 days 00:00:23.149684,0.08261639109539443,4,2048,0.000930238141987784,constant,0.2910100590412061,512,adam,,0.00011846511295260252,0.5547576530612245,,,,PRUNED
117,0.8128571428571428,2026-04-20 22:55:20.269451,2026-04-20 22:55:32.409234,0 days 00:00:12.139783,0.1498255823549402,3,512,0.000132539261281119,cosine_warmup,0.1311918074102911,256,adam,6.0,1.3811261840241766e-06,0.8128571428571428,,,,PRUNED
118,0.8180739795918368,2026-04-20 22:55:32.543848,2026-04-20 22:56:16.048919,0 days 00:00:43.505071,0.4208507210053568,4,2048,1.6218496423540607e-05,constant,0.11960284705336571,1024,adam,,4.5980508886146327e-05,0.8180739795918368,,,,PRUNED
119,0.47066964285714286,2026-04-20 22:56:16.318528,2026-04-20 22:58:00.195400,0 days 00:01:43.876872,0.07721999236079055,4,2048,0.0018642040597159116,cosine_warmup,0.10359980202624208,512,adam,4.0,0.0007716788048637431,0.47066964285714286,,,,PRUNED
120,0.5773341836734693,2026-04-20 22:58:00.475043,2026-04-20 22:58:12.097029,0 days 00:00:11.621986,0.47432847298181974,1,256,0.00010223867190513101,cosine_warmup,0.5744506370246535,128,adam,7.0,0.00029337961492213667,0.5773341836734693,,,,PRUNED
121,0.9328826530612244,2026-04-20 22:58:12.234965,2026-04-20 22:58:41.362413,0 days 00:00:29.127448,0.32250629517918034,3,256,0.0004520083738019425,constant,0.2296216892838995,512,adam,,1.0316321535628772e-06,0.9169005102040817,0.9328826530612244,,,PRUNED
122,0.5178188775510204,2026-04-20 22:58:41.499234,2026-04-20 22:58:59.018305,0 days 00:00:17.519071,0.4500845840672981,3,2048,0.007216667387070139,constant,0.5697394814391389,256,adamw,,1.2038691239563745e-06,0.5178188775510204,,,,PRUNED
123,0.9439030612244897,2026-04-20 22:58:59.251021,2026-04-20 23:01:30.977669,0 days 00:02:31.726648,0.5180519582953785,2,2048,9.511322534185268e-05,constant,0.5056567137523353,256,adamw,,5.210064966886982e-06,0.9439030612244897,,,,PRUNED
124,0.9084311224489796,2026-04-20 23:01:31.161238,2026-04-20 23:02:14.502500,0 days 00:00:43.341262,0.10684581338734848,4,2048,0.00011162643704020965,constant,0.14797584563472882,128,adam,,3.939817459875382e-05,0.8538775510204082,0.9084311224489796,,,PRUNED
125,0.8125701530612245,2026-04-20 23:02:14.787432,2026-04-20 23:02:20.937609,0 days 00:00:06.150177,0.1023371215348535,3,512,8.460730397627555e-05,cosine,0.1624657914543041,512,adam,,1.0827030204879697e-06,0.8125701530612245,,,,PRUNED
126,0.5857334183673469,2026-04-20 23:02:21.073161,2026-04-20 23:02:27.170241,0 days 00:00:06.097080,0.4572087255941743,1,1024,1.591454789276544e-05,cosine,0.5232964182860559,128,adam,,7.2799233116522585e-06,0.5857334183673469,,,,PRUNED
127,0.5641454081632653,2026-04-20 23:02:27.307852,2026-04-20 23:02:33.377948,0 days 00:00:06.070096,0.46258629105520244,1,512,2.956895935509545e-05,cosine_warmup,0.5934847562271666,128,adam,5.0,1.1833942467498578e-05,0.5641454081632653,,,,PRUNED
128,0.6307015306122449,2026-04-20 23:02:33.507917,2026-04-20 23:02:45.409340,0 days 00:00:11.901423,0.526675064123697,1,1024,1.2102875533125338e-05,cosine_warmup,0.5912986761743518,1024,adam,3.0,2.6635367691516928e-05,0.6307015306122449,,,,PRUNED
129,0.885625,2026-04-20 23:02:45.531629,2026-04-20 23:02:57.399068,0 days 00:00:11.867439,0.0930078917225584,2,256,0.0006156791485392378,cosine_warmup,0.10059193589016593,1024,adam,7.0,3.061007729090539e-06,0.885625,,,,PRUNED
130,0.9181760204081633,2026-04-20 23:02:57.521504,2026-04-20 23:03:40.579321,0 days 00:00:43.057817,0.541751685833099,4,2048,0.00037565231178164377,constant,0.5122775718364113,256,adamw,,2.76855006968377e-06,0.868329081632653,0.9181760204081633,,,PRUNED
131,0.5111288265306122,2026-04-20 23:03:40.857220,2026-04-20 23:05:00.176811,0 days 00:01:19.319591,0.5612935648430769,3,2048,0.0020837829233286945,cosine,0.4073498910948008,128,adam,,1.5825941341011817e-06,0.5111288265306122,,,,PRUNED
132,0.5011415816326531,2026-04-20 23:05:00.407049,2026-04-20 23:05:06.596339,0 days 00:00:06.189290,0.5938749863047318,1,1024,2.112774943088847e-05,cosine_warmup,0.5812588363111063,128,adam,5.0,0.0004889261846103655,0.5011415816326531,,,,PRUNED
133,0.7141964285714285,2026-04-20 23:05:06.722512,2026-04-20 23:05:12.914797,0 days 00:00:06.192285,0.23341486295556046,3,512,0.0016043679831968193,constant,0.211724241422238,512,adamw,,4.0627508115435265e-06,0.7141964285714285,,,,PRUNED
134,0.9393622448979592,2026-04-20 23:05:13.029378,2026-04-20 23:06:34.208367,0 days 00:01:21.178989,0.16989961494160705,3,256,0.0009119394946270201,constant,0.12730254740742733,256,adam,,7.446579384848601e-06,0.9393622448979592,,,,PRUNED
135,0.4993622448979592,2026-04-20 23:06:34.339680,2026-04-20 23:06:46.266043,0 days 00:00:11.926363,0.16328524478387596,4,512,0.004220998101469525,constant,0.34234313296682645,512,adamw,,0.00016504138205387483,0.4993622448979592,,,,PRUNED
136,0.9461989795918367,2026-04-20 23:06:46.405555,2026-04-20 23:08:43.987524,0 days 00:01:57.581969,0.14343942556081346,3,512,0.0003342729042253932,constant,0.1704298644383052,512,adamw,,0.0001291308719715349,0.8892474489795918,0.9263137755102041,0.9401913265306122,0.9518622448979592,COMPLETE
137,0.9338775510204081,2026-04-20 23:08:44.130560,2026-04-20 23:09:13.445427,0 days 00:00:29.314867,0.07846851830512805,2,128,0.0005506114802494203,constant,0.17808609377261148,512,adamw,,6.684478714607773e-05,0.914311224489796,0.9338775510204081,,,PRUNED
138,0.9182397959183674,2026-04-20 23:09:13.568588,2026-04-20 23:09:46.377273,0 days 00:00:32.808685,0.5820127036253273,3,2048,0.0003800692413944606,cosine,0.5800364875444801,128,adamw,,4.689177044185746e-06,0.9027295918367346,0.9182397959183674,,,PRUNED
139,0.46883928571428574,2026-04-20 23:09:46.599753,2026-04-20 23:10:09.639653,0 days 00:00:23.039900,0.01723330931237875,4,2048,0.0018760023833104434,constant,0.23603320148626333,256,adam,,0.0014342912775738308,0.46883928571428574,,,,PRUNED
140,0.6845089285714285,2026-04-20 23:10:09.928354,2026-04-20 23:10:16.794400,0 days 00:00:06.866046,0.46607277477093,3,1024,1.2008046121041808e-05,constant,0.41780720416971484,256,adam,,4.6275709202364485e-05,0.6845089285714285,,,,PRUNED
141,0.9497704081632653,2026-04-20 23:10:16.934906,2026-04-20 23:11:37.600562,0 days 00:01:20.665656,0.2076849030801351,3,512,0.00012344408383287622,constant,0.2335861710339645,512,adamw,,4.471865385560653e-05,0.9167729591836735,0.9385969387755102,0.9497704081632653,,PRUNED
142,0.9062500000000001,2026-04-20 23:11:37.729078,2026-04-20 23:11:50.929022,0 days 00:00:13.199944,0.5538846543791182,3,1024,0.0008343947247813113,cosine,0.3196633851452364,256,adam,,2.87637525080681e-06,0.9062500000000001,,,,PRUNED
143,0.8182780612244898,2026-04-20 23:11:51.055938,2026-04-20 23:11:57.389820,0 days 00:00:06.333882,0.27175438000054014,3,512,9.430086698872375e-05,constant,0.2104178175232515,512,adamw,,5.539853593766348e-05,0.8182780612244898,,,,PRUNED
144,0.9351785714285714,2026-04-20 23:11:57.518535,2026-04-20 23:13:16.789844,0 days 00:01:19.271309,0.580282465822371,3,2048,0.0001331823899783379,cosine,0.33802954680622893,256,adam,,1.418703189913822e-05,0.922640306122449,0.9351785714285714,,,PRUNED
145,0.9399744897959185,2026-04-20 23:13:17.022498,2026-04-20 23:13:46.178162,0 days 00:00:29.155664,0.1550952941923984,3,512,0.00022771028545484875,constant,0.16908401796742495,512,adam,,2.1003095796527377e-06,0.8725765306122448,0.923954081632653,0.9399744897959185,,PRUNED
146,0.9336224489795919,2026-04-20 23:13:46.301965,2026-04-20 23:15:05.767145,0 days 00:01:19.465180,0.41987195758731954,3,2048,9.789064875315528e-05,cosine,0.4958804390918878,256,adam,,1.2550774255092546e-06,0.8835076530612246,0.9244260204081632,0.9336224489795919,,PRUNED
147,0.757780612244898,2026-04-20 23:15:05.990639,2026-04-20 23:15:48.942364,0 days 00:00:42.951725,0.47429622190383725,4,2048,0.0011626678268082068,cosine_warmup,0.44804477607616544,256,adamw,5.0,1.110207980959526e-06,0.757780612244898,,,,PRUNED
148,0.9480612244897959,2026-04-20 23:15:49.213351,2026-04-20 23:17:46.602506,0 days 00:01:57.389155,0.19742194295047186,3,512,0.00022098626634907734,constant,0.1882242912211696,512,adamw,,0.0013827691758583319,0.9201785714285714,0.9395280612244897,0.9509948979591836,,COMPLETE
149,0.7979209183673469,2026-04-20 23:17:46.717924,2026-04-20 23:17:58.784536,0 days 00:00:12.066612,0.15001398494888096,3,512,2.7258356678767904e-05,constant,0.24943438490712352,512,adamw,,0.007497281050765045,0.7979209183673469,,,,PRUNED
150,0.9485331632653061,2026-04-20 23:17:58.924445,2026-04-20 23:19:56.843828,0 days 00:01:57.919383,0.23209181920096755,3,512,0.0004169380806113976,constant,0.18258557197220193,512,adamw,,0.00439308675495788,0.9280357142857143,0.9398214285714286,0.9511479591836736,,COMPLETE
151,0.9491326530612245,2026-04-20 23:19:56.985026,2026-04-20 23:21:53.951415,0 days 00:01:56.966389,0.37551445497553426,3,512,0.0006761252395217747,constant,0.16016487565852133,512,adamw,,0.002481570037787623,0.9288775510204081,0.9405867346938775,0.9514795918367347,,COMPLETE
152,0.95,2026-04-20 23:21:54.078016,2026-04-20 23:23:15.276265,0 days 00:01:21.198249,0.25940824205584734,3,512,0.0006059291124689628,constant,0.11411560434867868,512,adamw,,0.0079859663116751,0.8891454081632653,0.9274107142857142,0.940829081632653,0.95,PRUNED
153,0.7159821428571429,2026-04-20 23:23:15.408961,2026-04-20 23:23:21.549560,0 days 00:00:06.140599,0.4333007230082419,4,256,5.1983772739278144e-05,cosine,0.4553295581126147,512,adam,,3.5713924652154232e-06,0.7159821428571429,,,,PRUNED
154,0.913954081632653,2026-04-20 23:23:21.676495,2026-04-20 23:23:33.870469,0 days 00:00:12.193974,0.27956857941794033,3,512,0.0009280844950194757,cosine,0.1837882128613054,512,adamw,,0.004336838360330558,0.913954081632653,,,,PRUNED
155,0.9357015306122449,2026-04-20 23:23:33.999883,2026-04-20 23:24:02.996040,0 days 00:00:28.996157,0.5545462688986901,2,512,0.0006096471327005703,constant,0.12634842505256802,512,adamw,,0.0034728920236354334,0.9022704081632653,0.9228061224489795,0.9357015306122449,,PRUNED
156,0.7160076530612245,2026-04-20 23:24:03.128755,2026-04-20 23:24:09.336369,0 days 00:00:06.207614,0.11990657757513129,3,512,0.0006014173720813638,constant,0.2591992796373448,512,adam,,0.0068517557536920655,0.7160076530612245,,,,PRUNED
157,0.9300510204081633,2026-04-20 23:24:09.472505,2026-04-20 23:24:38.630828,0 days 00:00:29.158323,0.2648097901504266,4,512,0.00016625360812971886,constant,0.13131711850018482,1024,adamw,,0.0005351685096993324,0.916454081632653,0.9300510204081633,,,PRUNED
158,0.6734630102040816,2026-04-20 23:24:38.753875,2026-04-20 23:24:50.653359,0 days 00:00:11.899484,0.10476541519518272,3,256,0.0001014780248034585,cosine_warmup,0.16649605953508056,512,adamw,10.0,0.0015127792477166056,0.6734630102040816,,,,PRUNED
159,0.9126020408163266,2026-04-20 23:24:50.783790,2026-04-20 23:25:02.624325,0 days 00:00:11.840535,0.26897472975619546,4,128,0.0011838276872273127,constant,0.13593760749846137,512,adamw,,0.0008352064499637785,0.9126020408163266,,,,PRUNED
160,0.9071045918367346,2026-04-20 23:25:02.753916,2026-04-20 23:25:14.786765,0 days 00:00:12.032849,0.43966225199778697,4,512,0.00011563765455060297,constant,0.2431460971304728,512,adamw,,0.005743333382717029,0.9071045918367346,,,,PRUNED
161,0.9145025510204081,2026-04-20 23:25:14.913967,2026-04-20 23:25:26.757265,0 days 00:00:11.843298,0.08601458081947844,3,512,0.0009170511835444109,constant,0.1676635059392195,512,adamw,,0.00026456413770085913,0.8523979591836734,0.9145025510204081,,,PRUNED
162,0.9402933673469388,2026-04-20 23:25:26.886913,2026-04-20 23:26:47.796782,0 days 00:01:20.909869,0.349779252463261,3,256,0.0015455596881477818,constant,0.22199229314151173,512,adamw,,0.008250522008533188,0.9330867346938776,0.9402933673469388,,,PRUNED
163,0.8906505102040816,2026-04-20 23:26:47.920165,2026-04-20 23:27:03.348970,0 days 00:00:15.428805,0.1274357537407869,4,1024,0.0003699886316837159,constant,0.12728722233504192,512,adamw,,0.007883719494333257,0.8906505102040816,,,,PRUNED
164,0.9135714285714287,2026-04-20 23:27:03.491102,2026-04-20 23:27:15.406105,0 days 00:00:11.915003,0.2007006728573565,3,512,0.0005182622172277902,constant,0.2022554363521198,128,adamw,,0.0034177483748541724,0.9006122448979592,0.9135714285714287,,,PRUNED
165,0.9471938775510205,2026-04-20 23:27:15.528833,2026-04-20 23:29:13.222071,0 days 00:01:57.693238,0.274075764826236,3,512,0.00025177110749314625,constant,0.17552135964435164,512,adamw,,0.0019953237164070277,0.8796173469387756,0.9264413265306122,0.9406122448979591,0.9523214285714285,COMPLETE
166,0.5357015306122449,2026-04-20 23:29:13.351246,2026-04-20 23:29:19.577051,0 days 00:00:06.225805,0.4548946850967224,3,512,0.002172222463909261,constant,0.12565607440497495,256,adamw,,0.0005860669280723764,0.5357015306122449,,,,PRUNED
167,0.939234693877551,2026-04-20 23:29:19.704950,2026-04-20 23:29:48.786703,0 days 00:00:29.081753,0.2760534033612241,3,512,0.0005341656953345067,constant,0.26293805002864234,512,adamw,,0.0020034538145367754,0.8883163265306122,0.9271811224489797,0.939234693877551,,PRUNED
168,0.8104910714285715,2026-04-20 23:29:48.912957,2026-04-20 23:29:57.125897,0 days 00:00:08.212940,0.23940860877829095,4,1024,4.9396172953421434e-05,constant,0.1393203496286632,1024,adam,,6.023613939635119e-06,0.8104910714285715,,,,PRUNED
169,0.8341964285714286,2026-04-20 23:29:57.264544,2026-04-20 23:30:03.376486,0 days 00:00:06.111942,0.25347476345319436,1,512,0.00024994147726532616,constant,0.14951487123856913,512,adam,,1.293601931368746e-06,0.8341964285714286,,,,PRUNED
170,0.6349362244897959,2026-04-20 23:30:03.510803,2026-04-20 23:30:09.954489,0 days 00:00:06.443686,0.23553604530859018,2,1024,1.132274513019841e-05,cosine,0.4625632661113361,256,adam,,1.3208514658857643e-05,0.6349362244897959,,,,PRUNED
171,0.9382780612244898,2026-04-20 23:30:10.082538,2026-04-20 23:30:39.488576,0 days 00:00:29.406038,0.14936258650055903,3,256,0.002481683860015237,constant,0.14620409629020048,1024,adam,,2.368394084230547e-05,0.8948979591836735,0.924515306122449,0.9382780612244898,,PRUNED
172,0.9232015306122449,2026-04-20 23:30:39.618297,2026-04-20 23:30:51.731226,0 days 00:00:12.112929,0.39085725029875057,3,512,0.0011825017239698804,constant,0.17826350529881976,512,adamw,,0.00014291886089915867,0.8798086734693878,0.9232015306122449,,,PRUNED
