number,value,datetime_start,datetime_complete,duration,params_lr,params_lr_scheduler,params_mlp_dropout,params_mlp_hidden_dim,params_optimizer_type,params_warmup_epochs,params_weight_decay,state
0,0.9004081632653061,2026-04-20 17:54:48.602516,2026-04-20 17:55:43.661789,0 days 00:00:55.059273,0.001570297088405539,constant,0.5849549260809972,128,adam,,0.0002481040974867811,COMPLETE
1,0.5115561224489796,2026-04-20 17:55:43.811745,2026-04-20 17:56:39.467607,0 days 00:00:55.655862,3.511356313970405e-05,cosine,0.28318092164684583,256,adamw,,5.415244119402541e-06,COMPLETE
2,0.5412372448979591,2026-04-20 17:56:39.599708,2026-04-20 17:57:35.870142,0 days 00:00:56.270434,3.972110727381908e-05,cosine_warmup,0.2523068845866854,512,adam,4.0,0.00011400863701127338,COMPLETE
3,0.7075892857142857,2026-04-20 17:57:36.021277,2026-04-20 17:58:32.240544,0 days 00:00:56.219267,0.00020914981329035596,cosine_warmup,0.19242722776276353,128,adam,5.0,3.0771802712506896e-06,COMPLETE
4,0.9309948979591837,2026-04-20 17:58:32.370164,2026-04-20 17:59:29.814617,0 days 00:00:57.444453,0.006584106160121612,cosine,0.23567451588694796,1024,adamw,,0.003795853142670641,COMPLETE
5,0.5408290816326531,2026-04-20 17:59:29.969119,2026-04-20 18:00:27.558087,0 days 00:00:57.588968,6.963114377829287e-05,cosine,0.5077307142274171,128,adamw,,0.00014817820606039095,COMPLETE
6,0.9051147959183673,2026-04-20 18:00:27.694406,2026-04-20 18:01:25.900250,0 days 00:00:58.205844,0.0020597335357437196,cosine_warmup,0.464803089169032,128,adam,7.0,1.9777828512462715e-06,COMPLETE
7,0.7640051020408163,2026-04-20 18:01:26.029556,2026-04-20 18:02:24.314115,0 days 00:00:58.284559,0.00026100256506134784,cosine,0.1127095633720476,128,adam,,3.0086868214458464e-06,COMPLETE
8,0.8778826530612245,2026-04-20 18:02:24.464801,2026-04-20 18:03:22.522141,0 days 00:00:58.057340,0.0008113929572637835,cosine,0.24487572645688402,256,adamw,,1.808939009276714e-05,COMPLETE
9,0.9157397959183674,2026-04-20 18:03:22.676859,2026-04-20 18:04:20.712766,0 days 00:00:58.035907,0.002656813924114493,constant,0.2590017374859319,1024,adam,,0.000341676434183297,COMPLETE
10,0.8716454081632653,2026-04-20 18:04:20.843662,2026-04-20 18:05:18.864219,0 days 00:00:58.020557,0.00038453363484321294,cosine,0.19501868852682025,1024,adamw,,0.004485183570045473,COMPLETE
11,0.8279464285714286,2026-04-20 18:05:18.991824,2026-04-20 18:05:44.562875,0 days 00:00:25.571051,0.007501545386192258,constant,0.32510675623201524,1024,adam,,0.0009804076377313456,PRUNED
12,0.9306632653061225,2026-04-20 18:05:44.707049,2026-04-20 18:06:42.574654,0 days 00:00:57.867605,0.006762928557701394,cosine,0.2898475601191249,1024,adamw,,0.00034267659348601514,COMPLETE
13,0.9307015306122449,2026-04-20 18:06:42.711836,2026-04-20 18:07:40.609076,0 days 00:00:57.897240,0.00812606708699706,cosine,0.22409327087692915,1024,adamw,,0.00037512030361175374,COMPLETE
14,0.9290943877551021,2026-04-20 18:07:40.755429,2026-04-20 18:08:39.541284,0 days 00:00:58.785855,0.004859695720037243,cosine_warmup,0.15905662264683834,256,adamw,10.0,0.007216613104794144,COMPLETE
15,0.841798469387755,2026-04-20 18:08:39.666868,2026-04-20 18:09:05.892648,0 days 00:00:26.225780,0.0009014326924049989,cosine,0.4321166204051707,256,adamw,,0.0026878595184511686,PRUNED
16,0.9307270408163265,2026-04-20 18:09:06.067423,2026-04-20 18:10:05.193744,0 days 00:00:59.126321,0.005137041466218487,cosine,0.1292022574262472,1024,adamw,,0.0011300337480139354,COMPLETE
17,0.9324744897959184,2026-04-20 18:10:05.330041,2026-04-20 18:11:04.167408,0 days 00:00:58.837367,0.008285137024377864,constant,0.24206148547259299,128,adamw,,0.007378969386537013,COMPLETE
18,0.9326785714285715,2026-04-20 18:11:04.321026,2026-04-20 18:12:02.306726,0 days 00:00:57.985700,0.006433166825070861,constant,0.23819921999707663,128,adamw,,0.005994257482294393,COMPLETE
19,0.9238903061224489,2026-04-20 18:12:02.461929,2026-04-20 18:13:00.642369,0 days 00:00:58.180440,0.0020195417049152383,constant,0.2256086129887117,128,adamw,,0.009489276412537325,COMPLETE
20,0.9317602040816326,2026-04-20 18:13:00.791616,2026-04-20 18:13:59.359445,0 days 00:00:58.567829,0.009537783437806818,constant,0.42412037311304285,128,adamw,,0.0007791317398645572,COMPLETE
21,0.9315051020408163,2026-04-20 18:13:59.521530,2026-04-20 18:14:57.235817,0 days 00:00:57.714287,0.00487293663753352,constant,0.3812526440540989,512,adamw,,0.0032327870089807987,COMPLETE
22,0.9292091836734694,2026-04-20 18:14:57.389613,2026-04-20 18:15:55.184869,0 days 00:00:57.795256,0.003423323930391783,constant,0.32793339895308227,128,adamw,,0.00010289486972705555,COMPLETE
23,0.9219132653061224,2026-04-20 18:15:55.333418,2026-04-20 18:16:53.210530,0 days 00:00:57.877112,0.005355970158481824,cosine_warmup,0.288608127693565,128,adamw,3.0,0.007494923558533828,COMPLETE
24,0.9312372448979592,2026-04-20 18:16:53.334165,2026-04-20 18:17:50.750537,0 days 00:00:57.416372,0.006553408318602817,constant,0.4448094726558562,128,adamw,,0.003475783856703182,COMPLETE
25,0.9304464285714286,2026-04-20 18:17:50.903647,2026-04-20 18:18:48.303411,0 days 00:00:57.399764,0.007975910795240845,constant,0.27777138830143655,256,adamw,,0.0023435047051734667,COMPLETE
26,0.7665880102040816,2026-04-20 18:18:48.451799,2026-04-20 18:19:05.425190,0 days 00:00:16.973391,0.007875892378115848,constant,0.20542623614437372,128,adam,,0.004716818329215803,PRUNED
27,0.8396301020408165,2026-04-20 18:19:05.569375,2026-04-20 18:19:22.459198,0 days 00:00:16.889823,0.007910201206408394,cosine_warmup,0.5703716780213517,128,adamw,8.0,5.578410089115903e-05,PRUNED
28,0.9319387755102041,2026-04-20 18:19:22.582861,2026-04-20 18:20:20.002754,0 days 00:00:57.419893,0.0072524264177244,constant,0.21925249736890895,128,adamw,,0.0033839929152856144,COMPLETE
29,0.9313392857142857,2026-04-20 18:20:20.145857,2026-04-20 18:21:19.084744,0 days 00:00:58.938887,0.005047899726567762,constant,0.16956058087404455,512,adamw,,0.007355667269936873,COMPLETE
30,0.6015561224489796,2026-04-20 18:21:19.233394,2026-04-20 18:21:36.642742,0 days 00:00:17.409348,0.0005074093256675219,cosine_warmup,0.14982165268244454,128,adamw,6.0,0.0002772876600551746,PRUNED
31,0.9317219387755102,2026-04-20 18:21:36.811967,2026-04-20 18:22:36.115044,0 days 00:00:59.303077,0.008835628806886459,constant,0.2032198791580322,128,adamw,,0.007415686807502955,COMPLETE
32,0.8312117346938775,2026-04-20 18:22:36.255729,2026-04-20 18:22:53.323648,0 days 00:00:17.067919,0.004302132475223172,cosine,0.37617738248006505,128,adam,,0.000615638045869707,PRUNED
33,0.9328954081632653,2026-04-20 18:22:53.453517,2026-04-20 18:23:51.380567,0 days 00:00:57.927050,0.009908660160925068,constant,0.2690827624061046,1024,adamw,,0.006149425394433414,COMPLETE
34,0.9317729591836734,2026-04-20 18:23:51.521318,2026-04-20 18:24:49.623899,0 days 00:00:58.102581,0.0034721834977618857,constant,0.28726649314743435,1024,adamw,,0.003391717244743031,COMPLETE
35,0.9319387755102041,2026-04-20 18:24:49.757631,2026-04-20 18:25:47.895197,0 days 00:00:58.137566,0.007136622193842974,constant,0.16462443043787667,1024,adamw,,0.002235971260701517,COMPLETE
36,0.9320280612244898,2026-04-20 18:25:48.041733,2026-04-20 18:26:44.879156,0 days 00:00:56.837423,0.0062465978427213445,constant,0.27629159913817464,1024,adamw,,0.009889579194548935,COMPLETE
37,0.5093239795918367,2026-04-20 18:26:45.016418,2026-04-20 18:27:01.924622,0 days 00:00:16.908204,0.0001545538717098721,cosine_warmup,0.5032466219654865,1024,adamw,10.0,9.870680474904532e-06,PRUNED
38,0.8709693877551021,2026-04-20 18:27:02.062930,2026-04-20 18:27:19.184906,0 days 00:00:17.121976,0.006192355689801405,cosine_warmup,0.33302249739060086,1024,adamw,8.0,0.004071671581465443,PRUNED
39,0.5196173469387755,2026-04-20 18:27:19.322243,2026-04-20 18:27:36.311101,0 days 00:00:16.988858,5.082759599300451e-05,cosine_warmup,0.11463580148250962,1024,adam,5.0,0.00987984777622453,PRUNED
40,0.88375,2026-04-20 18:27:36.466107,2026-04-20 18:27:53.397745,0 days 00:00:16.931638,0.0014420241668958499,constant,0.26454778149099023,512,adam,,3.648926703896488e-06,PRUNED
41,0.9072448979591837,2026-04-20 18:27:53.579090,2026-04-20 18:28:16.168920,0 days 00:00:22.589830,0.004566127597317135,cosine,0.13172897125859673,128,adamw,,0.004530194183608469,PRUNED
42,0.7824234693877551,2026-04-20 18:28:16.306384,2026-04-20 18:28:33.130273,0 days 00:00:16.823889,0.007037441753172882,cosine_warmup,0.3437655097806547,512,adam,3.0,0.0024703442031214344,PRUNED
43,0.9324872448979592,2026-04-20 18:28:33.259439,2026-04-20 18:29:29.914339,0 days 00:00:56.654900,0.008115024471204789,constant,0.24989638324951474,128,adamw,,0.001726265639901644,COMPLETE
44,0.4951084183673469,2026-04-20 18:29:30.050006,2026-04-20 18:29:46.912581,0 days 00:00:16.862575,1.7073394032165065e-05,constant,0.28586101240332534,512,adam,,0.0014384221911587134,PRUNED
45,0.9323214285714286,2026-04-20 18:29:47.049628,2026-04-20 18:30:43.595641,0 days 00:00:56.546013,0.007116950082871963,constant,0.32074871825873535,1024,adamw,,0.008458226212587093,COMPLETE
46,0.9241454081632654,2026-04-20 18:30:43.717189,2026-04-20 18:31:19.826529,0 days 00:00:36.109340,0.0043871080637347265,constant,0.3813587997563783,1024,adamw,,0.0022724672788313515,PRUNED
47,0.8978188775510203,2026-04-20 18:31:19.973075,2026-04-20 18:31:36.776403,0 days 00:00:16.803328,0.0075122232046449765,cosine,0.35085227166088584,128,adamw,,0.004521452324584659,PRUNED
48,0.7315051020408164,2026-04-20 18:31:36.917021,2026-04-20 18:31:53.692219,0 days 00:00:16.775198,0.0018601928568243394,constant,0.30326289299118864,256,adam,,0.008940404354038204,PRUNED
49,0.6123724489795919,2026-04-20 18:31:53.831519,2026-04-20 18:32:10.571406,0 days 00:00:16.739887,0.00022491837168975843,constant,0.3597097321598482,128,adamw,,1.2008239911500194e-06,PRUNED
50,0.5997831632653061,2026-04-20 18:32:10.691548,2026-04-20 18:32:27.465916,0 days 00:00:16.774368,0.0004891573499431088,cosine_warmup,0.50578572941921,256,adam,7.0,0.0015553999615691328,PRUNED
51,0.898265306122449,2026-04-20 18:32:27.593205,2026-04-20 18:32:44.307468,0 days 00:00:16.714263,0.0029048542307303026,constant,0.36487227321147464,1024,adamw,,0.007283648181922613,PRUNED
52,0.9321045918367348,2026-04-20 18:32:44.439496,2026-04-20 18:33:40.474066,0 days 00:00:56.034570,0.005566324232847712,constant,0.2545989646556378,1024,adamw,,0.009660279313617388,COMPLETE
53,0.8858801020408162,2026-04-20 18:33:40.604407,2026-04-20 18:33:57.139323,0 days 00:00:16.534916,0.003160968654182714,constant,0.28729578936920963,128,adamw,,0.0013979668837324811,PRUNED
54,0.8984438775510205,2026-04-20 18:33:57.260337,2026-04-20 18:34:13.817551,0 days 00:00:16.557214,0.007081787034818006,constant,0.34485143282514086,128,adamw,,0.005157521061987341,PRUNED
55,0.8617857142857144,2026-04-20 18:34:13.942930,2026-04-20 18:34:30.560818,0 days 00:00:16.617888,0.0009028093484920564,constant,0.2138210939802591,1024,adamw,,0.009081037296639652,PRUNED
56,0.9319897959183674,2026-04-20 18:34:30.698120,2026-04-20 18:35:26.853242,0 days 00:00:56.155122,0.00737604551495155,constant,0.1465898788568521,128,adamw,,8.543785372654883e-05,COMPLETE
57,0.6696428571428572,2026-04-20 18:35:26.990359,2026-04-20 18:35:43.569409,0 days 00:00:16.579050,0.0018597209851948134,constant,0.2227363271683146,1024,adam,,0.008751188033997907,PRUNED
58,0.9024234693877551,2026-04-20 18:35:43.704521,2026-04-20 18:36:02.972844,0 days 00:00:19.268323,0.008392157995556673,cosine,0.3141989223153482,512,adamw,,0.007412118857301342,PRUNED
59,0.861390306122449,2026-04-20 18:36:03.089626,2026-04-20 18:36:19.653007,0 days 00:00:16.563381,0.00426364293370373,cosine_warmup,0.16148105883313055,512,adamw,9.0,0.0004963919589467966,PRUNED
60,0.9016836734693878,2026-04-20 18:36:19.798714,2026-04-20 18:36:39.223370,0 days 00:00:19.424656,0.008466580174007737,cosine,0.5322720171024579,512,adamw,,1.3476411457574796e-06,PRUNED
61,0.9250382653061224,2026-04-20 18:36:39.354802,2026-04-20 18:37:15.016475,0 days 00:00:35.661673,0.0071494196713248435,constant,0.32049635882400374,1024,adamw,,0.00799688010795411,PRUNED
62,0.9330102040816326,2026-04-20 18:37:15.152044,2026-04-20 18:38:11.539850,0 days 00:00:56.387806,0.0058170285931524995,constant,0.20596168345893295,1024,adamw,,0.007740509034289234,COMPLETE
63,0.48575892857142855,2026-04-20 18:38:11.686389,2026-04-20 18:38:28.243497,0 days 00:00:16.557108,1.0431500397049325e-05,cosine,0.3713782023300836,128,adam,,4.856457952639027e-05,PRUNED
64,0.48440051020408165,2026-04-20 18:38:28.397394,2026-04-20 18:38:45.039148,0 days 00:00:16.641754,1.3389695833897766e-05,constant,0.25246036910212855,1024,adamw,,0.002567654305811061,PRUNED
65,0.7975382653061225,2026-04-20 18:38:45.182701,2026-04-20 18:39:01.807594,0 days 00:00:16.624893,0.001701042642963305,cosine_warmup,0.305215619823099,256,adam,6.0,5.3648412468194194e-06,PRUNED
66,0.9017602040816326,2026-04-20 18:39:01.946485,2026-04-20 18:39:18.610247,0 days 00:00:16.663762,0.0027352745057703082,constant,0.12547786333047156,256,adamw,,0.004195197552363653,PRUNED
67,0.9324489795918368,2026-04-20 18:39:18.756161,2026-04-20 18:40:15.286630,0 days 00:00:56.530469,0.006439203964181953,constant,0.17344021039267168,1024,adamw,,0.008821967866575364,COMPLETE
68,0.6783418367346938,2026-04-20 18:40:15.413646,2026-04-20 18:40:32.000022,0 days 00:00:16.586376,0.0001288960866014196,constant,0.12748041819908057,1024,adamw,,4.8513247335948856e-05,PRUNED
69,0.9281250000000001,2026-04-20 18:40:32.119377,2026-04-20 18:41:28.538437,0 days 00:00:56.419060,0.006231575325254979,cosine,0.20391891841386917,256,adamw,,0.00440254220456861,COMPLETE
70,0.9305739795918366,2026-04-20 18:41:28.661663,2026-04-20 18:42:25.181775,0 days 00:00:56.520112,0.008169690010479212,cosine,0.4126693532672794,1024,adamw,,0.005319406346258286,COMPLETE
71,0.4848979591836735,2026-04-20 18:42:25.336066,2026-04-20 18:42:41.994525,0 days 00:00:16.658459,2.0846954835343784e-05,constant,0.4909601947386194,128,adamw,,0.0020280196213412964,PRUNED
72,0.9327678571428571,2026-04-20 18:42:42.125504,2026-04-20 18:43:38.612218,0 days 00:00:56.486714,0.006695619995545618,constant,0.17324936914186795,1024,adamw,,0.007652660847856949,COMPLETE
73,0.9324617346938775,2026-04-20 18:43:38.743122,2026-04-20 18:44:35.217721,0 days 00:00:56.474599,0.0033709798289351493,constant,0.1468435068353735,1024,adamw,,0.0057549281797524155,COMPLETE
74,0.714170918367347,2026-04-20 18:44:35.365319,2026-04-20 18:44:52.038871,0 days 00:00:16.673552,0.0007669134258651878,cosine_warmup,0.1262675365973989,1024,adamw,10.0,0.0069331836619408995,PRUNED
